Index,subreddit,post_time,user_name,title,text,num_comments,score,ups,upvote_ratio,downs,downvote,URL,over18
24,AutisticAdults,2023-05-26 02:31:22,Kmama,Advice from autistic adults for my teen - he lost his wireless headphones and broke his phone. How much responsibility should I expect him to take?,"My son, Max, is 14. he is autistic and has ADHD (inattentive type). He is a typical teenager in that he wants to fit in and be part of the crowd. He is also a typical teenager in that he is addicted to his phone. 
We gave him my old iPhone X at the start of the year so he could join in with other kids at school. We also gave him a pair of really good ($100) pair of wireless headphones. We spent more on the headphones because they have good noise cancelling, which he uses a fair bit when he is overwhelmed. He also uses the phone a lot to listen to music when he is out of his comfort zone. Otherwise it’s used for typical teen stuff - social media, watching YouTube, chatting with friends, etc.
Anyway, Max is not good with his possessions. He is always losing them and dropping them, treating them roughly etc. I think the word careless summarises it best.  He has had to replace or pay for repairs on a few of his items in the last three years. He saves up his birthday/Christmas money from us and his grandparents but doesn’t have a regular job. We keep offering to give him pocket money if he will do some jobs around the house, but he refuses (he says ‘I’m too lazy’.) I won’t let him get a job outside the house until he starts doing some jobs at home, as my belief is that if he has enough time and energy to earn his own money, he has enough time and energy to help at home first.
Anyway, in the last month, Max has lost his headphones at school somewhere (and they have now probably been taken by a less honest student), and this week he has dropped his phone and broken it. He doesn’t have enough money to replace/ repair them.
Part of me feels that he has to learn responsibility for his items, and needs to not be bailed out when he is being careless (things we have told him repeatedly, like don’t walk down the street on your phone, not looking where you are going, but he does it anyway). But part of me recognises his neurodivergence is affecting his ability to be careful with his items. I am ADHD myself, so I often lose my phone/headphones/ wallet etc. And I accept that it is part of my brain and wouldn’t hesitate to replace my own items, even if it was a stupid mistake on my part. I forgive myself for my neurodiversity.
How much should I do the same for Max, and how much should I be trying to teach him responsibility? Am I creating a spoilt teen if I pay for replacements, or am I placing unfair neurotypical expectations on a kid who is struggling with executive functioning?",24,18,18,0.92,0,<bound method VotableMixin.downvote of Submission(id='13s0ucv')>,/r/AutisticAdults/comments/13s0ucv/advice_from_autistic_adults_for_my_teen_he_lost/,False
25,AutisticAdults,2023-05-26 01:25:15,B0bert666,Are there any groups who explicitly hate/discriminate against people with autism?,"I’m writing a paper on the struggles of autism and was looking for specific examples of discrimination against people with autism and couldn’t quite find what I was looking for
I need something along the lines of how people with autism aren’t socially accepted in “normal” society, if you could help that’d be greatly appreciated",18,0,0,0.5,0,<bound method VotableMixin.downvote of Submission(id='13rzfr8')>,/r/AutisticAdults/comments/13rzfr8/are_there_any_groups_who_explicitly/,False
26,AutisticAdults,2023-05-26 00:14:15,GhostAmethyst,Dealing with Ableism from other Autistic people,"Really just seeking support, or to have a space for others to share their instances as well. 

I made a post in a chronically ill group about advice for staying hydrated as someone who hates water. 

I’m AuDHD and hydration has always been a struggle for me. I didn’t know it was strongly due to things like not getting hunger and thirst cues properly, things like executive dysfunction, other symptoms of AuDHD that just make care task so damn difficult to do. 

Most of the responses were great and I have tons of suggestions to consider. But one person started off their comment with “I hate to break it to you but part of being an adult is drinking water”. It felt patronizing, I have a lot of rejection feelings towards any kind of behavior people push as “normal”. Because even tasks that are necessary, just because need to do them even for my health, it doesn’t make it easy. 

They also started pushing the whole “sugar is bad” thing. And idk about anyone else, but as someone who got shoved into diet culture really young I struggle with disordered eating. And it’s important to pull away from this idea that some foods are good and some foods are bad. So I let them know this and asked them to just be more mindful, and I assumed they didn’t mean to be patronizing but it did come off that way. 

Things just escalated and it turned into them making fun of me for asking for advice but then not liking their advice. They said I was “bitching” because I wouldn’t drink water but complained about not being hydrated. They then compared me to their mother who complains to them about their weight, to which they tell her not to eat sticks of butter, and then they added their mom is always offended by this. 

They claimed to be AuDHD as well and said it didn’t stop them from “training” themselves to drink water. 

Tbh the whole situation made me cry. I’m scared to even post here that I might be antagonized by others. As someone who struggles to build connections, I just always assumed spaces like this were easier and people were always more compassionate because they can understand. This person triggered all the things I fear about my AuDHD which is that it’s not disabling, I’m just lazy and don’t want to do the work. And that I’m not willing to take help that’s offered, and that I over complicate things or I make excuses for why some things are hard. Idk. I just wanted to try venting about this, I’m not asking for advice. Just didn’t know if anyone had similar stories to commiserate over.",52,52,52,0.91,0,<bound method VotableMixin.downvote of Submission(id='13rxwap')>,/r/AutisticAdults/comments/13rxwap/dealing_with_ableism_from_other_autistic_people/,False
27,AutisticAdults,2023-05-25 23:00:21,comexalone,What are some work accommodations you have asked for and how did you employers react?,"Hello! i’ve been off work on stress leave due to autistic burnout and i’m currently working in a back to work plan for my doctor to submit and i’m just looking to hear from others what kind of accommodations you’ve asked for at work and what that process was like for you and also maybe some feedback on what i’ve looked up! 

Here are a some that i am currently considering that i’ve found on google for ADHD and Autism that i think would be helpful for me, if anyone has any thoughts pointers about these please let me know! 

-a mentor (one designated person who i can direct questions to to “improve communication and understand team culture”) 

- a written standard operating procedures guide that serves as a checklist for daily tasks, “creating a method and logical structure for task completion”

-clarity in communication (clearly and concisely presented instructions with well segmented information and examples, space for additional questions, visual aids)  

- “a culture that embraces transparency so the autistic employee can feel comfortable flagging potential for and instances of autistic burnout” 

I am diagnosed adhd and self diagnosed autistic. I worry some of these might be difficult for this reason, especially the last one, as i’ve read a lot of posts in these communities warning not to disclose to employers their autism. so just looking for advice and your thoughts and experiences in the matter :) thank you!",8,19,19,1.0,0,<bound method VotableMixin.downvote of Submission(id='13rw89g')>,/r/AutisticAdults/comments/13rw89g/what_are_some_work_accommodations_you_have_asked/,False
28,AutisticAdults,2023-05-25 22:37:42,Hour_Apple_2929,Tips on working with children,I’m newly diagnosed autistic and I’ve been selected to be a teacher KG assistant. Some of the classrooms have one or two autistic children. I feel very overwhelmed and want to know how to get through the day without burning out. I’m thinking about earplugs that will block out the extra loud noise as of course it will be noisy. I need tips please,1,3,3,1.0,0,<bound method VotableMixin.downvote of Submission(id='13rvowe')>,/r/AutisticAdults/comments/13rvowe/tips_on_working_with_children/,False
29,AutisticAdults,2023-05-25 21:16:22,doomed-kelpie,Does anyone else ever worry they won’t express the ‘right’ emotions at certain events?,"Sometimes I worry that I’m either not expressing emotions or expressing the wrong ones at special events. 

I mostly worry about this ‘cuz I tend to grin when I get nervous and sometimes laugh randomly because I thought of something funny, so I worry that people will think I’m amused at like, a funeral, or something.

I also worried I wouldn’t seem excited/happy enough at my older sibling’s wedding, but I think I ultimately was appropriately emotional? 

I didn’t worry about this as much until after I got diagnosed because the doctor who diagnosed me described me as having a ‘flat affect’. Around the same time, I started filming myself in cosplay for TikToks and I realized I have to extremely exaggerate expressions for it to look like I’m emoting. So essentially, my face doesn’t always express the emotions I think I am expressing (explains why people always think I’m angry when I’m not smiling, I guess) (before this, I didn’t film myself much, and I have a blank expression in most of my selfies). 

So I’m just a little curious if anyone else here feels like this sometimes?",37,119,119,0.99,0,<bound method VotableMixin.downvote of Submission(id='13rtmtd')>,/r/AutisticAdults/comments/13rtmtd/does_anyone_else_ever_worry_they_wont_express_the/,False
30,AutisticAdults,2023-05-25 20:54:27,HMWYA,“You’re so brave” - Stand Up Comedy Clip,"If you enjoy this clip, you can find the full autism-themed hour-long show at https://www.youtube.com/watch?v=1BppE9bM74E!",3,95,95,0.99,0,<bound method VotableMixin.downvote of Submission(id='13rt1sw')>,/r/AutisticAdults/comments/13rt1sw/youre_so_brave_stand_up_comedy_clip/,False
31,AutisticAdults,2023-05-25 20:47:49,kerghan41,I had an idea for a new sub catered towards the careers of people on the Spectrum. Check it out and contribute if you'd like.,,0,4,4,1.0,0,<bound method VotableMixin.downvote of Submission(id='13rsvpo')>,/r/AutisticAdults/comments/13rsvpo/i_had_an_idea_for_a_new_sub_catered_towards_the/,False
32,AutisticAdults,2023-05-25 20:20:13,LotteTheHippo,I didn't mess up big time but still feel horrible,"Summary to get you up to speed:
I (20f) study nursing. I'm in my 3rd year (out of four) and we got the news today that our whole year will go from 3 to 2 classes. This meant that they mixed all the groups. Most friend groups were kept together and some were split (for example mine, we got split 2-2, when our teacher (who was involved in this) has subtly tried to split us up for 2 years now, we are good students fyi).

This made everyone fairly upset, because we will now have classes of 26 and 27 people, instead of 3 with 17/18. We got very different news 2 weeks ago (that our while class would have the senior year together after working towards it for 3 years together).

I am the class representative, and decided that next to the messy and high emotion debate there will be tomorrow, we should send an objective and respectful email stating what it has done to us.

Now this is where I messed up. Some of our current classmates currently do an internship abroad. I should have included them more in the process before sending it. 
I learned later that they stand very differently in this than us (they are more emotionally detached and more accepting of this outcome).
We had the idea that maybe 2 girls (abroad) would want to change with 2 of my friends. This way everyone would be reunited with their friends. We wrote it down and I included that as a solution in de mail, when the girls abroad hadn't agreed to that yet. I have apologised to them both multiple times and send another mail stating that the names named shouldn't have happened, because not everyone had said yes to this yet. 
The girls did say they didn't blame me, but next time to communicate to them first and that they hope this doesn't have any consequences. That made me feel alright but horrible.

Later I got more feedback that some others from abroad found it to emotional and had some comments about wording and points made. We called and everyone explained their side (them not finding this very nice towards the new potential classmates and me saying we purely wanted to express emotion in this and tell what it did to us about what and how it happened). They sounded okay with it, and I did apologise multiple times again that I should have included them more.

I am crying rn, because I should have waited longer to send it, even though a different teacher said it was nicely written and my whole class said to send it.

Everyone forgave me or said it was okay, but I'm still very disappointed in myself.
I'm so tired these days (I'm also overstimulated from having so much going on and really want to do everything right)

I'm sorry this was so long, so here's a flower💐",1,9,9,1.0,0,<bound method VotableMixin.downvote of Submission(id='13rs6l1')>,/r/AutisticAdults/comments/13rs6l1/i_didnt_mess_up_big_time_but_still_feel_horrible/,False
33,AutisticAdults,2023-05-25 20:15:04,Willing_Ad_3985,What do you wish people knew?,"My work have asked me to do an autism info session for my colleagues. I'm pretty excited about getting to info dump uninterrupted for an hour about one of my favourite topics. Haha!

But I wanted to ask some other autistics people, what do you wish people knew?

I was diagnosed as an adult and have no other learning disabilities, so thats the context I will be talking about it. I just don't have the frame of reference or knowledge to talk about learning disabilities or autism in kids at the moment. 

Thanks in advance for any suggestions!",47,28,28,0.98,0,<bound method VotableMixin.downvote of Submission(id='13rs1s0')>,/r/AutisticAdults/comments/13rs1s0/what_do_you_wish_people_knew/,False
34,AutisticAdults,2023-05-25 19:26:37,cks2016,"To those of you who ended up receiving a formal diagnosis, what initially caused you to struggle with imposter syndrome the most?","Was it the quite good social skills you adapted by systematically analyzing every little interaction and pouring spare time and attention into studying behaviour?

Was it not thinking your behaviours or impulses were repetitive enough/at all because you actively moderated/surpressed them through your life?

Was it because no one ever suspected or mentioned it to you as a possibility?

Curious what doubts you had to wrestle with before you ended up receiving essentially a confirmation from a professional. What helped you to overcome these doubts? Was there some information that was explained to you in a way by another autistic person that helped alleviate them? Did the assessment process itself or the insight/explanation provided by your assessor help?

I am afab, early 30s, high masking, high compensating autist (I believe) with all kinds of in depth systems/learned mental gymnastic/strategies in my head for how to navigate the NT world.. I fear I wont be able to articulate this in an assessment because I am in burnout and that they will remain invisible, or that these internal strategies/systems if known will somehow be not enough to qualify me as autistic. I am working on unmasking but still afraid to seek a diagnosis for these reasons.. though I think this may be the right time as my mask has totally cracked. 

TLDR; Wondering what doubts you wrestled with through your self diagnosis journey and what convinced you to move forward to seek a diagnosis.

Thanks for reading",28,10,10,0.92,0,<bound method VotableMixin.downvote of Submission(id='13rqt7c')>,/r/AutisticAdults/comments/13rqt7c/to_those_of_you_who_ended_up_receiving_a_formal/,False
35,AutisticAdults,2023-05-25 18:32:50,AdorableAcres,Let's Talk・.・✫・゜・。 LIGHTS .・。.・゜✭,,0,2,2,1.0,0,<bound method VotableMixin.downvote of Submission(id='13rpfv6')>,/r/AutisticAdults/comments/13rpfv6/lets_talk_lights/,False
36,AutisticAdults,2023-05-25 18:10:15,amrjs,Had a meltdown in public for the first time in a while,"And knowing what it was helped. 

Yesterday I had barely slept and was the warmest day of the year so far, I chose the wrong clothes (too high neck and the cotton top was a bit too thick). The bus was too warm. Here I was already on thin ice. 

Got to uni and this alarm kept going off. We tried to have a seminar outside but it was loud, so we went inside again. I didn’t feel comfortable stimming too much and my nerves were fraught…

Bought lunch and the machine messed up my order… twice. But eventually I got it right. Picked a book up at the library and then went to look for a book for my dad because his birthday is next week. There I got the call I was dreading, but knew was coming, that I didn’t get a job I really wanted (they wanted me but someone else had more experience)…

The straw that broke the camel’s back was that I hadn’t gotten my summer schedule for my job despite them telling me I should’ve gotten it last week. Not getting this job made me severely anxious about not getting the schedule. You know how it is… they said something and it wasn’t happening, and and the uncertainty just had me in bits. 

I was crying so much and I couldn’t stop. Everything felt out of control and I was panicking. There had been too much noise and there were too many people. But because I knew what was behind it, that I was having a meltdown, I put on my sunglasses and put videos on with subjects that calm me, and I immediately went home. 

I couldn’t communicate, but I could get home and rest. By the time I came home I had my schedule… but it upsets me so much when someone says that I should get something within a specific week and it doesn’t happen that week. I’d rather get a vague timeline than that (I think) 

Knowing what it was helped so much to be able to tackle it. It took ~30min and it was under control but that’s really good for me",2,24,24,0.97,0,<bound method VotableMixin.downvote of Submission(id='13roven')>,/r/AutisticAdults/comments/13roven/had_a_meltdown_in_public_for_the_first_time_in_a/,False
37,AutisticAdults,2023-05-25 18:02:48,relax_overcome,Infodump about your special interests here!!,"I want to learn more random things so please tell me all about your special interests!

Edit: my special interests are psychology & research so anything new to learn about that is cool too",14,10,10,0.92,0,<bound method VotableMixin.downvote of Submission(id='13roooe')>,/r/AutisticAdults/comments/13roooe/infodump_about_your_special_interests_here/,False
38,AutisticAdults,2023-05-25 18:01:52,VermicelliNo2422,How to Not Overanalyze Myself?,"Long story short, I’ve recently been diagnosed with ADHD and all of my medical professionals believe I’m also Autistic, but they don’t have an official system to diagnose adults, so I’m stuck in diagnosis limbo. In the mean time, I’ve found myself overanalyzing everything I do and think.

For whatever reason, whether I’m starting to unmask, notice my tendencies more, or I’m internalizing symptoms and signs of Autism, it seems like literally everything I do lines up with either common Autistic experiences or symptoms. The more I think on it, the more it feels like everything about me is caused by something, instead of just being who I am. My interests are stereotypical, I’m more aware of how oddly I move, I can’t stop overthinking my thought processes. Even in therapy, I’m more and more aware of how many of my problems can be explained by me being Autistic. I thought it would be a relief to have an explanation, but instead it’s brought up so much self doubt and insecurity that I can’t help but study everything I do.

Does anyone else get stuck in this loop? Is this typical for people who have just found out they’re neurodivergent? It’s shaking my sense of self, making me feel like nothing about me is me, and I’m just a compilation of symptoms. How do you get out of this thought cycle and just accept how you are? It’s relieving to have an answer for a lot of my more severe problems, but I feel like I’ve lost a part of myself, as well.",1,4,4,1.0,0,<bound method VotableMixin.downvote of Submission(id='13ronu8')>,/r/AutisticAdults/comments/13ronu8/how_to_not_overanalyze_myself/,False
39,AutisticAdults,2023-05-25 18:01:13,Broad_Taro_Trapz,Not diagnosed with ASD but seems likely I have it and not sure what to do.,"Long story: I’m in my 40s, and my whole life I have felt different from others, like I don’t fit in. I have dealt with serious anxiety and mild depression since I was a child. I have been diagnosed with ADHD-c mostly off of extremely inconsistent school performance when I was a kid: if I found something interesting I could learn it easily and retain all the facts forever, but if something didn’t interest me I couldn’t  (and still struggle to) focus, I daydream constantly and looked for something that would interest or stimulate me. This involved destructivity and hyperactivity that would annoy my parents and teachers. I also had impulse control issues that nearly got me arrested several times that have gotten better but I still struggle to use any sort of social media appropriately. This all sounds like run of the mill ADHD, and ADHD meds help somewhat. 

But I have also always felt very uncomfortable in social situations, like I just don’t know how to act appropriately. My default were either over the top behavior that others found annoying (I learned to control that as an adult) or shutdown (in a corner by myself/fleeing). I can fake being normal for an hour or two but I hate it. So as an adult I don’t really socialize at all if I don’t have to and I really have no friends outside of my immediate family. I have 3 interests I am extremely obsessive about and I can’t imagine not being able to pursue them. I have a job that fits one of my interests and I am pretty good at it, but I try to find excuses to avoid socializing with
my coworkers. They are good people but it just feels awkward and stressful for me. 
I am also married with three kids, and my youngest and I are extremely similar. She was a really challenging child behaviorally since birth (just like I was) so we started seeing therapists and eventually a psychologist and at age 8 she was diagnosed with ASD without intellectual or language impairment. She is now 13 and the similarities between us are only more apparent now (with the main difference is she no longer has any violent outbursts that I continued to have until age 20).

My wife and other children are now convinced I have ASD either in addition to or instead of ADHD-C, and I suspect they are correct. 
My question for you all is do you think this is something worth pursuing with a psychiatrist? I realize it would be better for my family if I was less obsessed with my routine, and I do wish I had friends. I feel like I know how to make friends but what I have to do to make friends-hanging out, making small talk, planning things isn’t worth it. Basically the idea of changing the way I am and who I am at this point in my life is scary and I am resistant to it. Thanks in advance.",1,5,5,1.0,0,<bound method VotableMixin.downvote of Submission(id='13ron8l')>,/r/AutisticAdults/comments/13ron8l/not_diagnosed_with_asd_but_seems_likely_i_have_it/,False
40,AutisticAdults,2023-05-25 17:47:18,Neat-Application-142,AAC question,Are all AACs copy and paste when it comes to things like reddit or discord?,0,2,2,1.0,0,<bound method VotableMixin.downvote of Submission(id='13roalf')>,/r/AutisticAdults/comments/13roalf/aac_question/,False
41,AutisticAdults,2023-05-25 17:32:18,reeper150,I need schedule/routine/productivity resources,"Hi,

I have autism as well as minor brain damage from a brain injury, and I find it unbelievably difficult to create and stick to a routine as well as staying on task and getting pretty much anything done. I recently heard about pomodoro timers which sounds potentially promising, but for someone like me, I am going to need a way to plan out/schedule EVERYTHING. I desperately need a routine to tell me what I'm supposed to be doing at any given moment. I am hoping that someone here who has gone through similar issues can offer some resources or advice about how to get this process of creating and sticking to a routine started.

Thank you so much",1,5,5,0.86,0,<bound method VotableMixin.downvote of Submission(id='13rnx2z')>,/r/AutisticAdults/comments/13rnx2z/i_need_scheduleroutineproductivity_resources/,False
