Index,subreddit,post_time,user_name,title,text,num_comments,score,ups,upvote_ratio,downs,downvote,URL,over18
62,AutisticAdults,2023-05-24 19:15:49,Pipcatcher22,Do your friends come over for tea/coffee/dinner?,"My neurotypical boyfriend often has friends and family over in our house, to just chat. Just sit and chat and sometimes eat and drink. No alcohol either. Do you guys do that with neurotypical friends? I've joined them a few times and it makes my skin crawl. They have a lot of small talk and casual talk and to me it looks incredibly fake but i know that's cuz I'm hyperaware of social norms. I once asked him if any of them would watch something on tv together and apparently they never do that. I can't just sit and have coffee with someone- and if i do, it won't be small talk. It would be about specific things or deep/out there topics or heart to hearts...
I'm not sure if this is a common sentiment for autistic people or if it's really just about how close you are with someone, neurotypical or otherwise.",44,52,52,0.98,0,<bound method VotableMixin.downvote of Submission(id='13qusmi')>,/r/AutisticAdults/comments/13qusmi/do_your_friends_come_over_for_teacoffeedinner/,False
63,AutisticAdults,2023-05-24 17:59:04,emdelgrosso,TLC’s Match Me Abroad S1: Harmful to the Autistic Community,"I love all things TLC and crappy, reality, human-interest TV.

One of my favorites is 90 Day Fiancé and all of its spin-offs, so naturally, when Match Me Abroad came out on TLC, I hit play. 

The basis of the show is that individuals who are interested in dating abroad hire matchmakers and go out on arranged dates. 

One of the (adult) men, who is autistic and openly identified as so on the show, has HIRED one of these matchmakers who is horribly, horribly ableist and infantilizing toward him. She has continually and literally compared this client to a “little boy,” said she “feels like she needs to look after him,” said he “will be the most challenging client she’s had yet,” said he “has a very boyish energy” and feels like she’s “welcoming [her] younger brother,” and is of the opinion that, and I quote, “he is looking for his mommy.”

Only a few episodes are out so far of this show, so I can’t say how it ends up or how much worse it may get, but I’m calling it out now. This is harmful and hateful. 

This show, and TLC in general, need/s some education and training on neurodiversity and stereotypes.",8,25,25,0.91,0,<bound method VotableMixin.downvote of Submission(id='13qspsp')>,/r/AutisticAdults/comments/13qspsp/tlcs_match_me_abroad_s1_harmful_to_the_autistic/,False
64,AutisticAdults,2023-05-24 17:36:21,The_Teacat,Has anyone's family ever used a meltdown against you and/or lie to others about what actually happened?,"I've never talked about this one but it's happened a few times with mine, who are very conservative people who don't really believe in special treatment for things like this, and believe that if you're not on their side, you have to be Stockholmed until you are. Any sense of self or personal identity is not quite allowed and will be used against you unless it serves them. I'm still recovering from a lot of it and it's impossible to predict how much unwiring I already have to do, but I tend to be their scapegoat since I fight against it as much as I can.

But yes. I know there's nothing ""wrong"" with me, but they like to manipulate certain reactions out of me so they can demonize me even more. Specifically they've done this with meltdowns and my attachment to sentimental objects about as long as I can remember, seemingly just because they can. It's set me back a *lot* and left me with trust issues as well as anxious and depressive issues I don't like acknowledging since I'm concerned that gives them a ""win"", and I don't like admitting they can have that affect on me. (And it gives them more ways to toy with me and overpower me.)

This happened as recently as a few years ago, during an event where I was having a small, personal crisis over a financial issue. I wasn’t very comfortable around my family at the time and was going non-verbal while processing it, but the main culprit kept stalking me around and trying to force an answer out of me. It ended up not well; I ended up screaming at him to leave me alone as I kept having to retreat further and further to try and find privacy since I was so upset and embarrassed, and all he would do was follow me and? Act like there was anything he could do?

I ended up getting cut a few times trying to get away and was in the process of dealing with that as well and he still wouldn't leave me alone and that just pushed me further. And some windows were broken and he lied to the police about what was happening to make him seem more sympathetic, and none of my family understands what was actually happening and how unsafe and in-danger and just plain upset I felt; when all I needed was some privacy to get my center back and process some shitty feelings. They just demonize me for it now and barely even talk to me; all I wanted was to be left alone during an obvious meltdown? A deeply embarrassing, frustrating moment that their forced involvement kept exacerbating?

I've been dissociating a lot since then, because it's hard to feel safe showing any emotion or vulnerability around them knowing what they might do. I have a very hard time feeling confident in myself, telling stories about things that have happened, and taking responsibility for things due to everything that's happened to me in situations like this. Am I the problem here? These are the people who used to hit me just for being upset with me, punish me for being upset about things, and scold me for basic emotions without understanding why I was so frustrated, and never really helped me in a way that didn't serve them too, so obviously it's difficult for me to feel comfortable showing these things around them, and it's easier to shut down, but it's obvious they can still exacerbate meltdowns when they need to use them against me.

Has anyone else's family done this or been like this? How do you feel safe when they know they can use basic aspects of your brain's wiring like this and when you know they're against you anyway? I've been trying to leave for a long time and they just keep finding ways to remove that ability from me and attempts to infantilize me to keep me further held back and control me/take advantage of me even further. It's not so fun and feels super not nice actually speaking, you know?

Anyway. Thanks for listening. (Not sure if this was the right flair. Thanks, though!)",1,12,12,1.0,0,<bound method VotableMixin.downvote of Submission(id='13qs3l8')>,/r/AutisticAdults/comments/13qs3l8/has_anyones_family_ever_used_a_meltdown_against/,False
65,AutisticAdults,2023-05-24 17:33:09,vingtsun_guy,Identifying signs of illness,"I have been thinking a lot about this lately. I was diagnosed at 42, but I'm not sure that matters. I have always known I had a different relationship with pain than those around me - my pain tolerance threshold seems to be much higher than other people's. Yesterday, I was diagnosed with a sinus infection. I have never had one and I would venture to say that I had no symptoms of it. I do have asthma, and I've been struggling with fatigue, chest tightness and just overall shortness of breath, which is why I was at the doctor - I thought my asthma was acting up. At any rate, this has gotten me thinking about how I interpret things that are going on in my body. Does anyone else have issues with interpreting when your body is not working well, recognizing when you're sick, or even with feeling pain? If so, do you have a method to counter those issues, so you don't overlook the need for medical care?",5,5,5,0.78,0,<bound method VotableMixin.downvote of Submission(id='13qs0kk')>,/r/AutisticAdults/comments/13qs0kk/identifying_signs_of_illness/,False
66,AutisticAdults,2023-05-24 17:30:00,bohemianzorba,Dating,"What are your experiences with dating at 35+? 

I connect with people in 20s only & these connections are not so romantically receptive most of the time because of age gap. I don’t know what’s going on here",1,6,6,1.0,0,<bound method VotableMixin.downvote of Submission(id='13qrxff')>,/r/AutisticAdults/comments/13qrxff/dating/,False
67,AutisticAdults,2023-05-24 17:20:12,Trashtvslit,I suspect my husband is on the spectrum. Just looking for thoughts and clarity maybe…,"Just wanted to start by saying that I mean no offense by anything I’m about to say, and I’m somewhat new to my research into ASD, so I’m hoping to get some insight/perspective on this, and I appreciate any and all thoughts, opinions, or information. 

My husband and I have had a rollercoaster of a relationship as far as highs and lows, and not being able to properly communicate our issues and be in sync. I’ve recently started questioning if my husband is on the spectrum after a friend of mine was recently just diagnosed and had a revelation that a lot of his life struggles could have been better managed better had he known sooner, and it made me realize that my husband has a lot of those similar qualities. Once I realized this might be a possibility it was like this lightbulb when off and I started wondering if a lot of things I was getting frustrated with were because of the possibility of his ASD, and it made me see him in a new light (and even has made me pause before getting frustrated with him after realizing maybe he can’t help certain things). 

Here is my list of things that have made me question this:
- He doesn’t make a lot of eye contact with me, and when I’m telling him a story I often find myself saying “Are you listening?” And he snaps back “Yes I’m listening!?” 
- He gets a lot of anxiety when going to a new place, and always asks where we will be parking when we get there and is anxious the entire drive 
- He doesn’t like when plans are “sprung” on him, and it makes him mad and have caused several fights between us if my family invites us over “last minute” (aka a couple days away). 
- He always questions everyone’s motives and constantly thinks everyone is against him or is talking behind his back, even when they are not.  
- He goes through phases and obsessions over things, and it completely takes over his mind. For example: for months he played the same video game for hours and hours every day, then for months and months he obsessively watched YouTube videos about skateboards every night, then for a year or two he obsessively got involved in the QAnon cult movement online (it almost ended our marriage because it was affecting me and our kids). 
- He gives “squeeze hugs” where instead of gently hugging me sometimes he’ll squeeze me so hard that it hurts and I have to tell him to stop 
- He uses the same phrases in conversation constantly. 
- He doesn’t like anybody (even me when I’m just cleaning our house) touching his things, and gets very angry if he can’t find something of his. 
- (This one has caused a TON of emotional conversations and arguments between us) He doesn’t seem to understand how to comfort me when I’m upset, or even show any care when I’m sitting in front of him crying about something. He stares blankly at me or just says “It’s ok.” in a monotone manner. And when I say “I feel like you don’t even care about me or care when I’m upset” he always acts really confused and says “You know that’s not true? I love you”. It’s just so confusing. 

If you made it this far I really appreciate it. I guess I just find myself constantly questioning myself and constantly questioning if these qualities of his are part of a high functioning ASD. He has a full time job, he provides for me and our kids, he’s very funny and I love him of course, but some of these qualities have made it really difficult to understand each other and for me to communicate things to him. Let me know what you think and thank you in advance!",15,8,8,0.9,0,<bound method VotableMixin.downvote of Submission(id='13qrodf')>,/r/AutisticAdults/comments/13qrodf/i_suspect_my_husband_is_on_the_spectrum_just/,False
68,AutisticAdults,2023-05-24 15:42:27,Riksor,Alternatives to hanging up clothes?,"This might not be an autistic thing, but anecdotally I have this issue and so do many of my neurodivergent friends. How do you make hanging up clothes bearable?? I'm fine with cleaning and other chores but I can't bring myself to hang up clothes, it's so incredibly boring and frustrating, especially since I'm too short to reach my closet. It seems like such a waste of time--why hang clothes up when you're just going to wear them again?







I don't have a dresser. Right now my clothes live on a pile on my floor. Does anyone have any advice or alternatives?? Thank you",36,30,30,0.91,0,<bound method VotableMixin.downvote of Submission(id='13qp4xo')>,/r/AutisticAdults/comments/13qp4xo/alternatives_to_hanging_up_clothes/,False
69,AutisticAdults,2023-05-24 15:34:59,idkijustlovemydog,I'm so sick of my supposed friends. I bought tickets to a concert for three of us in advance. No one even mentioned paying me back until I brought it up. And still haven't been paid back. Plus so much more in post,"There was a concert that was gonna sell out fast (my friends love the artist and so do i). I tell my friends about the concert and we're all excited. We hang out and they agree to pay me back so I buy 3 tickets while we're hanging out. Total, they were $300. 

When it comes close to concert time, I arrive to my friend's house on time. I checked a million times and the concert started at 7. My other friend doesn't even arrive until 8:30.

We finally get to the concert at 9:00 and it's over by the time we get there. My friends really didn't care at all. Because they had no intention at all of ever paying me back for those tickets...

The money itself isn't what bothers me, it's the principle. I shouldn't have to remind someone to pay me back for a $100 ticket. I reminded them a few times, but I shouldn't have to beg to be paid back. Let alone 2 fucking people. These two people are always acting entitled to my belongings. Whether it be money, my time, food, rides, mental space, literally anything. And I'm so fucking sick of being disrespected.

The thing is tho.....it feels like everyone eventually starts to treat me like this. If I want friends, it seems like I have to settle for people that will be ""the least"" rude to me if that makes sense. I am so sick of it. I don't want to become bitter but it's hard. 

Sorry for the vent, I just really needed somewhere to post this. The way I'm feeling right now, I never want to see these people ever again. But I know I will....

I'm terrible at talking to people, but I'm wondering what some of you would say to these ""friends"" if this happened to you. I need some help formulating what I should say to them. 

 I only ever really reminded them twice to pay me back but I feel that's enough. I shouldn't have to call out everything they do to earn respect. They know damn well what they're doing and they're just taking advantage of me and don't care. 

Anyways. Sorry if venting isn't allowed here.",54,126,126,0.96,0,<bound method VotableMixin.downvote of Submission(id='13qoy8i')>,/r/AutisticAdults/comments/13qoy8i/im_so_sick_of_my_supposed_friends_i_bought/,False
70,AutisticAdults,2023-05-24 15:28:25,theautisticcoach,Discussion Group for Autistics from Asia & the Global South,"The conversation in the autistic community is dominated by Western, predominantly white, voices. The autistic experience in the Global South & East is VERY different.

Every month I host a free online discussion circle for autistic folks from the Global South and Asia, as well as those who live in the West but whose cultural context is non-Western. We have had participants from India, China, Pakistan, South Korea, Rwanda, Turkey, Morocco, Egypt, Palestine, Brazil, Peru, Hong Kong, Zimbabwe, Thailand, Myanmar, Israel, Kenya, Benin, and Vietnam to name a few.

Non-Western allies are encouraged to attend and listen, but speaking time is reserved for non-Western participants.

The next one will be on June and you can register for it here - [https://www.theautisticcoach.com/autism-discussion-affirmation-circles](https://www.theautisticcoach.com/autism-discussion-affirmation-circles)",0,7,7,0.82,0,<bound method VotableMixin.downvote of Submission(id='13qoskh')>,/r/AutisticAdults/comments/13qoskh/discussion_group_for_autistics_from_asia_the/,False
71,AutisticAdults,2023-05-24 15:15:10,BigAlba45,Why can’t I cry?,"(M29) Diagnosed 7 years ago) So when I was younger I could like any other person, but I was always told to man up, stop making a scene / drawing attention to use etc  (tbh I can imagine I would freak out quite badly) But from what I can remember I would just get in more trouble / be punished for it. So now if someone dies, someone leaves etc etc absolutely nothing happens. Is not being able to now my brains response to negative stimulus / reaction in the past? Or am I just an emotionless glob? 🙃",14,21,21,0.96,0,<bound method VotableMixin.downvote of Submission(id='13qoh7o')>,/r/AutisticAdults/comments/13qoh7o/why_cant_i_cry/,False
72,AutisticAdults,2023-05-24 15:14:46,BigAlba45,Why can’t I cry?,"(M29) Diagnosed 7 years ago) So when I was younger I could like any other person, but I was always told to man up, stop making a scene / drawing attention to use etc  (tbh I can imagine I would freak out quite badly) But from what I can remember I would just get in more trouble / be punished for it. So now if someone dies, someone leaves etc etc absolutely nothing happens. Is not being able to now my brains response to negative stimulus / reaction in the past? Or am I just an emotionless glob? 🙃",3,6,6,0.87,0,<bound method VotableMixin.downvote of Submission(id='13qogw3')>,/r/AutisticAdults/comments/13qogw3/why_cant_i_cry/,False
73,AutisticAdults,2023-05-24 14:55:02,aairo1228,I can't stand silence,"Idk if that's part of my autism or PTSD, but if nothing is on or I don't have anything to focus on will throw me into a panic attack. Does anyone else have something like this? I notice most autistic adults my age have the exact opposite problem, where too much noise can over stimulate them. And while too much noise will also make me freak out, no noise at all is way worse for me.",4,7,7,1.0,0,<bound method VotableMixin.downvote of Submission(id='13qnymb')>,/r/AutisticAdults/comments/13qnymb/i_cant_stand_silence/,False
74,AutisticAdults,2023-05-24 14:42:49,HyperAutisticDude,Noise cancelling headphones,"My headphones broke right after warrantee, I had the Sony WH-1000XM4, however I found it has a hardware issue where they can get into an endless screaming in your ear loop. 

So I was wondering if anyone had a good suggestion for a good noise cancelling headset that doesn't cost a fortune.",2,3,3,1.0,0,<bound method VotableMixin.downvote of Submission(id='13qnnod')>,/r/AutisticAdults/comments/13qnnod/noise_cancelling_headphones/,False
75,AutisticAdults,2023-05-24 12:09:39,kerghan41,Numbers are very comforting.,"Numbers have always grounded and centered me. I'm not some mathematical genius either, very far from it. But, when stressed, or trying to calm or center myself I find that I either count in multiples of X or I count by prime numbers in my head. 

For example, randomly start counting by 7s and won't stop until I'm well into hundreds if not thousands. I do this a lot and depending on my goal I'll do easier multiples or harder multiples. For example if I'm trying to distract my mind I'll focus on prime numbers but if I'm just looking to be comforted I'll count by 3s.

This is a bit personal, but during sex some people think about baseball or other things to make it last longer. Me? I count multiples or prime numbers silently to myself. Occasionally, I've mouthed the numbers before and have had to explain what I'm doing. Makes for good times...",29,49,49,0.95,0,<bound method VotableMixin.downvote of Submission(id='13qjrjl')>,/r/AutisticAdults/comments/13qjrjl/numbers_are_very_comforting/,False
76,AutisticAdults,2023-05-24 10:48:33,YouMadeMeSoFilthy,"Diagnosed with bpd, but suspecting it's actually ASD (and ADHD)","Hi! I got diagnosed with BPD almost 7 years ago shortly after my 18th birthday. I'm also diagnosed with generalized anxiety disorder mixed with depression, ptsd, social phobia and a panic disorder with agoraphobia.
.
But in the past few years I've been thinking about maybe being actually autistic. (I'm a trans guy btw, so AFAB) I read a lot about it, my occupational therapist who's autistic themselves also say i'm probably autistic - same with my autistic friends. 
.
The problem is - or the problems are - my psychiatrist doesn't want to refer me to anyone who can diagnose autism since I already have the BPD diagnosis. Plus there's only one place that can test someone for autism here and there's one day in the entire year where you have to call them for an appointment - for the next year. 4 hours where hundreds of people call that person to ask for an appointment. So it's close to impossible to get the appointment. 
.
Is anyone else here diagnosed with BPD and maybe with autism?",12,10,10,0.78,0,<bound method VotableMixin.downvote of Submission(id='13qi1yl')>,/r/AutisticAdults/comments/13qi1yl/diagnosed_with_bpd_but_suspecting_its_actually/,False
77,AutisticAdults,2023-05-24 10:34:49,NoPiano6624,What are your favourite career resources?,"Hi there,

What career resources including books, workbooks, websites, social media accounts, organisations etc. are your favourites or would you recommend?

I also have ADHD so anything including this diagnosis would be appreciated too. 

Thank you.",4,9,9,0.92,0,<bound method VotableMixin.downvote of Submission(id='13qht1i')>,/r/AutisticAdults/comments/13qht1i/what_are_your_favourite_career_resources/,False
78,AutisticAdults,2023-05-24 03:59:32,Naima92231,"At 61, It Occurs to Me That I'm Probably On the Autism Spectrum.","Last year I reconnected with a man I met in my late-20's (he's 6 years older), whom I considered a (very attractive) friend. I've know and cared about over the decades, but I got married, moved, had a wonderful son (now 24), eventually separated 
/divorced and move to another state with him, just to get away fro my ex.

But eventually I moved back (with my son) to the town I love the most, where my old friend still lives. He's 67, and I'm 61.

When we re-connected, he shortly thereafter went into the throes of some serious health complications. He'd lost a lot of weight and basically couldn't get up from his living-room floor to even feed himself, and was skeletal. So I brought him to my place for a while, where I could keep him fed, get him to doctors' appts., etc.

He continued to stay with me (or I'd stay at his place) after he got better. We were very affectionate with each other, but it was always platonic (not my idea--I'm seriously attracted to him, but I'm
not sure he understands why!).

Over time, he's become less physically affectionate (we've never even kissed). I don't mind (TOO much) not having sex, but we still sleep together sometimes and he's much less cuddly (not always, but more distant). I really miss that.

But he's warm and funny and talented and delightfully quirky. I love him as my best friend, but it's hard.

Anyway, a few months ago it dawned on me that he might be a very smart, high-functioning person on the spectrum. I slowly introduced the possibility to him--especially his sensory issues (I didn't question him much about sexuality), and a few other things. He seemed interested, and not insulted, by the possibility. We watched ""Rain Man,"", and now we're both always quoting from it.

I often tell him that, even when he makes no sense, he makes more sense to me than anyone. I trust him (not a common thing with me!), and I love him--I'm just not sure as WHAT, but that's pretty much okay. Well, sometimes it's been painful, but he knows that, and he's always kind and sweet (if a little hyper-critical sometimes). We tend to be there for each other, and he's obviously put effort into thinking about how I feel and adjusting how he responds.

I enjoy spending time with him more than anyone in years (aside from my soon, but that's different, of corse!).

I think that he and I tacitly agree that he's an ""aspie"" (I know that word's not used much any more), and, as I've learned more about it for his sake, I'm starting to believe (at 61!) that maybe I've been on the spectrum my whole life as well. For a long time I've thought that I have (and now get medicated for) ADD, but when I think back over my life and interactions I wonder..

I've taken a few online autism tests, with varying results, but today I took the AQ test and tested 33 out of 50! The questions can be so vague and difficult to answer, but I assume that's the way the tests are designed.

So, I guess, what next? I've never particularly trusted therapists. I just think back over my 6 decades, and how badly things often turned out at jobs, etc., and I guess I'd just like to understand. I know there's no magic pill for it, and I guess I'll always be this way.

But I've always carried a lot of shame and a lot of ""not quite fitting in,"" and I wonder if I can somehow reconcile all that, or if I can.

Any thoughts would be appreciated.",24,33,33,0.95,0,<bound method VotableMixin.downvote of Submission(id='13qae35')>,/r/AutisticAdults/comments/13qae35/at_61_it_occurs_to_me_that_im_probably_on_the/,False
79,AutisticAdults,2023-05-24 03:55:00,Applesaregood8774,Called pretentious?,Has anyone on here ever been called pretentious by a friend or family member?,9,9,9,1.0,0,<bound method VotableMixin.downvote of Submission(id='13qaaur')>,/r/AutisticAdults/comments/13qaaur/called_pretentious/,False
