Index,subreddit,post_time,user_name,title,text,num_comments,score,ups,upvote_ratio,downs,downvote,URL,over18
1,AutisticAdults,2023-05-27 06:14:39,luna_bea_tuna,Realisation - why I like cartoons / kids shows (as a 37 year old),"A sudden realisation while watching cartoons with my 3 year old, and reading more about sensory seeking autists. Kids shows / cartoons are visually “dazzling”, satisfyingly my visual sensory seeking, and the themes/lessons are overtly described to the viewer. Feels weird that I’m learning social interactions / lessons from a kids cartoon at this point in my life but also feels nice having someone be so explicit about them. Neat!",0,5,5,1.0,0,<bound method VotableMixin.downvote of Submission(id='13szrun')>,/r/AutisticAdults/comments/13szrun/realisation_why_i_like_cartoons_kids_shows_as_a/,False
2,AutisticAdults,2023-05-27 04:33:12,Putrid-Occasion1881,Autism and BPD? *Vent,"I got diagnosed with autism as an adult but I know of at least 2 people that are knowledgeable on both disorders and who know I'm autistic, that have noticed enough symptoms of BPD in me to ask my partner directly if I have this comorbidity. He said the idea has also crossed his mind since we met. 

I don't have a BPD diagnosis and none of my healthcare providers have mentioned it to me in my life but then again they didn't catch the autism until I brought it up either. I was curious that so many people were seeing this disorder in me so I did some research into it and it was uncomfortable how relatable it felt. I looked into specifically how autism and BPD can overlap and how they differ and I still relate very much to both. 

I don't really know what I'm looking for. For some reason I thought my autism diagnosis would be the last major psychiatric diagnosis I would receive in my life so I don't think I want to pursue if I would qualify for a formal diagnosis right now. I think I'm just uncomfortable because it feels like every time I finally figure out what's going on with me, there ends up being something else still.

 Does anyone else have experience with this comorbidity? Am I leaping to conclusions here by assuming there's a high chance I have this disorder based on my internet research and observations from others alone? This is how I discovered my autism after all. Is it worth bringing up to my therapist and/or psychiatrist to see what they think? I worry they'll think I'm being dramatic and that I'm looking for something to be wrong with me. 

If anyone has advice, can direct me to related resources, or would be willing to possibly tolerate me venting about this some more, I'd like to know. Thank you.",1,1,1,1.0,0,<bound method VotableMixin.downvote of Submission(id='13sxz75')>,/r/AutisticAdults/comments/13sxz75/autism_and_bpd_vent/,False
3,AutisticAdults,2023-05-27 03:25:45,MyBrainsPOV,Does anyone else live a life without friends?,"I am friendly with people at work. I do not hang out with them outside of work. I dont feel like I have time or desire to hang out with friends. I do feel lonely sometimes but mostly appreciative of the fact that most of the time nothing is expected of me as far as friendship. I instead spend most of my time doing chores at home, helping with cooking etc, and spending time alone decompressing. I have tried therapy before and plan to try again. I do feel kind of broken but then again I also just like being left alone. I simply cannot imagine what a life filled with friends would be like. I feel like there aren't enough hours in the day to do that. The back and forth that a friendship requires. How can you do that successfully and still live a life? It feels so huge. I'm nearly 42 and honestly feel completely comfortable with the idea that the next 20+ years will be the same. But what if I'm denying myself a significant human experience?",26,64,64,1.0,0,<bound method VotableMixin.downvote of Submission(id='13swqnf')>,/r/AutisticAdults/comments/13swqnf/does_anyone_else_live_a_life_without_friends/,False
4,AutisticAdults,2023-05-27 03:23:49,trainticketyboo,Looking for Autism from the Inside Discord link,"Hi everyone,

A few weeks ago I stumbled across a Discord centered around the Autism from the Inside YouTube channel. However, I was using a temporary username, and have since lost access to that Discord page. Is anyone here a part of that Discord, and if so, could you possibly send me an invite link?

Hoping to get access again!  Thanks a lot :)",0,2,2,1.0,0,<bound method VotableMixin.downvote of Submission(id='13swpdy')>,/r/AutisticAdults/comments/13swpdy/looking_for_autism_from_the_inside_discord_link/,False
5,AutisticAdults,2023-05-26 23:23:19,newme__whodis,"My family guilts me bc I don't have a ""solid adult job"" by now","I am in my early 30s and haven't worked in a few years starting because of Covid (I worked in retail and got burned out 8 months into the job) but before that I worked as a Home Health Aide for FIVE years and now that my SO is having more and more health struggles I get paid to be a carer for him. But that doesnt seem to count my parents want me to have a ""out of the house"" job with coworkers etc. And they just DON'T get it . My Mom is toxic af and recently made nasty comments. I feel like a disappointment now and need some kind advice. Thank you in advance",2,1,1,0.55,0,<bound method VotableMixin.downvote of Submission(id='13srqbd')>,/r/AutisticAdults/comments/13srqbd/my_family_guilts_me_bc_i_dont_have_a_solid_adult/,False
6,AutisticAdults,2023-05-26 22:55:16,Frogmaster1256,As a teenager with undiagnosed aspergers how to find a girlfriend.,,6,0,0,0.43,0,<bound method VotableMixin.downvote of Submission(id='13sr2az')>,/r/AutisticAdults/comments/13sr2az/as_a_teenager_with_undiagnosed_aspergers_how_to/,False
7,AutisticAdults,2023-05-26 22:50:04,Technical_Autist_22,"Since being diagnosed, I feel like I have an endless treat of questions circulating through my head all day and night","**TITLE SHOULD SAY “ENDLESS STREAM OF QUESTIONS”**

I wonder if there are stages to being diagnosed, similar to how there are stages of grief for bereavements? At first I was relieved, then I was extremely doubtful, had a small phase where I was quite upset at the realisation of never getting better at any of my struggles, and now I feel as though my curiosity it at an all time high and I’m questioning absolutely everything. 

I’ve been having a bit of a rough time lately, not feeling very focused, lashing out a little bit and feeling quite miserable and bitter but I’m heading out of that now. 

Any similar experiences? Advice perhaps?",10,12,12,0.85,0,<bound method VotableMixin.downvote of Submission(id='13sqxxe')>,/r/AutisticAdults/comments/13sqxxe/since_being_diagnosed_i_feel_like_i_have_an/,False
8,AutisticAdults,2023-05-26 21:08:47,Background-Control37,Disclosing at work?,"For everyone who has (voluntarily) disclosed their autism to colleagues at work, what has your experience been? For those who had a negative experience, what, if anything, could have made it better?",7,5,5,0.68,0,<bound method VotableMixin.downvote of Submission(id='13sokaj')>,/r/AutisticAdults/comments/13sokaj/disclosing_at_work/,False
9,AutisticAdults,2023-05-26 19:57:46,Tomovasky,Anyone’s dread long weekends.,"Does anyone else dread the long weekend? For me, I just want to go to work on Monday. The change in schedule really bothers me. Now to be fair, I enjoy my work and this is when I’m in a good place. Durning shutdowns or burnout I’ll take any chance I can not to do anything.",8,8,8,0.9,0,<bound method VotableMixin.downvote of Submission(id='13smw0e')>,/r/AutisticAdults/comments/13smw0e/anyones_dread_long_weekends/,False
10,AutisticAdults,2023-05-26 19:13:25,No_Boysenberry_7138,"Every night me brother beats me up. Like, batters me.",,2,10,10,0.86,0,<bound method VotableMixin.downvote of Submission(id='13slu5p')>,/r/AutisticAdults/comments/13slu5p/every_night_me_brother_beats_me_up_like_batters_me/,False
11,AutisticAdults,2023-05-26 17:53:47,serromani,How do I respond to this compliment from my boss??,"I'm really bad at receiving compliments, which usually is just a bit of an awkward personality trait but isn't really that big of a deal. When the compliment is coming from my direct supervisor, though, I really feel like I should learn to respond appropriately.

I'm currently doing some light freelancing work editing and proofreading for the marketing firm my dad works at (I had to go through the whole interview process and testing to prove I'm qualified, so it's not just something I was handed due to nepotism-- especially since he doesn't even work in the department involved with copywriting at all).

I was assigned my first workload today, and I emailed my boss asking a clarifying question about exactly what all she wanted my notes on. I explained that I didn't want to offend anyone by overstepping beyond my jurisdiction and making unwelcome suggestions.

She responded by telling me to go ahead and include any suggestions I felt may improve things, and when I thanked her she replied ""You are so great!  😊"". I'm not really sure if I'm supposed to respond to that, and if I am I have no idea what to say.

I know she probably has a friendlier than normal tone with me because she's (sort of) known me since I was younger (via occasional company holiday parties with my dad, etc), but that compliment just feels so broad that I really don't know how to address it gracefully.

What do you think I should do? Does this warrant a response, and if so, how might I go about wording it?

Thanks for helping me with my awkward panic, everybody!",3,3,3,0.72,0,<bound method VotableMixin.downvote of Submission(id='13sjx78')>,/r/AutisticAdults/comments/13sjx78/how_do_i_respond_to_this_compliment_from_my_boss/,False
12,AutisticAdults,2023-05-26 16:10:20,,Did anyone else internalize that “horrified” look people can give us for making social mistakes?,"I never once thought to question it. Everyone acts like that’s the “right” way to show someone they’re doing something “wrong.” But every time it stung so bad, and I interpreted that look as meaning *I am a disgusting stain on the Earth.* Even when I observe people making this face to others, I feel the same way, they are sending a message that tells the person they’re disgusting. It’s not simply displeasure or disapproval, I’ve seen that, that horrified look is sending a different message, a destructive message. That look does not say I or someone else *did something wrong* it says mine or another persons *existence is wrong*. 

I don’t know this is so confusing. I’ve found myself making that same look thinking “this is how I’m supposed to show disapproval, I’m just being like everyone else,” but it feels so wrong. SO WRONG. My moral compass screams to me that *this is not the right way to show disapproval despite the fact that it’s the socially acceptable way of showing disapproval.* It feels fundamentally dehumanizing on either end. I don’t know how to explain this to most people because for them it’s “ugh! That’s just the way the world is!” But I hope someone here understands what I mean. I’m not trying to fight the fact that this is what people do to show disapproval, I understand that and I can respect that while believing that this method of showing disapproval is destructive. It’s *shame*.

I get that most of us hate the whole “it’s not what you say it’s how you say it” type of thing, and right now it sounds like I’m being like that, but honestly what I hate most about that phrase is that people often hold us to different standards just to put us down…not cause they care about the morality of things.

Edit: I just need to get this out somewhere. I’ve violated my moral compass trying to keep up with this social stuff that I’m trying to learn. And I feel disgusting inside. I feel so disgusting. And I understand everyone else is doing it just to keep up as well, does everyone else feel that filth growing inside of them too?",10,68,68,0.99,0,<bound method VotableMixin.downvote of Submission(id='13shbtz')>,/r/AutisticAdults/comments/13shbtz/did_anyone_else_internalize_that_horrified_look/,False
13,AutisticAdults,2023-05-26 15:43:23,SakuraNightGlow,Looking for help in getting an official diagnosis,"Hello! I've been trying to get a diagnosis for autism for now half a year, probably longer than that and I just keep getting dead ends, mostly because insurance isn't covered and most places are $3,000+ to get tested and I just can't afford that, since I'm a college student in the US ;-;
The only place I have so far is Sachs Center which is $675 for an official diagnosis and today I'll be checking out the referral my primary doctor gave me, but in case those don't work, could I get some options, preferably in the NYC area, to get an official diagnosis? 
Btw I am a 20 year old female, I know diagnosis for adults and females tends to be more difficult to find so hopefully this helps specify the responses.
Thank you!",8,3,3,0.72,0,<bound method VotableMixin.downvote of Submission(id='13sgmqb')>,/r/AutisticAdults/comments/13sgmqb/looking_for_help_in_getting_an_official_diagnosis/,False
14,AutisticAdults,2023-05-26 15:08:40,thefrustratedpoet,I love my wife,"I’m not diagnosed and I’ve been having real difficulty articulating myself, in particular explaining to my wife of 10 years why I seem to have changed just recently, and what I need.

It’s not fair on her at all, or on us. She’s never swayed in her love and devotion despite 12 years of my chaos, mood swings, meltdowns, shutdowns, exhaustion and year after year of undefinable and ever changing problems.

I was diagnosed ADHD in 2021, and treating it has given my underlying neurodivergence absolute free reign. I’m basically incoherent at times. Not to mention completely burnt out.

My wife has been so supportive, loving and wonderful, and has even offered to pay for the therapy I sorely need.

This morning I asked for something I’ve never asked for, never realised I might need (until I watched some clips from the Temple Grandin movie). I asked her to lie on top of me.

She did as I asked and I immediately felt calmer, more relaxed, and sleepy (I have been really struggling to sleep recently as well).

Having a supportive spouse is the single thing that is keeping me afloat and I’m so lucky to have her.",10,81,81,0.99,0,<bound method VotableMixin.downvote of Submission(id='13sfqxk')>,/r/AutisticAdults/comments/13sfqxk/i_love_my_wife/,False
15,AutisticAdults,2023-05-26 15:01:27,AutoModerator,Friday check-in thread,"This is a weekly thread in case you feel like checking in and telling us how you are doing. Non-mandatory things you might like to mention:

* How are you feeling?
* What's occupying your interest and attention?
* What song or clip sums up your current mood?
* What is something good or bad that has happened to you this week? 

Memes are permitted in this thread if that's how you'd like to express yourself. Supportive comments only please. This is not a thread for seeking advice, giving advice, or arguing.",5,9,9,0.86,0,<bound method VotableMixin.downvote of Submission(id='13sfjyg')>,/r/AutisticAdults/comments/13sfjyg/friday_checkin_thread/,False
16,AutisticAdults,2023-05-26 15:00:04,blushvibe,30/M autistic/ADHD partner fixates on cat fur?,"Hi there! I’m really happy I found this community, and I’m wondering if someone can shed some light on a question my partner and I have had for a while now. 

My fiancé is 30, and a late diagnosis for both autism and ADHD. When he was around college age, his parents got their first pet cats for the family. He’d had experience with animals before, of course, but these were his first “pets” and thus the first animals to really spend time with him in a way other people could observe. 

They noticed he was intently fixated on their cats’ fur and would politely point it out to him (without telling him to “stop”—they were pretty gentle with him) but he couldn’t stop for more than a little bit. The physical act is difficult to explain, but almost every time he’s around our black cat, he “inspects” her fur intently through staring, and moving small bits of her fur around to see down to her skin, or to maybe see underside of her coat? Almost like the way monkeys clean each other, but he’s not picking anything off of her? 

It doesn’t hurt our cat at all, and is totally harmless, but he does it a lot, and when he does, it’s really hard to break him out of it. He asked me to just gently nudge his hand out of the way when I see him doing it while we’re all family cuddling together, but he goes right back to it immediately. I’ve nudged him like 5-10 times in a row consistently, and it hasn’t helped. 

He doesn’t know why he does it, and it came on very very late in life, as you can see. He does stim with his own hair a lot (curling the front piece around his finger near his forehead)  and likes to rub one spot for a long period of time (when he’s holding me, he’ll move his thumb back and forth rapidly on my skin—this is sometimes painful for me) so he’s very tactile. 

We’re both at a loss for an explanation and are wondering if anyone else has experienced this in their partner, or does it themselves? Maybe someone can shed some light on this for us? 

Appreciate the read! Thanks!",16,4,4,0.67,0,<bound method VotableMixin.downvote of Submission(id='13sfinq')>,/r/AutisticAdults/comments/13sfinq/30m_autisticadhd_partner_fixates_on_cat_fur/,False
17,AutisticAdults,2023-05-26 14:16:42,DommyMommyMint,Anyone else still do this? I'm 23 🥲,,57,213,213,0.99,0,<bound method VotableMixin.downvote of Submission(id='13seg51')>,/r/AutisticAdults/comments/13seg51/anyone_else_still_do_this_im_23/,False
18,AutisticAdults,2023-05-26 13:46:24,Postdemocraticera,My city has started a programme where anyone who needs it has free access to quiet and peaceful rooms they can feel safe and rest in.,,2,14,14,0.87,0,<bound method VotableMixin.downvote of Submission(id='13sdpfr')>,/r/AutisticAdults/comments/13sdpfr/my_city_has_started_a_programme_where_anyone_who/,False
19,AutisticAdults,2023-05-26 06:30:05,East_Midnight2812,I 27F think I will stick to masking no matter what.,"I don't know, I've been doing it long before I knew the term for it. It's just my default and I don't know how to break out of it. I've been doing a good chunk of my life and that's all I've ever known. I can't eloquently pull my thoughts together right now although I'm eager to get this off my chest safely.",8,20,20,0.9,0,<bound method VotableMixin.downvote of Submission(id='13s5cep')>,/r/AutisticAdults/comments/13s5cep/i_27f_think_i_will_stick_to_masking_no_matter_what/,False
20,AutisticAdults,2023-05-26 05:43:17,SpicyRamen5193,Any tips to focus on work?,"I suspect im AuDHD and it's sometimes very difficult for me to focus at work sometimes. I work overnight at HD, so it's much more like a warehouse setting. I don't get bothered by all the noise, but I'll space off, a question will pop into my head and won't go away til I look it up, or my clothes aren't fitting me 'right' and it bothers me. Today feels especially bad, as my brain won't stay focused for more than maybe 15 minutes before I have to go and switch tasks or something to keep my brain somewhat entertained, and even then that isn't always successful. Music is only aometimes an option for me as it will get too loud to hear my music sometimes. All I really do at my job is look for an item's SKU on the shelf and then packout the item on the shelf if that helps.",0,5,5,1.0,0,<bound method VotableMixin.downvote of Submission(id='13s4iar')>,/r/AutisticAdults/comments/13s4iar/any_tips_to_focus_on_work/,False
21,AutisticAdults,2023-05-26 05:05:44,los-pollos-hormones,I love night time,"It’s 1am right now.  All day I felt overwhelmed and like I was about to explode, but now I’m walking the empty streets and I feel wonderful.  Maybe it’s the some of the weed talking but I don’t care because this is the best I’ve felt in days.  I even saw a taxi drive by.

I’ve always wanted to be a people person and a family man.  I wanted to be comfortable with parties and lots of people and I wanted to fit in with the stereotype of a small town guy who knew everyone.  But right now I feel so comfortable walking around with the cats and the possums.  The only person I talked to was the waffle house lady and it was great.  Last time I only talked to a drunk guy when I went to pass him.

Some times it’s really hard for me to accept that I wont ever be as loud and boisterous as the person I want to be, but right now I love it.  I just wish it was easier for me to remember that.  And I wish I could be like this all of the time.",8,41,41,0.96,0,<bound method VotableMixin.downvote of Submission(id='13s3tvh')>,/r/AutisticAdults/comments/13s3tvh/i_love_night_time/,False
22,AutisticAdults,2023-05-26 03:29:57,Scout1769,I Firmly believe I have ASD. Any advice for a guy just learning about the spectrum at 29?,"My entire life I’ve always been, different. Growing up, kids and even adults would see me in a very unique light but would always dismiss it as “silly little quirks” or “that’s just how he is”. I was diagnosed with ADHD around 1st grade and I took Adderall until 2012. I never really considered anything more but something was/has always been…off about me and  my social understanding never matched even the other individuals that had ADHD. 

Where do I start? I find it impossible to control the volume of my voice, I don’t know (still) when to talk in turn without accidentally interrupting. If someone explains something one way and I explain the exact same thing but from my vantage no one knows what I’m talking about. Loud sudden noises (like fireworks and gunfire give me anxiety). I have to do thing in a certain order and it makes me angry if things get out of whack. I seem to talk normal in my head and writing/typing but I struggle to talk to others and I am amazed if a conversation goes remotely well despite rehearsing it in my head over and over. Eye contact makes me uncomfortable. People think I’m being mean or rude when I feel like I’m completely neutral or even friendly. I repeat myself a lot, and even edited this post because I kept repeating myself. When confronted, yelled at, or even anxious or overwhelmed I have bad verbal shutdowns, where I just panic in my head but on the outside I’m just blankly staring or looking down. There is so much more. 

I recently found a paper from kindergarten regarding transitioning into first grade and the observations about me that the teacher and nurse at the school had made that year executed by the guidance counselor, nurse, and a doctor they had come in the school each year (this was 1999 in a little backwoods country school). It examined basic physical, linguistic, and cognitive functions at that age. I was 5-6 at the time. I had a hard time speaking and I remember that part, they had me in a 1 on 1 language class with the guidance counselor. At the bottom of the paper was additional notes that read:

“Speech Language -Diagnostic
We highly recommend special classes for **** 

Observations:
 **** shows high potential for PDD-NOS & ADHD. We advise you as the parent/guardian of **** that he sees his pediatrician before the new school year. 
*There is more to the note but there is an old stain that made some if it illegible.”

From my understanding PDD-NOS was an old diagnostic criteria for Autism before it was changed to ASD. (Please correct me if I’m wrong) 

My entire life my parents never told me, nor did they pursue it with the pediatrician or any of my doctors. I struggled all the way through school and barely graduated in normal classes when I should have been in special ed…it was brushed off as ADHD because my mom always did the talking at the doctors and I was only allowed to say what she coached me to say, and now I know why…I guess she just couldn’t accept the fact her son had a learning disability. 

*side note I grew up in a wealthy but abusive household as an adopted only child. 

I’m married now and still struggle everyday with the same things I always have but it is way different as an adult.
There is so much more to my story but too way much for Reddit, I’m also physically disabled as icing on the cake so I’ve thought about starting an instagram or a YouTube channel to help spread awareness but I don’t know if it would catch on. If anyone has any advice on getting an official diagnosis and how to better understand and cope with this new discovery please let me know.

Thank you for reading",3,2,2,0.67,0,<bound method VotableMixin.downvote of Submission(id='13s1zoe')>,/r/AutisticAdults/comments/13s1zoe/i_firmly_believe_i_have_asd_any_advice_for_a_guy/,False
23,AutisticAdults,2023-05-26 02:36:07,trev_thetransdude,Found this chair at costco for $40,I did have to alter the straps a bit to make it a little more comfortable to sit in though. I moved the strap that connects to the pole a little tighter in the front so it doesnt feel like the chair is trying to dump you out when you sit,31,243,243,0.99,0,<bound method VotableMixin.downvote of Submission(id='13s0xsv')>,/r/AutisticAdults/comments/13s0xsv/found_this_chair_at_costco_for_40/,False
