Index,subreddit,post_time,user_name,title,text,num_comments,score,ups,upvote_ratio,downs,downvote,URL,over18
42,AutisticAdults,2023-05-25 17:30:07,Neat-Application-142,Advice/help?," 

I've been trying to get into a politics server it's got 1000s of members its the biggest one out there I do not want to debate, I don't have the expressive language skills (Even as an adult) to be able to do it accurately in a way I wouldn't be run over by others. I also quite latterly can't speak on time and misplace words and sentences it wouldn't work even if wanted. But my friends are going into the server and doing debates but I don't got access to the same channels because you need to level up by having these conversations. I asked the moderators if I could be allowed in to just watch. My first couple where answered then he asked what I needed and i explained only to then have my texts where intentionally being ignored. I couldn't access DM bots and got told I was lying to which i ignored. I got asked to explain publicly, which is embarrassing but I did. Even after I explained they wouldn't budge or respond. Then got in trouble for reposting (cause it was so fast I wasn't being answered or even seen) My friends can't do anything cause they don't control what happens. I'm wondering if anyone has advice in this situation on what to do or if you know where I'm talking about to help. thanks.

 (I've even tried explaining if i could speak to a mod educated in disability nothing worked/ignored) ",0,2,2,1.0,0,<bound method VotableMixin.downvote of Submission(id='13rnv0a')>,/r/AutisticAdults/comments/13rnv0a/advicehelp/,False
43,AutisticAdults,2023-05-25 17:16:49,WhistlingBread,Anyone pretty good at confrontation?,"I’m trying to determine if I’m on the spectrum and I’m wondering if this is a common trait, or at least not a super rare trait for autistic adults.  I’m ADHD, but due to several social deficiencies I suspect I also have autism.

I wouldn’t say i’m the most diplomatic person, but I’m more than willing to confront people in situations where everyone else around me seems to be anxious.  At my last job I was unofficial the “security” because I had zero qualms asking people to leave or getting into a dispute when necessary.

The funny things is I get really nervous in social situations for people I’m friends with, or if the relationship is important to me.  But if it’s just some person on the street I can engage with practically anyone, and I’m not afraid to tell them how I feel if they are engaging in inappropriate behavior.  This just doesn’t seem like an autistic trait, but maybe I’m wrong",21,20,20,1.0,0,<bound method VotableMixin.downvote of Submission(id='13rniqt')>,/r/AutisticAdults/comments/13rniqt/anyone_pretty_good_at_confrontation/,False
44,AutisticAdults,2023-05-25 17:16:12,Independent-Alps7271,Isolation feels easier,"
I’m NB afab and 28. I realized I was on the spectrum a few years ago but am only now starting to accept it. It’s so lonely. I know no other autistic ppl. I know that could potentially help but I’m so exhausted and depressed. Sorry it’s a long one, there’s a tldr below. 

It’s not that I can’t find joy in some interactions it’s that I have to wade through so much anxiety and confusion to hit upon enjoyment. It makes interacting feel scary and not worth it. I live alone and don’t work and leave the house on average once  a week (this has gotten more inconsistent) for groceries and to do laundry at my moms. My sister also lives there. I have no adult friends besides them and a new one (my first one that’s not family) I’ve been solely texting because in person is too hard. Even with her I told her I had to take a break due to issues with isolation. 

I really love my mother and sister. I don’t know what I would do without them and their support. I like my new friend, she’s so kind and funny! But interactions always feel…well bad. 

I’m able to unmask at times with all of them but I usually end up feeling ashamed and confused about even being a person? Like hearing my voice can be nails on a chalkboard but I compulsively keep speaking and seeking reassurance (I also have OCD) then just spiral. I always cry around them and get ‘existential’ as they may say. I’m just so depressed and confused about myself and life it’s all I can focus on. I think of it as an unstoppable overflowing. It has to come out and I’m powerless to stop it. I feel like I’m too much and not enough constantly. I feel like nobody knows me and my pain. I just want to fix it maybe but obviously talking doesn’t help. Makes it worse honestly but I can’t stop. 

I feel Infantilized often. Even though I know it’s not intentional and there’s no Ill will behind it, obviously it still hurts. As if I’m just a little baby who just doesn’t get how to be a person yet. But I feel I’ve never known. 

With my new friend I struggle to feel I’m enjoying our friendship even though I know I like her and the things we talk about. My body just feels so tense when speaking with them and after interactions I pick them apart endlessly worrying I did something wrong. I always think I did something wrong and ppl just won’t tell me. Reading between the lines is exhausting. I’m struggling not to break it off out of fear and exhaustion. 

TLDR: It feels easier to isolate. I’m incredibly in my head all the time when alone and it’s hell but it feels like a “hell you know” type of thing. It’s preferable to the strain of interaction. 

I feel like I never know what is expected of me!! I’m simply tolerated. I feel like I’m in a damn play and don’t know my lines. I know I’m loved but I don’t feel loved. That I’m a black hole and it just gets lost in me. I feel like nothing. Nobody. 

I don’t know what I’m posting this for except desperation and a potential for advice. I feel so lost and lonely. If anyone has similar experiences please share. Thank you for reading I know this is all over the place and long. I had to stop editing or i would do it for hours lol.",6,10,10,0.86,0,<bound method VotableMixin.downvote of Submission(id='13rni68')>,/r/AutisticAdults/comments/13rni68/isolation_feels_easier/,False
45,AutisticAdults,2023-05-25 16:20:50,Curious_Cosmic_Owl,Am I trying to make a self-fulfilling prophecy?,"I am currently 29 F. I've been struggling during a long time with comunication and social skills. I investigate a bit and this made think that maybe I am neurodivergent. So I booked a consult with a  proffesional in autism in children (I didn't found one that diagnoses adult near me). I fill a battery of tests and she said that she would give me the result in a month. 
 Even if I don't have autisim I know ""something is wrong with me"". A month feels like a long time so I would like to askin avance:
 Did some of you had to go to more than one specialist to been diagnose? 
In case that I am not in the spectre. Did someone know which diagnoses they maybe give me?
Thank you for reading and I apologise for my english.❤️",2,2,2,1.0,0,<bound method VotableMixin.downvote of Submission(id='13rm3d7')>,/r/AutisticAdults/comments/13rm3d7/am_i_trying_to_make_a_selffulfilling_prophecy/,False
46,AutisticAdults,2023-05-25 15:48:57,SolyLunaX,"My male partner is suspected to be Autistic, but refuses to seek diagnosis/treatment. It’s taking a toll on our relationship.","My (39M) partner of 3 years is suspected to be autistic by our couples therapist that he hasn’t gone to in about a year but I still see. He shows many characteristics the biggest ones being a very negative reaction to intense emotions (especially mine) to the point that he literally physically runs away from me, and hypersensitive to any real or perceived criticism. ANY … it’s impossible to have a conversation with him about anything negative even when I try as hard as I can to use all the communication tools I’ve learned in therapy. He usually blows up and if the topic is specifically triggering he becomes verbally abusive. 

I (34F) am diagnosed ADHD and have my own triggers and issues, especially with rejection sensitivity which is the icing on the cake since he is minimally affectionate and while most days I know he loves me, it’s very difficult to actually see it. 

Anyway, I’ve spoken to him several times about my concerns for him as well as for what it’s doing to us as a couple and he’s just not having it. He refuses to go to a psychiatrist or even back to therapy with me. When we first went to therapy it was going well until it started bringing up feelings for him he just could NOT handle. 

We’re both Latinos which adds another layer of stigma to mental health which plays a huge part in his reluctance, since any kind of neurodivergence is seen as “crazy” and “lack of motivation” that can easily be fixed with faith and determination so that doesn’t help the situation at all. Not to mention it makes it nearly impossible for him to understand MY issues and MY meltdowns at all. I recognize he doesn’t have the tools yet to understand or manage it but it’s really hurting me. 

I know that inevitably if this doesn’t get any better I will need to walk away, but I would really like to find a solution. He was my best friend and has been my ideal partner in every way and I just don’t know how to move forward from here. I know if he doesn’t want to help himself there’s not much I can do and that it’s not my responsibility to do so, but I would really like to find a way. 

Has anyone been effective at getting a loved one to treatment? If it was you, how would you want your partner to approach it? Any other advice for me that would also help preserve my own mental health? 

Thanks in advance.",15,10,10,0.86,0,<bound method VotableMixin.downvote of Submission(id='13rl9ux')>,/r/AutisticAdults/comments/13rl9ux/my_male_partner_is_suspected_to_be_autistic_but/,False
47,AutisticAdults,2023-05-25 15:40:48,cyborgmonkey-,"Just getting diagnosed at 41, things are starting to make sense",I've been told by the doctor that my ability to mask enabled be to go so long without a diagnosis. I don't even know what I'm like when not masking.,27,74,74,0.98,0,<bound method VotableMixin.downvote of Submission(id='13rl2dp')>,/r/AutisticAdults/comments/13rl2dp/just_getting_diagnosed_at_41_things_are_starting/,False
48,AutisticAdults,2023-05-25 14:18:15,HabitAggravating2625,I may have undiagnosed Autism,"I'm almost 46 and have felt like I'm different all my life. I don't mean to offend anyone when I say this but I have felt and been made to feel like I was defective in some way.

I don't get people, I try but I don't understand how they're minds work and used to try to fit in but never did. I had some trauma in my early 20s that made me stop trying and since then I have lived alone with very little social communication. I find people scary I will avoid them irl because I'm scared of offending them and it turning confrontational, in that instance I will either lock up like my operating system crashed or just loose the ability to think straight making me talk loud/erratic.


I started painting models a couple of years ago and felt I did a ok job for a beginner but had nobody (friends or family) to ask if I was being bias over my own work, so I joined reddit. I posted my work and the response I had was overwhelming, I had never had positive reinforcement like that from anyone but my own mother, I literally cried with joy (it still makes me overwhelmed to think of it).

It was through my new found hobby and the kind people of reddit I eventually started to open up to people, I was diagnosed with social anxiety disorder in my early 30s and joined so I joined a reddit sub for social anxiety. It was in that sub someone surgested I may have undiagnosed Autism and suggested I took some online test.

I took those test and scored very high on them suggesting a high possibility I have some form of Autism. Since I did them (a couple of months ago) I have spent every day obsessing over what Autism is and reading/watching/listening to any information I can get.

I come to the point where I need to go see a doctor and ask for a referral to a specialist but I don't want to waste the time of a already overwelmed NHS. What if I'm not Autistic and I am just the broken thing I have accepted myself to be. I should imagen the assessment process is expensive and I don't want to waste resources on me that could help somebody in more need.

I'm sorry if I offended anyone with anything I said in this post, that was not my intention so please forgive me if I did. I have never been good at social communication. If I did offend anyone for any reason please feel free to let me know what I did wrong and how I could possibly improve myself and my understanding. Thank you!",7,12,12,1.0,0,<bound method VotableMixin.downvote of Submission(id='13rj187')>,/r/AutisticAdults/comments/13rj187/i_may_have_undiagnosed_autism/,False
49,AutisticAdults,2023-05-25 14:10:16,LadyLurkerHandz,I’m just tired,"Back to work full time in office. I can’t handle it. My husband yelled at me this morning. I have a tendency to fold clothes and not remember to put them in the drawers. And i think he’s just tired.

It’s been rough this week. I cooked dinner and paid bills and kept up with work, but something always falls through the cracks now. I’m so exhausted and overwhelmed. I was really honestly scared to even apply for FMLA but I was approved. I think I have to use it. I can’t operate like this. 

I feel like I might be in the middle of an extended meltdown. I’m not really good at determining when that’s happening cuz I tend to kinda blank out large chunks of time. But the only thing I do notice is my emotional instability. I feel like I’m lashing out on tiny stuff. And we get tense with each other. 

But everything is so goddamn expensive. And taking unpaid days off is.. idk at this point it’s necessary I guess. I’m sorry I’m just venting to release.",7,86,86,0.98,0,<bound method VotableMixin.downvote of Submission(id='13riu9j')>,/r/AutisticAdults/comments/13riu9j/im_just_tired/,False
50,AutisticAdults,2023-05-25 13:22:42,DisgruntledBrDev,Resources on Masking and Social Interactions,"Pretty much that. I suck at masking, and some of the things i do are so second nature i just began noticing them after 5 years of paying attention, so i'd like some resources on masking.

If i see something i'm unconsciously doing on said resources, i'll better understand my current mask and become more capable of taking it off, and by learning about better strategies, i can make a new, better mask i can put on or take off more easily.

If anyone can recommend me resources on tones of voice, facial expressions, conversational guides, etc, i'd be really thankful. Cheers.",1,3,3,1.0,0,<bound method VotableMixin.downvote of Submission(id='13rhp46')>,/r/AutisticAdults/comments/13rhp46/resources_on_masking_and_social_interactions/,False
51,AutisticAdults,2023-05-25 12:38:25,goblinisamazing,Help with noise reduction as I’ll be working at a summer camp,I’m thinking of going with loops for everyday wear (can you swim in loops though?) if not can you swim in defenders? We go to a huge water park a couple times this summer and I need something I can wear there but also while being in the water! All advice is helpful! Also which loops do you recommend for blocking noise but still hearing someone talk to you?,4,2,2,1.0,0,<bound method VotableMixin.downvote of Submission(id='13rgogj')>,/r/AutisticAdults/comments/13rgogj/help_with_noise_reduction_as_ill_be_working_at_a/,False
52,AutisticAdults,2023-05-25 07:55:52,That-Employee7645,Did you disclose your autism to your job?,"I’m curious to hear about people’s experiences of disclosing (or not disclosing) their autism to their workplaces/managers. There’s a poll below for a quick survey, but longer responses are always appreciated.

What is the nature of your work (e.g. hospitality, trade, professional, small business owner, etc.)?

Were you taken seriously by your manager or those you told?

Were you given any accommodations you asked for?

Do you feel that disclosing your autism has hindered or would potentially hinder your career progression?

Did it advance your career in any way, for example, via ‘reverse discrimination’, ‘affirmative action’ or any similar programs/policies?

Were you scrutinised more closely after disclosing your autism?

Are you open about it to the wider team or just a few people (manager, etc.)?

[View Poll](https://www.reddit.com/poll/13rbdyt)",36,15,15,1.0,0,<bound method VotableMixin.downvote of Submission(id='13rbdyt')>,/r/AutisticAdults/comments/13rbdyt/did_you_disclose_your_autism_to_your_job/,False
53,AutisticAdults,2023-05-25 07:31:49,xMorfil,Talking to people,"I (29f) am currently waiting for a diagnosis but I have done the assessment to get referred so I'm guessing it's likely I'm somewhat autistic. 

I have been thinking lately about how much I don't want to meet and speak with people, like at all, I have no interest in making friends. I have no interest in trying to maintain the constant contact people seem to want, and my communication in general sucks. 
Plus, my mind goes blank when people don't follow the script in my head and I have no clue what to do after script is abandoned. 

I'm trying to figure out if it's okay to be happy with no friends? 
Not trying to sound bad, I just do prefer it. I've always been standoffish when came to making friends.

Thanks for any comments.",7,13,13,0.93,0,<bound method VotableMixin.downvote of Submission(id='13rb0e3')>,/r/AutisticAdults/comments/13rb0e3/talking_to_people/,False
54,AutisticAdults,2023-05-25 05:27:52,Necessary-Ad-1178,Assessment Complete’,Just excited to share after 3 weeks all of my assessment tasks are complete and I should get my report back soon.,1,4,4,1.0,0,<bound method VotableMixin.downvote of Submission(id='13r8wo0')>,/r/AutisticAdults/comments/13r8wo0/assessment_complete/,False
55,AutisticAdults,2023-05-25 05:04:58,Ok-Eggplant4965,I hate being the first in an organisation to need accommodations,"So I need a Personal Emergency Evacuation Plan (PEEP) because unfortunately alarms send me into freeze where I can't function at all, and if I'm forced to then it'll build anxiety on top of the sensory overload and...well, we know where this is going. 

Apparently I'm the first person in the organisation to need a PEEP. They didn't even have a template for it, they had to Google it. It's taken over 12 months of asking (and a fire drill that ended badly). I just hate being the first person to need this stuff, because then I have to go out of my way to educate everyone, plus I have to push for it because they don't realise how vital it is. I know I should feel better that people after me will have an easier time, but I can't help but feel...why me?",3,37,37,1.0,0,<bound method VotableMixin.downvote of Submission(id='13r8i3a')>,/r/AutisticAdults/comments/13r8i3a/i_hate_being_the_first_in_an_organisation_to_need/,False
56,AutisticAdults,2023-05-25 03:36:56,the-puzzle-guy,It feels like my family is trying to get rid of me,"I am an autistic 22 year old man. I moved out of my parents home for the first time in October of last year after being pushed to do so by my parents and other relatives, stating it would be a ""great opportunity to learn and grow"". 

I now live over 1000 miles away from them, and have been getting replies to my texts and calls less and less often. My younger sibling graduated today and the only reason I knew is via a Snapchat story. My older sibling is getting married soon and I have no details on when or where it is happening, and I very much so doubt I am a part of the plans. I keep getting snippets of a life I am no longer a part of, or even welcome in.

I have no idea what I could have done to make my family exclude me like this. I know I haven't always been perfect, but could I have been that bad? I feel awful, hopeless, and nauseous. I did not want to move away in the first place, and now I feel stuck and alone. If anyone has any advice on how to fix anything that would be appreciated, but I suppose I just needed to vent a bit before I exploded.",7,13,13,0.85,0,<bound method VotableMixin.downvote of Submission(id='13r6tpl')>,/r/AutisticAdults/comments/13r6tpl/it_feels_like_my_family_is_trying_to_get_rid_of_me/,False
57,AutisticAdults,2023-05-25 01:18:27,Free_Instruction6888,Trash Bags,"Do normies not realize that scented trash bags actually have a second fragrance “literally garbage smell” added to the plastic?  Why!?! So you take the trash out more often. 

Same with every 11th diaper, it slightly smells used. 

$$$

That is all.",1,1,1,0.56,0,<bound method VotableMixin.downvote of Submission(id='13r3www')>,/r/AutisticAdults/comments/13r3www/trash_bags/,False
58,AutisticAdults,2023-05-25 00:27:24,Sadie_Baddie_Ivy,Why is it so hard to make meaningful friendships,"Growing up I had 1 main best friend all the way up to 7th grade. I thought it was a great relationship, but looking back I realized all it’s flaws. I was used a lot of just treated kinda poorly. I’ve had other “friends” that just used me too and made fun of me behind my back. I left highschool in 10th grade due to bullying and just feeling so unwanted and alone. I feel like I’ve only really had 3 real friendships in my life including my bf. I  moved away from my home state of PA to MD when I was 18 (I’m 21 now) to move in with my bf and it has been great for me and discovering myself, however I’ve yet to make any friends. I spend the first year in MD really putting effort into my mental health and recovering from trauma ( which led me to my autism diagnosis) so I never really thought of friends. I’m not currently working, so its extra hard.  I try to strike up conversations with ppl sometimes, but it’s extremely hard and I just struggle with conversations. I just want to meet other neurodivergent adults around me  make some real friends.",23,120,120,1.0,0,<bound method VotableMixin.downvote of Submission(id='13r2sut')>,/r/AutisticAdults/comments/13r2sut/why_is_it_so_hard_to_make_meaningful_friendships/,False
59,AutisticAdults,2023-05-24 20:41:34,thetreecycle,My first word was “beetle”,"Like the insect. I don’t know why but it was my first word, my parents thought it was funny. Anybody else have odd first words?",54,44,44,0.92,0,<bound method VotableMixin.downvote of Submission(id='13qx2j9')>,/r/AutisticAdults/comments/13qx2j9/my_first_word_was_beetle/,False
60,AutisticAdults,2023-05-24 20:39:50,FlamingPhoenix24,Collective Effervescence & Autism,"I'm curious to hear opinions on this phenomenon. Specifically, I'm wondering if anyone else actually dislikes the feeling of collective effervescence.

My special interests are psychology and religion, so naturally I'm very interested in the many places where the two meet. I've recently stumbled across this idea that a large part of what motivates people to participate in religious group activity and attaches them so strongly to their particular tradition is this seeking after and enjoyment of collective effervescence (a phenomenon where individuals in groups can begin to feel and act as a group rather than individuals). I've read that people seek after this experience instinctively to develop and strengthen social bonds. This has been posited as a possible explanation for group religious experiences of connectedness with a god or gods, the holy spirit, etc. It also is thought to be part of why people in modern times enjoy group activities such as sporting events and concerts, which have shared mechanics and psychological effects with religious group activities.

The kicker is, I hate this feeling! I've experienced collective effervescence and it felt like my brain was hijacked by a stranger. I also don't care for concerts or sporting events, but I always assumed it was because of the overwhelming stimuli. Now I wonder if it also is due to my avoidance of this phenomenon. Also, despite religion being a special interest, I am not religious. I've tried to participate in multiple religions and join multiple religious groups due to my high interest in religion, but none of them ever fit for me. I'm curious if this is an autism thing, but I can't find any data online, anecdotal or otherwise, about autistic or even other neurodivergent opinions/experiences related to collective effervescence.

Please let me know your thoughts and opinions if you like.",24,28,28,1.0,0,<bound method VotableMixin.downvote of Submission(id='13qx0y3')>,/r/AutisticAdults/comments/13qx0y3/collective_effervescence_autism/,False
61,AutisticAdults,2023-05-24 20:18:29,trev_thetransdude,Do you have an ESA (emotional support animal)?,"If you say yes, this implies that you have a letter from your doctor or therapist, etc.  that your pets are needed for emotional support.

Also, feel free to state what your emotional support animal helps you with if you please

[View Poll](https://www.reddit.com/poll/13qwhc3)",10,4,4,1.0,0,<bound method VotableMixin.downvote of Submission(id='13qwhc3')>,/r/AutisticAdults/comments/13qwhc3/do_you_have_an_esa_emotional_support_animal/,False
