index,subreddit,post_time,user_name,title,text,num_comments,score,ups,upvote_ratio,downs,likes,URL,over18,ASD
220,Advice,2023-05-27 10:40:00,Foxglove_4,Healthcare Provider Won't Resend Check that Bounced,"So back in April I received a $30.00 refund from my healthcare provider, and I attempted to cash it on my banking app. I checked a few days later and the amount still wasn't there, and then I received both a digital and in person letter from my provider saying I was one of many to receive a duplicate check, so my check did not go through and I cannot cash it.

I call the number for Accounts Payable that they put on the letter about 10 different times, and each time the person on the line did not understand my issue, they seem Just as confused as I am.

I was even given 2 other numbers from them that directed me to billing, and they did not understand my problem either.

&#x200B;

Eventually, I got one of the agents to email my issue to their manager, since no one was able to help. I finally received an email saying that they would look into it and re-issue me a new check. I ALMOST got it and then they sent me another email shortly after saying that my check's funds were deposited, which is not true. There was no pending funds or deposited funds anytime for that amount in the month of April on my bank statements.

&#x200B;

It has been over a month and I am sick of jumping through hoops for what should have been a simple fix, and I know $30.00 is not a lot to some people but that could really help me out.

&#x200B;

For more background information, I have been with this provider since 2020 and my parents also received a check from them last month, only there's DID go through, so I highly doubt this is a scam, just seems very fishy to me and I don't know how to proceed.

&#x200B;

Any advice will be appreciated, thank you!",0,1,1,1.0,0,,/r/Advice/comments/13t42if/healthcare_provider_wont_resend_check_that_bounced/,False,False
221,Advice,2023-05-27 10:36:06,kousenseii,I missed one digit in bank account number,"So I was transferring money to my friend's bank account then I noticed it's being delayed turned out I've put wrong number, it should've been 12 but I've only put 11. All the numbers are correct and the name but one digit is lacking. Will the money be returned to me? What will happen..",3,1,1,1.0,0,,/r/Advice/comments/13t40a7/i_missed_one_digit_in_bank_account_number/,False,False
222,Advice,2023-05-27 10:35:55,Affectionate_Day3197,Would I(20m) be rushing a relationship and would that be bad?,So I(20m) recently just kind of started dating my friend(19m) and we are meeting as a couple for the first time on Wednesday with friends and we're just going to be out in the city getting lunch then watching a movie at the cinemas but I was recently told my parents will be away on holiday then and for the weekend and I was wondering if it would be weird to invite him up to my house so soon. I feel like rushing things before can and has ruined the romance and i really like this guy and don't want to ruin things between us.,1,1,1,1.0,0,,/r/Advice/comments/13t4073/would_i20m_be_rushing_a_relationship_and_would/,False,False
223,Advice,2023-05-27 10:32:05,Sho_up,Should I break up with my boyfriend?,"So long story here. Buckle up. (I shall use fake names for this story) 

Logan and I (Sara) have been together for 4 years this December. Met when we were 18 on tinder and clicked and have been together ever since. We will be turning 22 this year. I am 3 months older September 2001 and he’s December 2001. We have similar interests and we like spending time together, we’re close and he’s my best friend. Honestly we’ve raised each other and part of me can’t imagine my life without him. We’ve been living together for just over 2 years and have lived with his parents, on our own and then with my younger sister. 

We’ve been through so much together, his parents (very toxic) and their treatment of me, which we’ve sorted but still is kinda painful, my mums death (she was a narcissist but I’m her oldest daughter and we were still quite close), my struggles with obesity and PCOS/endometriosis, his poor mental health and undiagnosed depression, financial hardship, Covid 19 and the Aus NSW lockdowns, my complicated relationship with my father and younger brother and so much more. 

Although the main reasons I’m thinking about leaving him are as follows. 

1. Tonight he got upset and overwhelmed and punched a hole in our garage door, this isn’t the first time he’s done something like this. Once he was so angry he threw a McFlurry at the ground and screamed, he broke his hand in 2 places in early 2021 from punching a floor. He knows this behaviour triggers me as my boyfriend before him threw a brick through my window and constantly screamed at me for the little things which has caused me some trauma. I’ve attempted to communicate with him multiple times and he acknowledges every-time, this happens usually once or twice a year, although the arguments and screaming has picked up over the last 3-4 months. 

2. I’m not feeling very sexually satisfied. We have our once a week and it’s usually hand stuff which is okay but I’ve expressed an interest into other things and a different frequency and I’m denied or we agree and then it’s the same stuff every-time. Consent is important and I do respect his boundaries but even then he finishes and it takes me ages to because I’m not 100% enjoying myself. 

3. We have been together 3.5 years and not once has this man cooked me a meal, yes he’s made me toast and noodles, and grabbed the Uber eats from the door, but he’s never made me a meal because “my cooking tastes better”. We’ve talked about weaponised incompetence he is quite intelligent and knows how to make meals, and he says he will try harder and hasn’t.

4. Also not once has he planned a date, he’s paid for quite a few but never called to book a table or surprise me with something special I’ve booked and organised every single one in all 3.5 years. He also hasn’t bothered to get his licence so I do ferry him around quite a bit (contributes to gas and rego) and even though again I have tried to communicate with him about these issues I am met with “I will try harder” and “I don’t want to get my licence” “I don’t like driving” etc, even though our lives with benefit greatly from him driving, taking himself places, going to his own appointments etc. 

5. Final main point is I basically mange his life. I have a genuine belief that if I don’t run his errands for him he wouldn’t do it. He is listed as a dependent under me on his doctors forms because he doesn’t want his own account, I have to remind him to call his grandparents, I go out and get him new socks when his got lost or have holes, sew the holes in his pants, remind him to pack lunch and take house eyes etc and drop off lunch/house keys when he does forget. it makes me feel like his mum which I hate. I have mentioned little things here and there regarding this specific issue but we haven’t had a massive conversation. 

I would like to add to some of the positives as I feel like so far I’ve only focused on the negatives. 

He is incredibly funny and intelligent, in my eyes physically he is beautiful, flawed like every human but somehow I feel I can look past almost anything he does and be okay. When I see him I see home, comfort and fun. He is generous, has great friends and people skills, he usually shower with me. Washes my hair and face, cuddles me when I need, strokes my hair. He smells great even when he doesn’t and we have a 2 thirds 1 third on the finance split in our house. Logan works a full time job and I have a permanent part time job and study. He washes clothes for me and takes on and puts on my shoes for me when I get home/leave for work. 

I guess my main issue is am I staying with him because I’m comfortable or am I genuinely willing to look past these rough times and move on with him? I can see us getting married (although I’m not sure how he feels about commitment) and having children, I can see him being a great dad. 

Just need some advice I guess, all welcome.",1,1,1,1.0,0,,/r/Advice/comments/13t3xzw/should_i_break_up_with_my_boyfriend/,False,False
224,Advice,2023-05-27 10:31:35,BuddyInteresting1360,Instagram bot scammed me,A instagram bot messaged me and i said shut up bot she said she aint no bot and she sounded like no bot so we wrote a little bit and added on Snapchat and send just a Picture of my face. Then she send me a picture of my Instagram followers and a photoshopped pic with my face and not my dick in it and now she said if i dont cooperate she will send it to all my followers. I blocked her in sc and insta but im not sure what will happen next. Does anybody know if she will send it or not or what i should do next?,2,1,1,1.0,0,,/r/Advice/comments/13t3xp7/instagram_bot_scammed_me/,False,False
225,Advice,2023-05-27 10:29:39,blackwavves,Siblings money problem advice,"Hi everyone, I have a situation that needs an outside perspective. 

My mom passed away a few years ago but had an agreement with her job through her insurance to gift a family member a certain amount of money for life every month after she passes away. I have a small family with just my sister, dad and me. So my mom near the end of her life decided to give my sister the amount of $500 bc it was the most amount she qualified for. (I would of gotten $350.) My sister who is 8 years older, also bought her first home before that time and is renting it out with a slight profit. My mom also thought my sister would use the extra $500 for life for helping pay the mortgage of the Maple house, as we call it. The one thing my mom left me was a stock account worth $5000. My mom loved us very much equally. We never had the conversation about the fairness of the distribution of money. Well it’s been about 2 years since my mom passed and my sister has been receiving a free $500 every month since she passed, for the rest of her life. If you do the math, in 40 years it will be close to $240,000 she would of gotten for free. 
Well my dad’s health is declining and we are setting up a trust. We are having a discussion, and we talked about making things 50/50 between us so there is no bad blood with money between us. She has a house with her husband and the other home she rents out. I told her how I felt it’s unfair that she is getting all this money and if it was are gonna be 50/50 from the parents then shouldn’t that be apart of that too? 
After many discussions, she agreed it’s better to pay half than have bad blood between us. I told her that if things were reversed and I got the gift of $350, I would’ve shared 50/50 with her. We are the only family we have, and we should share things equally for when my dad passes away.

Do you think it’s wrong for me to think we should share this $500 for life? Or is that fair to be equals with everything?",0,1,1,1.0,0,,/r/Advice/comments/13t3wfn/siblings_money_problem_advice/,False,False
