index,subreddit,post_time,user_name,title,text,num_comments,score,ups,upvote_ratio,downs,likes,URL,over18,ASD
1175,Advice,2022-12-31 03:19:23,emdelgrosso,How do I handle my invasive neighbor?,"Context: 
My husband (M25) and I (F24) (no kids) moved into our first home in April 2022. (Southern USA)

The couple that lives on one side of us (“our neighbors”) is older and retired, has lived here for 2x longer than I’ve been alive, have 2 grown kids that have each moved to opposite sides of the country that they don’t see often, and they don’t have any commitments/hobbies other than the husband painting as far as I know. All this to say they have a lot of time and probably less social interaction than they need. 

Situation:
Our neighbors started out very kind, albeit with a much more intense level of involvement with us and our goings on than I had ever seen or experienced but know sometimes people have “nosy neighbors.” But I knew they were kind and well intentioned.

A little bit ago, my husband bumped into them out and about and ended up casually mentioning that I had a medical test coming up. This happening has ended up creating the most overwhelming, frustrating, taxing interpersonal situation I have dealt with in my entire adult life. I know that sounds dramatic. Keep reading.

Since that first test, unfortunately for me, the doctors have found more and more concerning things and have assigned me more and more tests. I have had at least one upcoming test at all times for months at this point, always being promised answers if we just do one more scan/test/procedure. Every single time one of these appointments is approaching, I get a text message from my neighbors telling me I’m being prayed for and asking if I need anything. Every single time one of these appointments pass, I get a call asking me how they’ve gone. 

This has been well intentioned of course, but feels invasive and adds to my overwhelm. 
But I’ve navigated it. Until today. 

I texted her today to let her know how today’s test went so that she didn’t blind-side me while I am in public tomorrow (and so that I could control the timeline, knowing she is going to ask me soon regardless). 
She calls. I let it go to voicemail (my throat hurts from my test today, talking makes it worse, and I am fully out of socializing today) and she texts me asking to call her when I can. I let her know I’m in pain and emotional and will call if I feel up to it and appreciate her caring. 

THEN! My doorbell rings. I’ve been recovering all day. I feel awful. I have been crying all day. I don’t want to socialize. It’s 9 p.m. 

I send my husband to go send her away. She insists she “just wants to hug, doesn’t have to talk.” He knows the shit storm he’d be in for if he made me talk to her, so he kindly said he’d pass on hugs and got her to leave, and then…

SHE. CALLS. MY. FATHER. 

Who I do not live with! 
She doesn’t know my dad knows anything about my medical things. 

This is so far beyond and past anything I am okay with. I feel totally violated. I feel frustrated. I should not have to carry this emotional burden of handling this. 

I can’t handle this the way I feel inclined to because I have to live next to them for an indeterminate amount of time. 

What do I do? What do I say? How do I handle this? Please give me any ideas at all. I’m at my wits end. 

I just want a friendly wave when we see each other outside. The occasional request to keep an eye out when either of us are out of town. A normal neighbor relationship. I’ve never done anything to allude I want anything more.",41,5,5,0.73,0,,/r/Advice/comments/zzjz8x/how_do_i_handle_my_invasive_neighbor/,False,True
1890,Advice,2021-01-19 10:06:47,bwssoldya,Struggling with selfishness versus being there for others,"Hey r/Advice,

I have been dealing with an internal struggle on and off for the past little while already and today it seems to have gotten to a point where I'm ready to ask some advice on the matter. It is the struggle between being a good friend and selfishness.

I have felt like a selfish person (in the bad way) for a while now, dealing with my problems, talking about myself a lot (this issue is here while writing this as well) and laying focus on myself. I've really taken notice of it this last year and I've decided I don't like being selfish. I want to be less selfish and focus more on the people around me. I want to hear them out, I want to help them with their struggles and I want them to be in a place where they enjoy being.

This however goes against the other side of me, the side of me that is hurting, that is in pain and that has helped me survive for the past like 5 years. I have no official diagnosis, but I'm pretty sure I am suffering of some form of depression, given how lazy I have gotten and how I beat myself up, both emotionally and in some ways physically as well (with junk food, taking care of my body etc).

Now that you know the two sides that are at play, I'd love like to explain the situation and go through some of the internal debate that rages within me. A good friend of mine is going through a tough spell in life. They have just broken up with their SO last week and yesterday they had some news that causes them to think their job might not be as secure as they had previously thought.

Over the course of this last week I've been talking to them about their breakup and I've kept on tell them I'm there for them and they need to reach out if they want my help and I've offered to hang out in voice chat with them when they're lonely in the mornings etc, been DMing with them on an almost daily basis to talk them through the rough patches and basically offering my support, trying to tell them everything will be alright and things will be better in the future. This has been going on for a week now and I totally get they are feeling down and in the dumps and life is taking a shit on them right now and I've been there and I know you have too.

However, since yesterday morning I've felt actually fairly happy since a while. Even though there's plenty of nasty dark clouds drifting over towards me as well, but I've not really had a break in the grey clouds that have been the day-to-day of my internal thoughts over the past 5 or so years, so to finally have a glimpse of a blue sky and some sunshine really gave me a good boost.

Today however, with my friend taking a few steps back down their emotional state where they were just last week as well, I am having a serious discussion on both sides of my being. On the one hand I want to be a good friend for them and be there for them,  I want to offer my support to them, I want to reach out to them and do .... I don't actually know what to do, I have no idea what to say or do to help them out, I know the feeling is shit and I've not really conquered it myself, so I don't know what other advice I can give besides ""hey things will be alright"". But I want to be there for them, I want them to not feel as shit as I have, or maybe improve it somehow. On the other hand, that would probably require more voice chat's as well, but I personally don't really enjoy the voice chats that much and on top of that, I'm feeling fairly alright today and yesterday and I don't want to go back to that place myself either, it's been a while since I left that place.

The thing is, this friend hasn't reached out to me today and from where I'm standing, I don't think it likely they will. They haven't asked me to hop into voice, they haven't asked me to DM them asking them to go into more detail on what they are feeling and they haven't asked for my support and part of me is going ""I really don't want to reach out to them again. It's all I've done for the past week or so and I've set aside my dislike for voice chats etc. to be there for them, I've offered to watch their favorite TV show with them, etc., all for them. I myself am feeling quite alright generally speaking and I don't want their 'negativity' (big word, I know they can't help it, but at the end of the day it is negativity) to ruin my day too. My past years have been bad enough by themselves. Let them reach out to me and maybe I'll consider responding, but maybe also not because of the last reason"".

On the other side however, I have this part of me going ""Dude. You offered to be their friend, you have on multiple occasions told them you want to be there for them and you want to help them. You have also decided that you want to try to not be as selfish as you have been and still are and it takes a lot of effort to be selfless, but c'mon, you made promises and you genuinely also want to be there for this person and you can't even be selfless for that. How can you call yourself a good friend if you can't even put your own feelings aside for a friend going through a deep deep valley in their life?""

Which gets answered with a ""yeah, and where was this friend when I was going through these deep valleys huh? Where were they for me?"", which sounds an awful lot like Ego, I do realize that.

To which the other side responds with ""What don't you understand about being selfless? The whole point is that you do it and not expect anything in return. Just because they weren't there for you doesn't mean you can't be there for them. Also you didn't reach out to them either, much like they are not reaching out to you right now and you know how shitty you felt. Maybe instead of letting them go through the same thing you went through you can reach out and they'll have a much easier time than you still have"".

**Question**  
So here finally I have the question for all of you: How do you deal with this sort of internal struggle? How do I make the right choice? Both for my friend and for me if at all possible? This struggle between selfishness (and Ego is on that team here and there as well) and between caring for others is a tough one and I don't know how to make this call, I need some help and I could ask my mother, but it feels like she is biased and I won't be getting the answer on *how* to deal with this and more on what to do in the situation, which doesn't help for any future similar situations.

Any advice or help would be much appreciated and even if you don't want to comment or plan to comment, thank you for reading through it all, it's been a long read and I appreciate it. I hope your day is going well and either way, I hope it only gets better for you.

Sincerely yours,",10,2,2,1.0,0,,/r/Advice/comments/l0gykk/struggling_with_selfishness_versus_being_there/,False,True
1977,Advice,2022-08-29 21:47:02,introvertedfreak21,Best way to get rid of ants?,"So, I've had an issue with ants for a long time. I've tried thus shaker bag of ants killer and put around the outside of my house but they came back, I've kept a spray bottle of water, bleach, and peppermint to kill them when I see them in the house. I made sure there was no food left on dishes I put in the sink, and so on. Recently I noticed they came back and it's through a seal break on our back door. We rent so we can't really do anything and if we say we found the seal break because of ants, we are told bugs are our problems to deal with. I couldn't really figure out what they were after because they were in an area that we don't eat near and isn't close to the sink. Earlier today I decided to see how many packaged muffins we had left since we buy them in bulk. Come to find out, the ants were trying to get to the muffins. It seems the packaging was well sealed because they couldn't get through. They mostly wanted the chocolate muffin so I just took the few muffins we had out of the box, put them in a gallon ziploc bag, and threw the box away. I could see in the packaging that there were no ants in the food, just crawling on the plastic trying to get in. So, I've come to ask what others recommend. I can't afford the expense of calling an exterminator nor is the problem bad enough that I need one. Just a few ants get in but nothing too crazy and they are small black ants and we don't really get bit by them.",3,1,1,0.67,0,,/r/Advice/comments/x10wcg/best_way_to_get_rid_of_ants/,False,True
1989,Advice,2021-10-24 00:26:29,introvertedfreak21,Help cheering up a partner,"So, my boyfriend(25) and I(24f) have been together for almost five years. Even though we've had all this time together, I sometimes fill struggle to figure out how to cheer him up. One thing to consider is that he has very mild autism, its almost unnoticeable to most people. I only see small things with it, like a lack of empathy sometimes.

My problem I think lays mainly in helping make him feel better about himself. We come from very different backgrounds. I grew up poor, had two family vacations my whole life. My family scraped by with what they could and they never made it easy on themselves. They liked to drink and party like they were in their 20's and use their kids as therapists. I grew up in a very unstable home so any achievements I made, no matter the size, meant a lot to me. Buying my own car on an auto loan meant a lot even though it was totaled a year later. Moving out on my own meant alot, even if I had to have help to do it. Every little step meant something big to me.

My boyfriend is the opposite. His dad pretty much went to the military, worked on planes there, and once he was out, pretty much got a really good job. He wasn't set for life by any means. He had a wife with two kids not his own to take care and then his own kid as well. He had to not only work his job building planes, but a second one to keep up with the problems around his wife. Once she had passed away, his dad used that money form her death to just take the kids of a bunch of vacations. He didn't want to think of his grief, he didn't want his kids sad. I understand the sentiment but at the end of the day, I feel he should've given his children time to process their grief and have them a stable environment.  My boyfriend had been on more vacations than just the ones right after his mom's passing. He was only 14 at the time, once his dad moved on and met another woman who also had a good income, they took a lot of vacations and usually brought their families with them. 

But besides the vacations, Ben's dad never really pushed him much in school to do well. Always told him that to just go into the military and they will set you up for life. He has great ASVAB scores but because of his autism, he refused to see the military as his family. They couldn't break him like other soliders but also he had a hole in his heart they worried about. He finished basically training but they just discharged him. He hurt a lot after that, he felt like such a let down and couldn't believe he failed. Next he went and tried going to school to become a jet mechanic like his dad, even got a huge loan on his head just in hopes that would pan out. He did great in the classes, always good scores. But when it came to the final tests, he couldn't pass them. Not all his fault, a part of the test was not taught to him which was wielding metal together. After spending too much many and failing too many times, he gave up on that path and once again, felt like a failure. Nowadays, he can't seem to shake that feeling. I've tried my best to make him feel better but I just don't know how. I've slowly been working on his issues form the problems his family caused, like getting him use to being touched, pointing out stuff he shouldn't bring up around others, and helping him show its safe to come to me when he feels down. I know it isn't easy, his family really didn't treat him with much love as a kid.

I mainly just want any advice on how to help show him he's not a failure, that he can accomplish things on his own and doesn't need to rely on others. He mainly worries about the student loan on his head as its about $29k left on it form the original $40k. I try to remind him of what things he has accomplished but they all seem like small stuff to him, like living on his own with me and my roommate. It also doesn't help that his dad makes it seem easy to just be successful and pressures him to do better as an adult. He also acts like that just because Ben is over 21, he should have his life figured out.

Any advice would be appreciated. I just love him so much and want him happy.",0,1,1,0.67,0,,/r/Advice/comments/qeh49r/help_cheering_up_a_partner/,False,True
1990,Advice,2021-09-11 12:38:17,introvertedfreak21,Feeling sore without doing much,"To give a bit of background, I recently quit my job at a warehouse to work in a pharmacy. The warehouse job was having us work 12 hour days almost every day with only the weekend off. I was experiencing a lot of medical issues form it. I had one doctor tell me the job was causing early arthritis and I had a panic attack at work that lead me to find out I had an anxiety disorder. I quit the job about 4 days ago and started my new job. I am still in training so I'm not on my feet a lot and just doing the training stuff. I work short 4 hour shifts until I finish training. However, I still feel so sore all over. My body aches a lot more than expected, my legs especially. I'm just worried my old job did more damage than I thought. I also have scoliosis in an S shape so my back being sore here and there is normal but my legs aren't normal. Any advice would be helpful.",1,1,1,1.0,0,,/r/Advice/comments/pm6oxa/feeling_sore_without_doing_much/,False,True
1994,Advice,2021-08-12 23:28:25,introvertedfreak21,Struggles wirh finding a woman,"I'm a 24 year old bisexual female. I've been in a committed relationship with my 25 year old boyfriend for 5 years now. Since I grew up in the South where there isn't a large LGBT community, it was hard to find girls to date before I was with my boyfriend. He's very open minded and doesn't mind me trying to just find a woman to mess around with. I think part of it is because he wants me to get over my trust issues with women since I've had a lot of failed mother figures and terrible female friends.

For awhile, I gave up on trying to find a girl. This is because it was just hard. I'd match with a girl, we would chat for awhile and she would either just ghost me after a week or start making plans to meet and just never confirm a time and date. Recently, my best friend(25m) got a girlfriend who is also bisexual. She's really cool but he's made it pretty clear he is not open to her being with anyone but him. I respect that but it has made me want to try again because she is so very open about being bisexual and it was just such a breath of fresh air to me. I never realized how suffocating living in the south really is to me. I plan to move eventually.

Now my current issue. I made a tinder looking for only girls. I've managed to get a good few matches and I messaged most of them first. Only one responded back and she just stopped talking suddenly too. The others just don't respond. I guess I just get discouraged easily. I wanted maybe some tips or advice on how to handle this situation. Maybe there is a certain way I talk that turns them away, maybe they expect me to move faster than I actually do. I try to at least get to know the people I talk to before I think about moving to intimate stuff.",7,1,1,1.0,0,,/r/Advice/comments/p3bj2r/struggles_wirh_finding_a_woman/,False,True
