index,subreddit,post_time,user_name,title,text,num_comments,score,ups,upvote_ratio,downs,likes,URL,over18,ASD
2000,Advice,2021-06-01 21:19:38,introvertedfreak21,Unsure on reconnecting with my older half-sister,"Hi, I'm a 23 female and this is gonna be kinda long.

Some back story first to get a full picture. My sister and I share a mom but not a dad and have a six year age gap. My parents split when I was 3 in an ugly divorce. My dad choose to try and be a part of my life still and I think my sister resented that because her dad just left. My dad tried his best to also be a father to her, he did help raise her with my mom before the divorce but she didn't want him as a dad after the divorce. 

Up until I was 11, I lived with my mom and sister. Most of the memories are blurry to me as I was forced to take heavy medication for ADHD.  When I was 11, my dad got custody because my mother was a drug addict and would let my sister and I live in filth. It was bad, as in cat feces and empty pill bottles all over the floors, flea infested beds, I even found an old report card form my time there were I had missed 93 days of school. We lived in a house my grandfather owned, once he came to live with us, he helped get rid of most of the cats, cleaned the house up, and helped take care of my sister and I. Since she was so much older, when my sister was home, she would either take care of me or completely shut me out. Most times it was my grandfather but he had to work a lot and this was all because my mom would just sleep all day. My grandfather wasn't without his vices too but they were much more minor, just stuff like some pot or beer when he wasn't working. That was all just to give an idea of the kinda home I had then. 

When I was 13, my dad managed to ween me off the meds enough that the doctors said I could completely stop taking them, he let me make that choice and I stopped taking them, I couldn't stand them. They made me feel less me, like I was a watered down version of myself that could only really think all the time. Shortly after that, I remembered parts of how bad living with my mom was. I remembered how bad it was and living with my dad made me realize that wasn't normal. I thought that my mom needed help, a push to make herself better. So, I cut contact with her until she got sober. I kept in contact with my grandfather and sister for a few months after but seeing them just made the decision harder. They would talk about how good she was doing and that I should come see her, trying to make me feel guilty. More than anything, they blamed it all on my dad. I had to cut contact with them too.

When I was 15, almost 16, I decided to reach out to them again. It was because I wanted to know more about my mom and hope she was better. It was emotional to say the least. What I remember most was being able to tell who my sister and grandfather was but then seeing this woman behind my sister with dark hair and was very thin. I didn't realize who she was till she hugged me and cried about her baby. I didn't recognize my own mother. She went form being 300lbs to only 95lbs at 5'4"". She didn't look healthy, she scared me honestly. She looked like skin and bones. I know now that it was probably a combination of loose skin and drugs that made her that way. It wasn't a good idea to see them, I honestly regret it. They filled my head with these lies about my dad, tried to make me believe he was abusing me(I had bad ance that he would pop sometimes which hurt but it wasn't abuse) and just all these nasty things. My mom ended up calling child.protective services on my dad. After my dad got me back home, he talked to me about what happened and helped me see that my mom and sister just used me to hurt him again and what they said wasn't true. I decided to cut contact again after that happened.

A year passed and with it, so did my mom. She died of s drug overdose and that fact ripped me up inside. I believed so heavily that one day she would overcome her addiction so we could have a healthy relationship, I really wanted to believe she loved me more than drugs so to die in such a manner hurt. I remember the morning my dad told me, he work me up after my stepsister left for school, made my favorite breakfast sandwich and sat at the table. As soon as he told me, I just broke down in tears. I still tear up thinking about it. He let me stay home from school so I could process my feelings. That Saturday, we went to see my sister and grandfather to mourn with them. I wanted to see my uncle too but he was inside so I left my dad's side to go see my uncle. I talk to him when my sister came in the room. I gave him a hug and my sister joined the hug. Then she whispered in my ear how my mom couldn't live without her baby. She put the thought in my head that my mom's death might not have been an accident. I ran back to my dad crying, told him what my sister said and we went home after that. We went to the funeral, sitting away from my sister and grandfather while it happened. I cried the whole funeral, it was just hard to accept she was gone and I struggled for years on how to accept her death and how she died. I eventually accepted that her death was an accident and that there was no deeper meaning behind it. My sister blamed my dad for her death and why I didn't talk to her anymore. She would every now and again send me a message on facebook about her missing me and how my dad was keeping us apart like he controlled me.

My dad is no saint though. He was a great dad for most of my life but in the end, he made mistakes too. I felt more like just a tool while living with him and my step mom. She treated me like a second-class person, like I was below her and convinced my dad that I was mean to her for no reason. He always promised to leave her but never did. For a year he had a lot of seizures that was linked to a clogged artery that really affected how he thinks and acts now. Its probably best he was with her for that because she has a lot of experience with seizures and does her best to take care of him. I don't like her still but as an adult, we get along. She stopped trying to be a mom to me and has just become my dad's wife.

Now to today. I never had the real strong urge to reach out to my sister. She seemed to being going down the same path our mom took, doing drugs, dropped out of school, never got a job, and just lived off the money the government would give her and my grandfather for the three kids she had with her drug dealer boyfriend. Maybe I'm really just looking for validation on keeping things the way they are. I briefly felt like maybe reaching out wouldn't be bad if I set firm boundaries with her and just finally get more information about my mom. I always felt like part of me was missing, I never really knew my mom at all and only got bits and pieces about who she was form my dad. She was already lost to drugs by the time I could remember anything about her. I am just unsure if I should reach out to her, if I really need that kind of trouble in my life. Keeping out of contact would change nothing about my life as it is and I'm content with where I am as a person but reaching out feels like it might just cause more problems in the long run and add really nothing to my life as is. I might also just be looking for a support system in the wrong way, its hard to live life when the people you expect to support you have failed you a lot as well. Honestly, I only really have three people I feel won't ever hurt me or just leave me. So, any advice would be helpful, I might just choose to keep out of contact because it just feels like the best option since she seems so convinced that my dad is to blame and may be beyond reasoning out of that.",0,1,1,1.0,0,,/r/Advice/comments/nq4xct/unsure_on_reconnecting_with_my_older_halfsister/,False,True
2001,Advice,2021-05-29 23:49:07,introvertedfreak21,Advice on becoming normal after leaving an adusive home,"This one will probably be really long as there is a lot to unpack. I am a 23 female.

To start, I moved out of my dad and step mom's home in December 2020. I couldn't be happier, this has been one of the best things for my mental health but I am struggling with it at the same time.

It really never hit me how bad my home life was until I got into a healthy relationship with my bf, he has been very supportive and helped me a lot when things with my family was bad. I would like to say it wasn't always bad, it was mainly just my step mom and I butting heads a lot because she couldn't understand why I wouldn't want to be more girly and blamed every issue I had on ADHD and always comparing me to my little sister, her daughter form a previous marriage. I had a good relationship with my dad and stepsister, it was mainly just my step mom I had issues with but it wasn't bad until we moved form our family home in a quiet neighborhood to this home far form the city with lots of land.

After the move, things didn't go well. My parents went into a bunch of debt to get that home and get it the way they wanted. That seemed fine because my dad had a job he was making decent money at but it wasn't a stable enough job, it was all contract work for putting appliances in people's homes. Things weren't good between my dad and his boss so he tried going solo. The money issues piled up, dad wasn't making a lot of money and my stepmom's job was only making sure ends meet, debts weren't getting paid. There were times I had to pay our electric bill because someone showed up to shut it off while I was home alone form work.

They charged me crazy high for rent in a home with three adults and one minor(my sister was in highschool most of this time up until May of last year). It went form 300 to 400 to 600 for my bedroom. I also had to pay my own car insurance and all issues that arose with that car. It wasn't easy, I could never save money because I couldn't stand being there. I would make sure to be gone every minute my parents were awake. Leave two hours before my shift just so I could be gone, hang out at my bf's after work just to stay gone, be at his house all weekend long. Just. To. Be. Gone. I couldn't take it because almost every night someone was drunk or high and the other was screaming. Some nights I'd come home from a 12hr shift at work only for them to have all their friends over to be loud and drunk by the pool. It was like living with bad college roommates and I was the only adult. 

I hated the holidays because of them. I remember Christmas being the worst. One christmas my dad threatened to not give my sister and I anything at all because we whined a little about some christmas photos. Even though stepmom made us stand outside in cold weather in Christmas dresses. We did it, we did our best to pose but we whined a little because we were cold. We were also 21 and 16. Another Christmas was ruined because my dad mixed alcohol and Xannax together. Most know not to do this, we told him several times that he becomes so ugly to us when he does. He did it anyways, yelled and screamed at us about not caring about him and demanded that I, his own daughter, go get his gun and let him shoot himself in the head. He eventually went outside to sit in his truck because we wouldn't listen to him, my step mom had to fight him to get his pistol away because we honestly didn't want him dead. We were so thankful the neighbors didn't call the cops form their screaming. I remember at one point hiding myself and my sister in my room form my father as he and step mom screamed at each other that night. Once he left for his truck, we were able to try and do Christmas Eve stuff together and he eventually came back inside and apologized for being ugly. That was the last Christmas Ever I spent with them, I made sure to get out before the next one.

Now, the part I need advice on as that was all to get an idea of where my problems come from.

I currently live with my bf and our mutual male best friend, Ron. Bf and I both come from small families, him being the baby. Ron however comes from a happy split family. His dad has two other sons and three stepkids, all get along well. His mom had two more kids as well. Ron is the oldest of 7 kids so he is use to always having someone around and people to mess with. I'm not use to it, every now and again I catch myself reacting to Ron or BF just walking by, making a noise, things like that. I'm so use to reacting in fear, preparing myself for a fight because my dad or step mom is home and drunk. I'm struggling to let my guard down I guess. Mainly just with Ron because he will just come by and touch me, just walk past me to get to the fridge, or make noises to mimic a show I'm watching. Its all harmless stuff and I know but I'm just so use to being combative that I have to keep catching myself from starting a fight needlessly. I know he means nothing by it, I know he's just use to having lots of siblings to pick on around so going form households of at least 5 people at a time to just a small place of three people is hard. I just need advice on how to let my guard down and stop seeing every thing as a need to protect myself.",3,2,2,1.0,0,,/r/Advice/comments/nnz5qw/advice_on_becoming_normal_after_leaving_an/,False,True
2316,Advice,2021-09-08 19:27:29,linguisticshead,"My dad tells me to prepare for my dog's death, but I have no idea how. Can anyone help?","Hey everyone. In October last year we found out my 12 year-old dog has cardiac failure. Since then, she has given us a few scares and we thought we were going to lose her, but she is still here and soon-to-be 13 years old. My dad tells me she doesn't have much time left and I know he is right. He tells me I should prepare for her death, but I have no idea how. I spend as much time as I can with her, but all I can do is cry in bed at night every day. 

She has been with me since I was 6. I won't even try to explain how much this baby means to me. She is a loving, brave and wonderful dog. I know we don't have much time left, but I don't know how to prepare to her death. I just simply can't imagine my life without her. This has been so hard. Please, any advice would help.",4,3,3,1.0,0,,/r/Advice/comments/pkhf1n/my_dad_tells_me_to_prepare_for_my_dogs_death_but/,False,True
211,Advice,2023-05-27 11:06:32,Stelios_Cy01,Socializing,"

I am 21M moving back to my country after years of living abroad. How easy is to make friends in my new neighborhood village  mostly with peers ?
Any advice will be appreciated 
Thank you",0,1,1,1.0,0,,/r/Advice/comments/13t4j1b/socializing/,False,False
212,Advice,2023-05-27 11:05:58,tbo3900,Awareness and concerns with people with disabilities,"So My brother is in a program/company he has a intellectual disability so  I guess he is with a agency that does little to nothing idk if it’s  funded by the State of Maryland or the government but the housing that he currently lives in that’s doesn’t have transportation sometimes , have a shortage on food, no daily activities for the adults, lack basic everyday needs  like toothpaste, soap/body wash , water etc it’s been a ongoing thing for a few years now I have reached out to family , the directors , the case workers etc what should I do it bothers me so much to see him suffer that way",0,1,1,1.0,0,,/r/Advice/comments/13t4ino/awareness_and_concerns_with_people_with/,False,False
213,Advice,2023-05-27 10:53:25,travneedshelp,i’m done with being alone,"please help me i literally have like no friends, or anybody to talk to, and i’m not close with my parents at all even though i live with them i feel so alone that i sometimes cry everyday and just think that sometimes i want to end it and everything would just go away honestly, i also have this crave for a relationship, i’m a gay male and every time i see couples i get upset at myself thinking i’m not good enough for anybody. idk if this is the fact that i’m alone all the time but i just feel so desperate for the need of someone. i was really never close with my parents even though i still live with them because i’m only 16, then we moved and basically all of my old friends got sick of me and trashed me to be popular, and i go to a new school now and nobody there talks to me i’m graduating next year and felt like i had s horrible high school experience. and my social anxiety is getting worse",5,3,3,1.0,0,,/r/Advice/comments/13t4ajd/im_done_with_being_alone/,False,False
214,Advice,2023-05-27 10:51:46,Interesting_Image285,How to find the right one? 17M,"So, to start things off, i’m a 17 year old highschool dropout making $20k-25k a month, i live in the beautiful city of Toronto where every other girl smokes, drinks, acts the same, dresses the same, speaks the same, and they are all ran through. I also believe that i am far more intellectual than others in my age. What must I do or where must I go to find someone whos not a complete moron. TYIA",1,1,1,1.0,0,,/r/Advice/comments/13t49il/how_to_find_the_right_one_17m/,False,False
215,Advice,2023-05-27 10:46:44,TownCalledPanic,Should I message the guy who rear ended me?,So it's been over a year since I was rear ended by a silly young kid on his phone. Ended up costing me 10k in repairs (destroyed my restored car) and a years worth of battling insurance companies all because he did not properly communicate what happened on the day. I was thinking of messaging him to see how he was and to indicate in a civil way what he caused and to wish him well.,1,1,1,1.0,0,,/r/Advice/comments/13t46gf/should_i_message_the_guy_who_rear_ended_me/,False,False
216,Advice,2023-05-27 10:43:56,Abraxman13,Racoons,I have raccoons that keep getting under my home and up into ig atic that I have no access too and I have tried so much to keep them from under there but they move and open anything I put against the crawl space under my home. What else can I do?,7,1,1,1.0,0,,/r/Advice/comments/13t44te/racoons/,False,False
217,Advice,2023-05-27 10:42:31,dreamyer_2000,Online gaming relationships,"know this might not be the right place for this but I know a few of the guys lurk on Reddit.

I'm a female player in a online gaming community. I've worked really hard for our team and make sure we are supplied, farming for others and helping other get geared. I pass on things I need to help others and I think I've set a bad precedence because now there's no prio for gear. I'm watching teammates gear multiple characters and I'm struggling with my main.

I had to be flexible and change my spec and relearn a totally new one for the good of the team. I was told that I'd be prio'ed for gear and anyway, no one else really needed gear anymore anyway. So basically I'm getting the scraps.

So my leader keeps telling me I need to upgrade my gear. The problem is that the gear I need isn't dropping and when it does other people are needing it as well. Tonight an alt character got the gear my lead keeps telling me to get! Then they ended up trading it to another player. I swear it's a ""good 'ol boy system"" at play.

I want to leave but I have a bunch of people I'm attached to within the group that are not at fault as well as family and IRL friends that play. If I leave it will create a mess for them but I'm doubtful anything will change if I stay. I don't want to be seen as throwing a tantrum to try to get my way.

I've worked so hard for this group but feel completely used, lied to and disrespected.

I play too much to simply walk away and because of a disability this is my main socialization. I can change realms but would have to start over by myself and meet new people.

Thoughts would be appreciated. Am I over reacting over a game? Am I taking it too personal?",0,1,1,1.0,0,,/r/Advice/comments/13t440c/online_gaming_relationships/,False,False
218,Advice,2023-05-27 10:41:21,ZucchiniPowerful3844,Making big life choices,"How do people do it?? 

The long and short of it is my husband and I are trying to decide where to buy a home AND wether or not to have children. I play out so many different scenarios in my mind and no matter how I spin it I see happiness and regrets. 

Do we go rural and have quiet and space and green and prioritize my mental health? If we do this we can't be near my family....

Do we stay near my family where we can't afford a house or land? 

Do we have children? Or do we just spend our lives and money traveling and just doing us? 

Choice paralysis. I truly don't know how to call it. Any and all advice welcome.",1,2,2,1.0,0,,/r/Advice/comments/13t43cl/making_big_life_choices/,False,False
219,Advice,2023-05-27 10:40:53,throwraFrequentRow2,How do I move on from something like this?,"Was I potentially dealing with a narcissist?


In 2021 I was in a position financially, emotionally to be ready for a relationship 

I’d never had a boyfriend because for some reason I never felt attracted to anyone. Like kissing made me feel weird 

And I met a man who had just weeks ago immigrated to this country and had downloaded tinder.

We talked for just over a month until I was so ready to meet him. He was putting it off, I think cause he had just moved here and was unsettled. But he seemed keen, constantly texting me with updates about his day etc 

So I set up the first date. I was on a camping trip with friends which happened to be down the road from his house, so one evening I popped out to meet him. We had a great time, instant chemistry and amazing chats. He texted me how much he fancied me and couldn’t wait to see me again

For the first time in my life, I loved our kissing. They were passionate and intense chemistry, and I enjoyed sex for the first time too. I thought I’d finally met my person. I was always turned on around him and I was the one always initiating sex 

And from that point, we were dating. I had to plan all the dates as I was the one with the car. I would pick him up and we would go hang out somewhere outdoors.

The chats we had were amazing. Shared experiences of grief and interest in music. We would lay in the park and talk forever. He was kind and sensitive and reassured me he was a nice guy as I was cautious and apprehensive with dating. He told me all his exes still want to be friends with him as they know he’s nice and harmless.

I liked the pace of the relationship too, quick to become comfortable but not rushing things. He seemed very into me, soppy messages, loads of compliments and talks of the future. I felt safe and comfortable.I’ve never had a man I like, be interested back too so my feelings were amazing 

At 3 months, I moved closer to his town, not just to be closer to him but to be closer to my work too. 

It was at that point, my housemates pointed out I was doing s lot for him and he didn’t take me on dates. I cooked him dinners and planned fun things. I was supportive to help him find a new job etc . When he was sick, I was out getting him meds and stuff for his back ache. I felt like the adult in the relationship 

I brought up the lack of dates one day. I told him ‘I feel I do a lot when it comes to planning dates. I would really like it if you took the initiative to plan things. It doesn’t need to be expensive or even cost anything.’ He came up with some weird excuses like I was better at planning bla bla bla. Even on my birthday there was no effort 

But from that point, I felt a massive change in him. He was no longer super kind and friendly to me. He gave me very dirty evil looks and little criticisms all the time. When I brought up further needs, again in a sensitive way, I was told I was pressuring and manipulative. He talked about his ex girlfriends non stop. 

His attitude toward me got worse, he seemed so annoyed by everything. Even accusing me of being bad at planning and unable to understand sarcasm. He never even made an effort to get me food and drink when I stayed at his, I would have to make sure to bring my own food so I didn’t get hungry. Even him getting me a glass of water always seemed a big annoying effort for him

At the same time I was going through a hard time with loss of my job, some awful housemates, family illness and grief from loss of a family member 

He dumped me and told me he dated me because he was lonely and never fe in love

He never even spoke to me like he did with his exes, which hurts and makes me wonder what’s wrong with me",4,1,1,1.0,0,,/r/Advice/comments/13t4321/how_do_i_move_on_from_something_like_this/,False,False
