index,subreddit,post_time,user_name,title,text,num_comments,score,ups,upvote_ratio,downs,likes,URL,over18,ASD
174,AmItheAsshole,2023-05-27 10:23:53,thatgirl_bella,AITA for kicking my dad out for saying women belong in the kitchen?,"I've recently had a fight with my dad and I'm unsure if I handled the situation appropriately, so I’ve come to you all to get a judgement!   
  
I (21F) invited my dad over for dinner a couple of nights ago. We have not always had a good relationship due to him being an alcoholic while I was growing up (he has been sober for nearly a year now). I cut him off when I turned 18 and moved out but we reconciled and have been working on our relationship for the past 2 months.   
  
During a conversation about my future plans, I mentioned my career goals and was explaining what university classes I was currently enrolled in when he cut me off and said, “Women belong in the kitchen, not chasing some dream job” and laughed. I was taken aback by this. I asked If he was being serious, and he said “No need to get your knickers in a twist about it”  
  
In that moment, I couldn’t contain my anger and frustration. I told him his comments were disrespectful and he shouldn’t talk about women that way. He seemed unapologetic and said he was just expressing his opinion and that I should embrace my traditional role as a woman.  
  
I told my dad that if he couldn’t respect me and support my dreams, he was no longer welcome in my home and that we should rethink if we should be in contact. He left after telling me that I couldn’t take a joke.  
  
I haven’t reached out to him since but over the last couple of days, I have received a messages from family telling me that I broke my father’s heart by telling him we should rethink being in contact and that obviously he was joking, and I need to chill out. Now I'm feeling guilty and not sure if I should let this go, he's never expressed these views to me before so maybe it’s a one time thing. On the other hand, I'm wondering if this is something that will continue in the future. So AITA?",29,18,18,1.0,0,,/r/AmItheAsshole/comments/13t3t2a/aita_for_kicking_my_dad_out_for_saying_women/,False,False
175,AmItheAsshole,2023-05-27 10:21:50,anon1234nothing,AITA for not inviting my SIL to my sons birthday party after she was a bad friend when I was dealing with a sudden loss?,"Want to keep this as short and sweet as I can, my mind is just blown over what just happened. I lost my only extended family member suddenly last year. It was a traumatic one. My friends were so amazingly supportive, brought food and sent flowers, came to the services, came to spend time with me and my family. Except my husbands sister that I thought was one of my best friends. Her absence during the whole thing was even more obvious when everyone else was so supportive. I know not everyone has the capacity to pour into another person at all times and have always acknowledged she has a lot on her own plate with 4 kids, but she never even gave a “sorry for your loss” text after I kept desperately trying to reach out and being at such a low point in my life. 

Eventually I confronted her about it because my feelings were hurt and the distance between us kept growing and I wanted to make an attempt to fix it. She told me she couldn’t talk to me about my [addict] family member dying because addicts are a trigger for her and she has no sympathy for them, and also then calling my husband an alcoholic and me an enabler, but also that since she already felt distant from me prior to the loss that she didn’t feel the need to reach out and be a good supportive friend. We never really got anywhere conversation wise, and I was far from ready to be cordial with her after the initial convo. As such I did not invite her or her kids to my sons small birthday party about a month later - it hardly seemed like the time or place to see each other for the first time after such a loaded convo (we already hadn’t seen them for 6 months), but when she found out about it she went off on me in a colorful text and then unfriended me AND my husband on everything and told us to have a nice life.

AITA for not inviting her to the party, or for telling her that she hurt my feelings in the first place? I’m so taken aback by everything that’s conspired",11,3,3,1.0,0,,/r/AmItheAsshole/comments/13t3rwn/aita_for_not_inviting_my_sil_to_my_sons_birthday/,False,False
176,AmItheAsshole,2023-05-27 10:02:23,Professional-Bit3280,AITA for going off on my (24m) own at the club and leaving my girlfriend (24f) with a friend?,"Hey folks, 

My girlfriend (24f) and I (24m) went out to a nightclub with one of her friends who I also get along well with. 

Anyway, it was super crowded, so there was no room for me (an avid shuffler) to dance and people kept bumping into me every couple seconds trying to get through and whatnot. So as I was really not having a good time, the girls kept wanting to push deeper and deeper into the crowd. So not wanting to kill their fun, but also not wanting to have a miserable time, I said i was going to head to this open spot way off in the back. And I did. 

My girlfriend is absolutely pissed that I left her at the club. For the record, I’d never leave her alone at the club, but she was with our friend, so I thought it was okay. That said, I can see her point that her boyfriend shouldn’t have left her in the club. 

So Reddit, am I the asshole here or is it at least somewhat reasonable what I did even though she has a right to be upset about it?",12,6,6,1.0,0,,/r/AmItheAsshole/comments/13t3g7t/aita_for_going_off_on_my_24m_own_at_the_club_and/,False,False
177,AmItheAsshole,2023-05-27 09:42:50,Valuable-Custard6374,AITA for the way I react during fights with my SO before my breaking point?,"Recently I've been struggling with my relationship with my SO because we are getting into arguments and fights. I've been struggling to understand who in the situation is the one perpetuating the fighting, myself or my SO. I will give just the fight that happened today as an example of what happens when things get out of hand.  
  
For some context: Earlier today I was posting on a forum. I joined a debate and was having fun with the topic with a few other people. My SO doesn't understand why I bother posting on the forums, and ridiculed me about it, which he's done multiple times in the past.  
  
Later, we were looking at houses and I made a comment about one that had an easement on the property, commenting that the property taxes may be lower because of it by a slight amount. He argued it wasn't true, so we looked at a few houses in the surrounding area, and I was correct about the property taxes being lower, but he insisted that I was wrong, despite us comparing the numbers. Then, he tells me that he was the one who said what I said, and that I was wrong because I said what he said. This frustrated me and I said ""What are you talking about. The numbers added up to make my point exactly."" he continues to argue this point, and I tell him that I no longer want to have the conversation and that I'm done and to please stop talking about it.  
  
He continues to push it, and I continue to tell him I am not having fun and I don't want to have the conversation with him any longer. He then brings up ""How is this any different than your ""debates"" on that forum? you just like arguing with people"". This really got me pissed off so I told him a few more times to please stop the conversation and that it was making me upset and that debating and fighting are two different things entirely. He told me ""You're the one talking about it, it's not me"". I asked him to please stop and to leave me alone a few times again before I couldn't take it anymore, so I told him ""You're a fucking asshole"" and I got up from my chair. I said ""I can not believe you are forcing me to physically leave my house in order to get away from this conversation."" and I left the house with him continuing to yell whatever his side of the conversation was at me as I left.  
  
This happens so often, and I'm sick and tired of it. I feel like I'm the one causing these fights to start, but I don't know if it's because I actually am causing it, or if he's making me feel like I'm causing it by the way that he's interacting with me. I know that by the end of the fights I've reacted poorly and am definitely a jerk, but I can't pin point whether I am the catalyst of these fights or not. I just feel like I'm going insane.  
  
AITA for reacting the way that I do in these fights before the point of me breaking and saying something inherently mean?",24,5,5,0.78,0,,/r/AmItheAsshole/comments/13t34sj/aita_for_the_way_i_react_during_fights_with_my_so/,False,False
178,AmItheAsshole,2023-05-27 09:41:15,prani2040,AITA for asking my girlfriend to dress better on a date night?,"So we had decided to go out on the weekend and I suggest going somewhere fancy. She says okay and I find an upscale Chinese restaurant and show it to her, she says cool and we agree to spend the evening there. 

Fast forward to the evening, I see her dressed in a t-shirt and worn down jeans. I ask her why she’s not wearing a dress and she just replies, she doesn’t feel like it. I’m like “uhh okay, but I told you it’s a fancy place” and she’s like “Ah it’s just a Chinese restaurant”

I pull up their Instagram and try to show her their feed to convince her that it’s upscale, but she doesn’t even want to look at it.

I ask her again to dress appropriately and this time she’s pissed and she says we’re not going anywhere tonight. We haven’t talked since then, it’s been a day now.

She usually likes to dress up even when we go to a normal bar. This is leaving me confused. AITA here?",40,14,14,0.82,0,,/r/AmItheAsshole/comments/13t33tc/aita_for_asking_my_girlfriend_to_dress_better_on/,False,False
179,AmItheAsshole,2023-05-27 09:40:51,em1_em1,AITA for getting my MIL kicked out after she spilled coffee in my suitcase?,"I (24f) came home at 3am from work trip few days ago. I was jetlagged, only wanted to see my wife (25f) and go to sleep. I was surprised to see that my MIL (48f) was also waiting with my wife for my arrival at our living room. The second I walk in, my MIL starts complaining about how I was supposed to arrive at 2am, how she has been up for one hour more than she thought she would, etc.. I had sent a message to my wife that my flight was delayed, but my MIL thought that I should have sent her a message aswell, even though I didn't know she would also be waiting for me. My wife calmed her mother down and I told them that I was going to sleep. That was apparently another thing for my MIL to start complaining. She thought that I needed to empty my suitcase before I go to sleep. My wife stood up for me and told her mother that I don't need to empty it right now and I can do it in the morning when I wake up. They argued for a little while, but finally I got my permission to go to sleep from my MIL. At this point I need to say that I left my suitcase closed and it was out of the way, standing near a wall. 
Fast forward to next morning, when my wife and I woke up to a scream from my MIL. Both of us got straight up from bed and went to see what happened. My MIL stood horrified in the middle of our living room and she was looking at my suitcase, which now was laying open on the floor. My wife asked what happened and my MIL responded that she had ""accidentally"" spilled coffee in my suitcase, because I had left it laying open on the floor. My wife and I both knew she was lying, because I did not leave the suitcase like that. I looked at my suitcase and immediatelly realised that the amount of coffee in my suitcase didn't match the size of the cup my MIL was holding, because the cup was small and there were lots of coffee in the suitcase. I started crying, because everything that I had in the suitcase was ruined. My MIL started saying I was overreacting and I shouldn't have left my suitcase laying around like that. She said I was an AH because I blamed her for what happened. At this point my wife kicked her mother out and comforted me. 

Now that few days have passed, I have started thinking that maybe I overreacted and it really was my fault that my MIL spilled the coffee in the suitcase. So am I the asshole?",29,13,13,0.93,0,,/r/AmItheAsshole/comments/13t33kp/aita_for_getting_my_mil_kicked_out_after_she/,False,False
180,AmItheAsshole,2023-05-27 09:38:15,I_Dont_Exist_Bitch,"AITA for leaving after hearing a friend ""makeout"" for over 20 minutes?","I (m21) was hanging out with some friends tonight. My buddy (m21) had invited this girl (21) he'd been fwb with in the past to hang out with a bunch of our friends. Hangout eventually ends and me, my buddy, and the girl all head back to my buddy's place. We had a few drinks and smoked a little before calling it a night. I crashed on an air mattress in the living room while my buddy and this girl take his bed. (They're friends and share the bed fairly often, and have never done anything but sleep in said bed when people stay over after hanging out)

 Now his place has a really open floor plan, so his bedroom is pretty open so I can hear everything thats happening in there. He and I have a system. No sex when the other is there, neither of us wanna hear what the other sounds like in the sack lol.

 We laid down for bed and I ended up scrolling for a few before I heard something weird from his bedroom. Tonight was apparently the night he stopped giving a fuck about our rule because I could hear him and her groaning and her quietly gasping and his bed creaking FOR 20 MINUTES. I sent him a warning text that I could hear ""something"" but I ended up having to yell at them that I could hear them.

 They got really quiet and said they weren't doing anything but I ended up saying that they weren't being subtle and should cut it out since I can hear all of it.

 NOT 10 MINUTES LATER I HEAR IT AGAIN, albeit quieter this time. I texted a different friend and told her what was up and she told me that I should definitely just head home. So I lied to my buddy and said my roommate needed a ride home from his girlfriend's place but he said that he could tell I was lying and to just tell him the truth. I told him I didn't like hearing whatever was happening in his bedroom and that it kinda grossed me out.

 He said that nothing was happening and they were just making out.

 I tried to explain that I don't want to be at his place when he's doing stuff like that and he seemed upset that I thought that ""anything like that"" was happening. 

I get that I don't know what exactly they were doing in there, and I have a lot of stuff weighing heavy on me recently so I could have just snapped over something small. I know I have a short fuse and that night had already lasted way longer than I wanted it to. I felt like my boundaries were crossed and it made me upset.

So AITA?",10,4,4,0.75,0,,/r/AmItheAsshole/comments/13t322k/aita_for_leaving_after_hearing_a_friend_makeout/,False,False
