index,subreddit,post_time,user_name,title,text,num_comments,score,ups,upvote_ratio,downs,likes,URL,over18,ASD
796,AskDocs,2023-03-31 21:03:02,VermicelliNo2422,Lamictal and Combined Birth Control?,"Sorry if this isn’t the correct sub for this, but I’ve gotten conflicting answers from my psych, my pharmacist, and my doctor at Planned Parenthood about this, and thought I’d seek out more opinions. 

I’m 24, AFAB, 5’5” and 230lbs. No physical prior conditions, but I’m diagnosed with Depression, Anxiety, and ADHD. I’m taking the Lamictal as a mood stabilizer for my Depression.

For medications, I’m currently on 10mg methylphenidate IR, 27mg methylphenidate ER, and my doctor is working with me to swap me from 20mg Fluoxetine to 20mg of Lamictal. I also take a combined birth control pill (Blisovi/Tarina FE 1/20). 

From my psych, I was told that the interaction between the bc and Lamictal would be minimal. From my doctor at Planned Parenthood, I was told that Lamictal can interfere with bc and make it less effective, and that I should use backup protection. From my pharmacist, I was told that my bc would be unaffected, but that I should take my Lamictal a few hours after my bc, because the estrogen would cause me to metabolize the Lamictal more quickly and I wouldn’t get the full effects. 

I’ve tried to look around online, but everything I read has a different conclusion about the interaction. I’m mostly concerned about my bc impacting my Lamictal, and was wondering if anyone had any more insight on medication timing.",2,2,2,1.0,0,,/r/AskDocs/comments/127zd43/lamictal_and_combined_birth_control/,False,True
1483,AskDocs,2023-05-25 11:55:07,YouMadeMeSoFilthy,"Intense pelvic pain, bump on my cervix","24 afab (ftm, pre transition so no surgeries or HRT yet), been having the following symptoms: pelvic pain, intermenstrual bleeding, irregular cycle, bloating, constipation, painful intercourse, bleeding during intercourse, loss of energy, exhaustion since 2020. I discovered a bump on my cervix in 2019 and told my gynecologist, they said they can't see anything. I was diagnosed with HPV and genital warts in 2018, warts were removed via laser surgery.  When I told my gynecologist about my symptoms in 2020 they gave me the pill and didn't order any tests except the yearly pap smear and an ultrasound. In 2021 I went and asked again because my mother was diagnosed with breast cancer, her father later died of stomach cancer. The symptoms, especially the pelvic pain, have gotten worse and the bump on my cervix got bigger. But still my gynecologist tells me I'm just constipated and I should get back on birth control (i stopped taking the pill in November 2022) The pain is always there, sometimes only light, sometimes very bad, pain meds don't help. My GP tested me for bladder infection, test came back negative. The intermenstrual bleeding lasts for 2-3 days, no period pain, only the ""normal"" one, no PMS, no symptoms of ovulation before the bleeding. I'm frustrated no doctor wants to listen to me. And scared because I don't know where the symptoms come from.

Edit: Forgot to add excessive sweating as a symptom, I'm also very heat sensitive.",1,1,1,1.0,0,,/r/AskDocs/comments/13rfqt8/intense_pelvic_pain_bump_on_my_cervix/,False,True
1807,AskDocs,2023-05-18 15:13:27,fernfeathers,"Doctor says it’s anxiety, I don’t think it is.","Hi everyone. 

30F, 5’9”, 160lbs. 
Medications: 100mg Sertraline, 100mg Lamotrigine, Kyleena IUD. 
Diagnoses: Depression, anxiety, autism — high functioning. 
Substances: Edibles (~15mg) 1x/2x a week, marijuana smoking everyday.
No vitamins or non-rx medicines. 

3 weeks ago: came down with a cold after starting a new job. I figured it was from how I now work with kids, and my immune system needed to adjust. Main symptom was a cough. 

2 weeks ago: the cough half cleared up but I was still fatigued and lethargic. 

This week: Coughing fits starting up again, chills, cold sweats, shaking/shivering, hot flashes, body aches, extreme nausea, nausea, dizziness, diarrhea. Other physical symptoms now include slow movement, shivering as if I’m cold, and a temperature that will fluctuate between 95-97°f. Cognitive symptoms include fuzzy brain, slow thoughts, forgetfulness. Extreme lack of appetite and I can barely finish a fruit smoothie. 

I visited a LNP this morning. She told me that I just to increase my anxiety medicine dosage and sent me along the way. I felt very dismissed. This is not how my anxiety presents, my medicine is working and I like the dosage it’s at, and this feels like more than a cold. 

I have now missed three works of work for whatever this may be and I dislike staying home. 

Thank you for your time and reading.",5,0,0,0.5,0,,/r/AskDocs/comments/13l1qxw/doctor_says_its_anxiety_i_dont_think_it_is/,False,True
1971,AskDocs,2023-04-03 04:16:46,introvertedfreak21,Is this a panic attack?,"Hello, I'm a 25F that weighs 230lbs and is 5ft tall. Currently I have arthritis in my hands, scoliosis in the shape of a backwards S so my right hand goes numb if I stress it and I have one hip slightly higher than the other so it makes one leg seem longer than the other. I do have bad allergies that cause frequent headaches behind my eyes. I take generic benadryl, generic zoloft, and a antacid that starts with an L; I know it's long lasting. I was also diagnosed anxiety but I thought it was more manageable.

So, sometime early 2021, I believe I had my first panic attack. I had been working 12hr shifts five days a week, learning on living on my own with my roommate and boyfriend, and lost my car maybe a month prior. I worked at a warehouse in GA that had no AC; I was given this large order that I hated doing. While I worked on the order, I had this creeping feeling of struggling to breath. I just kept ignoring it but it was getting worse. I ran into my boyfriend at work and it just spilled out of me, I started crying and was struggling to breath. I wasn't in a state to keep operating the machine we used to move around the warehouse. After that time, I started taking Zoloft.

I've been doing better but lately I feel like it's coming back. I had a panic attack at my job today, I currently work in retail and yesterday was super busy and even though I only have a 5 hour shift today, the nonstop growing line caused this feeling of struggling to breath. I called one of the managers over and asked her to take over for me while I take a minute to breath. I went to the family bathroom we have as it was the only private one. I broke down, I was crying and hyperventilating. I didn't feel like anything was mentally, I just couldn't get a grip on my body. I'm just wondering if this sounds like a panic attack. I still have this tight feeling in my throat. I do have Hydroxine to help prevent panic attacks but I don't feel it's strong enough. I can't start therapy yet because I go off my parents health insurance this year and I can't afford to get my own at the moment. I don't lose it till August.",3,1,1,1.0,0,,/r/AskDocs/comments/12a959g/is_this_a_panic_attack/,False,True
1982,AskDocs,2022-03-12 20:52:48,introvertedfreak21,My boyfriend falls when ever he stretches,"Age 25

Sex Male

Height 6ft

Weight 209

Race White

Duration of complaint About two months

Location Whole body

Any existing relevant medical issues Quarter size whole in his heart

Current medications None

So I'm asking this for him because he refuses to go to doctors for fear of being charged a lot of money, yay usa healthcare....

He has a quartar sized hole in his heart which causes low blood pressure to a healthy degree. Its not enough to make him easily weak when standing or have any issues like that. However when he got covid back in December 2021, he's been having this issue where he will stretch really hard while standing and right as he does, he just suddenly falls on the floor. He's still awake and responsive but he needs a minute or two before he can stand back up. It was something that only happened maybe once a month but its starting to become more frequent after he had covid. I also got covid form him but all I've experienced since then is a lot of mucus production and congestion, neither which he has to my knowledge. He doesn't drink, smoke, or do any drugs. He doesn't take any prescription meds regularly either. His diet isn't the best, I'm working on getting us both to eat more vegatablss and less red meat. Any advice or suggestions would be helpful, I'm not really sure how to describe what happens to him in a way I can research it since its like fainting but he's still responsive and aware, just his body loses all energy in a brief moment.

Sorry if anything is repeated, my original post was taken down because I forgot to put his gender in a way the boy noticed and forgot his race.",1,1,1,1.0,0,,/r/AskDocs/comments/tcql3p/my_boyfriend_falls_when_ever_he_stretches/,False,True
1992,AskDocs,2021-08-30 02:51:18,introvertedfreak21,Athlete's foot or something else?,"I've noticed some pretty bad heel cracking on my feet closer to my toes. I did take some pics but I can't post them on here. I thought they were form me not scrapping dry skin off my feet that would fall off. One time I tried to pull at some of this skin and found that very painful, like ten times worse than a bad hangnail. My step mom suggested it was bad athlete's foot so I bought some cream form Walgreen's for Athlete's foot. It says it is clotrimazole cream and I am not sure if I should use it daily but I've used it almost weekly. The cracking hasn't gotten better. I forget about it a lot, to be honest. I also take Zoloft for Anxiety, Birth control, and Naproxen 500mg for my back though I'm working to get off of that and may see a spine specialist soon. I was worried that maybe this was actually some other health concern as Athlete's foot is just one of many reasons why my heels are cracking. There is also a lot of peeling skin around my pinky toe(the smallest one), that hasn't been as bad as the cracks though.

Detailed Edit:

I am a 24F.
Height: 5ft 0in
Weight: 250lbs
Race: White
Complaint: Heel Cracking
Duration: Not sure, at least a year
Existing Medical Issues: Scoliosis, Anxiety, Degenerating disc between my tailbone and spine.
Current Medication: Zoloft 25mg, Naproxen 500mg, Norethindrone .35mg
I don't smoke, I only drink once or twice a month, no other drugs

I hope this helps. The cream I use is white so I thought it would help to show the cracks in the heels.

[My feet](http://imgur.com/a/kS72zCp)",4,1,1,1.0,0,,/r/AskDocs/comments/pe9i5j/athletes_foot_or_something_else/,False,True
1993,AskDocs,2021-08-16 23:19:55,introvertedfreak21,Physical Anxiety Issue?,"So, I am a 24 female, I am 5ft tall and weigh at 250lbs. I know I am overweight, I've been working on calorie counting to help slowly lose weight. I currently take Naproxen 500mg, birth control, and acid reducer. I also have scoliosis which was what the Naproxen is meant to help with.

A little background, I work at a warehouse. Due to the pandamic, we are short staffed and I live in a right to work state. They make us do 12hr shifts almost every day and make us come in for a sixth day every third week. At the time, I had worked one 10 and a half shift, and two 12 shifts. It wasn't the first time I did that and in the heat of summer, I'd been working at that job for over a year now. My only idea of what stressed me out was the job in combination of my boyfriend buying a motorcycle and having been in an accident that previous Friday. He's fine, just bad roadrash but it still scared me.

Last Wednesday, I had what I was told was a panic attack. I had felt this tight feeling in my throat, like a ball had formed there. It got worse and worse, making it harder and harder to breathe. It got a point where I felt like I was drowning. I had ran into my boyfriend and that's when it all just overtook me, I started wheezing and was struggling not to cry. I refused 911 because I could talk and I could calm down but not enough to be breathing normally. It was a struggle to talk. My step mom came and got me from work. She gave me two options, I could go with her to the liquor store and she would buy me a few drinks or I could take half a xanax(she had a prescription for these). I took the xanax because I don't really like drinking alcohol much. After I took the medicine, she bought me some food, and in the maybe 20mins form when she got me, got food, and took me to my house, the xanax kicked in and I never felt so relaxed before. I never knew how much tense I really held in my body, no other meds I took helped me relax my muscles so well and it made me question so much of what doctors told me.

I had been told because of my back, one leg would always be tenser and never relax as well as the other leg did. I took meds to relax my muscles so I wouldn't be in pain. Everything else made the pain mild enough that I could ignore it. Xanax wiped that pain out completely, my muscles fully relaxed for the first time in forever. The next day I was off of work and I could feel how much it hurt to have that medicine out of my system. I mainly stayed home that day as it hurt a lot to walk around. I wanted to think maybe my legs were tired because I had worked an 8 and a half hour shift before my panic attack. The next two days after, I was just pretty sore but managed fine. The Sunday morning was different, I had to work that morning. I could feel that tight feeling in my throat again so I thought it wouldn't hurt to take just half a xanax before work. It was the best I was able to work ever. Nothing hurt, I did feel mildly sleepy but it was no worse than my usual tired(I had to wake up at 6:45 that morning), the sleepy feeling went away with time but I could move with no pain. My fingers didn't hurt form folding tons of shirts, my feet didn't ache form standing all day, and I was just able to move fine. I worked 12hrs that day and I didn't start hurting till the last hour of my shift.

With all that in mind, I decided that I needed to search out therapy. I set up with an online therapy service that my insurance mostly covers. Today I woke up with my shoulders aching all day and just feeling weak. I was ready to just get this appointment over with so I could get some answers. The video call was set up, I waited 20mins for the therapist. Watched this little thing say she was unavailable then online then back to offline. I was later told that I missed the appointment somehow and that I had to reschedule. I was mad because I sat in such an anxious state waiting for this. I felt like I'd throw up and was shaking. I set up another appointment and sent an email about what happened to the support team. I decided to just give it a try of half a xanax again and a hot shower. The pain in my shoulders went away, I was able to breath normally, and no longer felt nauseous. I do have another appointment set up next Friday but I just want some advice on if this sounds like something else. I always avoided medicine like Xanax or strong pain killers because my mom was an addict who died of an overdose and my father isn't much better, he would only mix xanax with some alcohol which I know is the number one thing recommended not to do.",2,1,1,1.0,0,,/r/AskDocs/comments/p5roem/physical_anxiety_issue/,False,True
2006,AskDocs,2019-05-27 20:11:39,introvertedfreak21,Can scoliosis lead to misformed hip bones?,"Hello,
I'm a 21 year old female that stands at 5 feet tall and currently weighing at 188lbs. About two months ago I went to my doctor about pain in my right hip only to find out I was weighing at 202lbs and had scoliosis to where my lower back is curved to the left and my tailbone is slightly misplaced, its still connected but it doesn't look to be perfectly connected. After some antiinflammatory medicine, the pain went away and my doctor put me on a diet pill to curve my appetite which has helped me to lose 14lbs so far. My last visit I asked for a copy of my x-rays, something I should've asked for sooner, I know. I had forgotten they took x-rays of my hips as well as my lower back and noticed that my hips seemed too narrow for a female set of hips and when showing it to a friend and my father, both agreed to them seeming narrow and my pelvis is very thin, thin enough that having a child would most likely shatter it. I have another appointment coming up on the 31st of May to see my weight loss going so I was gonna talk to my doctor about the oddities of my hips and if I should see a specialist about my spine since my back and shoulders are popping a lot and my muscles get so tense that I can't pop anything and become really painful which isn't good since I work at a warehouse that sells clothes so I need to use my back. I have gotten clearance to lift up to 50 pounds which is the weight listed in the guidelines of my job but nothing more than that. But my main concern is if there may be something worse than just my spine being curved wrong and if I should ask for further x-rays of my spine and hips.",1,1,1,1.0,0,,/r/AskDocs/comments/btqqmt/can_scoliosis_lead_to_misformed_hip_bones/,False,True
2027,AskDocs,2022-06-08 04:36:27,Vessecora,Should I push for a third opinion? I've been feeling like my heart is flip flopping.,"I'm 27F, Caucasian, Australian, 165cm and 100kg. I recently had a cholecystectomy and I had an ECG while admitted but there was no issues noted on my discharge papers. 

For the past year however I've been feeling my heart flip flop in my chest at random times, on average once a week. I sometimes get shortness of breath at the same time. 

I've already asked both my GP and a hospital doctor but they both said that it doesn't sound like I'm having palpitations because according to them that's only skipping a beat... Admittedly I do have PTSD and anxiety so I may not have been explaining right in person. And I don't recall feeling any symptoms of either PTSD or anxiety when the flip flopping happens. 

Should I press for further investigation by a specialist? I do have to admit that I am worried that the anxiety etc and my body weight will continually put stress on my heart. Both of which I am treating. Though the body weight is a bit complicated by an eating disorder, so please assume I understand any advice regarding weight and do not need to hear it since the psychological aspect is more important right now. 

My current medication is Sertraline for the PTSD/anxiety, and for a while before the cholecystectomy I was on Rosuvastatin.",1,1,1,1.0,0,,/r/AskDocs/comments/v7gz2k/should_i_push_for_a_third_opinion_ive_been/,False,True
2310,AskDocs,2021-12-30 18:40:21,linguisticshead,"Grandma died in her sleep. She had no health conditions, what could have caused her death?","77 female, caucasian white, about 55kg and 160cm. Had a femur operation 3 months ago because she fell and had to replace some parts of it (I am not so sure what the surgery did but I can ask if details are needed).

She fell at home on Monday, hit her head and face but was alright, did a tomography at the hospital and it was clean, showed some swelling that the doctor said was a sign of Alzheimers. 
She didn’t pass out before or after the fall. She didn’t feel bad either. 

On Tuesday 28/12/21 she went to sleep at 23hr. She told grandpa she wasn’t feeling well but she threw up and said she felt better after. Grandpa took her BP and HR and it was normal. Grandpa found her dead Wednesday 29/12/21 morning, at 8hr. She was already cold and stiff. Dad said she probably died right after she went to sleep, around 1/2. 

At the funeral yesterday at afternoon she was a bit swollen. I didn‘t look too close but mom said she was purple, grandpa noticed that too when the ambulance took her away from the house. Dad also noticed she was a bit purple on her neck, face and chest. 

Mom and her siblings decided they didn‘t want an autopsy but I really want an explanation.",2,3,3,1.0,0,,/r/AskDocs/comments/rs8soi/grandma_died_in_her_sleep_she_had_no_health/,False,True
2331,AskDocs,2020-10-26 19:37:04,linguisticshead,PVCs on extended exercise,"18F, 160cm, 57kg, European but live in Brazil, diagnosed with GERD, ASD (Autism), OCD and GAD. Otherwise healthy, never had any health issues. 

I started to have PVCs a year ago. Had a clear echo, EKG and stress test in December. Since then, I'm learning how to live with the health anxiety PVCs have caused me. Recently though, I began to feel PVCs during exercise. It's important to say that I haven't exercised in at least 8 months because of health anxiety. Also due to COVID-19, I spent these past months at home and did not move around a lot. 

I have a good diet and normal blood work. I noticed my PVCs don't have anything to do with the intensity of exercise. I can run 15 minutes on a 160bpm and I don't feel anything, but if I walk 30 minutes on a lower heart rate I might get one or two PVCs. I can ride the bike very fast for 30 minutes to 1 hour until I start to get some PVCs. Usually it's when I'm doing the exercise for a long time that they occur. It also doesn't have anything to do with my heart beating faster because I feel nothing when I work out hard. 

I am really worried about it. Other than that I have no symptoms at all that could indicate CAD or heart failure or something like that. I am quite reluctant to get another stress test because last time I had a panic attack on the treadmill and the doctor wasn't so nice. As I said, I haven't exercised due to health anxiety and my heart beating faster still gets me anxious and sets me into a panic attack sometimes. I don't feel ready to have one again so I'm looking for advice or reassurance. What could this be? I wonder if it's because my body has not moved at all in 8 months and I'm just getting back to it so it's slowly getting used to exercise again?",4,1,1,1.0,0,,/r/AskDocs/comments/jilhkr/pvcs_on_extended_exercise/,False,True
2339,AskDocs,2020-10-11 14:31:34,linguisticshead,Ectopics on exercise,"[18F] [57kg 160cm] diagnosed with GAD, ASD and still trying to figure out what’s causing pain in the esophagus while swallowing (even though tests came out clear). I haven‘t had any alcohol in 8 months but used to drink a lot. I started to feel really strong ectopics last year in July. I had a clear stress test, ekg and echo in December. 

The ectopics caused me extreme health anxiety and I completely stopped exercising. I used to ride 14km everyday on the bike. I haven’t really exercised in over a year but I am trying to get back to it now.

I was a very long time without feeling any ectopics but have had some of them for the past weeks. They eventually come and go. A few days ago, I was riding the bike for one hour not very hardly when I started to get a lot of ectopics. I made a 10 minute pause and didn‘t get any of them and then I was back on riding for 15 and got a few more. I was also riding on a very bumpy road so I‘m wondering if that worsened them. I‘ve been trying to exercise everyday for 10 minutes despite my anxiety (exercise really triggers me) and I have never experienced ectopics during these times although my heart will go up to 190bpm. 

I also can‘t tell if they‘re really ectopics because they aren’t nowhere close to the ones I was experiecing last year. It doesn’t feel like ectopic, because I just get this weird feeling in my neck and it doesn’t go away quickly like the normal thud on my chest I used to feel, so I‘m wondering if I‘m just overly aware of the blood going through my neck because I am so anxious? 

A medical advice would really help right now because I‘m feeling very depressed because these ectopics really ruined my life. I am healthy. I don‘t understand.",3,1,1,1.0,0,,/r/AskDocs/comments/j96dp6/ectopics_on_exercise/,False,True
3326,AskDocs,2023-03-05 08:50:59,joyyers,Is this cafe au lait spots?,"Hi! 18f, wondering if these two spot on my chest could possibly be cafe au lait spots? I've had them for a while, and they've kinda grown over the years. Unfortunately no pics of before but they've def grown, but they're entirely flat and pretty much just a tanner color from the rest of my skin. I spooked myself into thinking they're melanoma for a while, but I don't think this really looks anything like melanoma now that I'm clearheaded. I'm not worried about any diseases cafe au lait spots could indicate because I'm 99% sure it's just these two, I'm just wondering if that's what it looks like.

I've toyed with the idea of these behing the beginning of seborrheic keratosis, too. Does that look more like these?

Here's the pic. https://imgur.com/a/aLKzoci",5,1,1,1.0,0,,/r/AskDocs/comments/11is8el/is_this_cafe_au_lait_spots/,False,True
