index,subreddit,post_time,user_name,title,text,num_comments,score,ups,upvote_ratio,downs,likes,URL,over18,ASD
63,AskVet,2023-05-27 08:47:41,Ancient_Ad_6950,Wtf do I do?,"Do vets allow me to just walk in and ask for an exam/deworming? 

Live in Michigan btw. My two cats need an exam and deworming, my 4 month has worms and isn’t eating all like before. Both share litter so I gotta check both.

All 24 hour vets are far and all require appointments, I tried to make one and it’s availability is a few days away. 
Honestly I’m concerned and don’t think I can wait that long. 

My cat just vomited now and both didn’t even eat properly. One eats too fast and the other just licks the wet food. 

Both use litter fine.",1,1,1,1.0,0,,/r/AskVet/comments/13t288x/wtf_do_i_do/,False,False
64,AskVet,2023-05-27 08:36:29,Knightfellnight,Is it a bad sign that my kitten is just laying in my arms?,"So my cat had 4 kittens (all girls) about 7-9 weeks ago (around march 21st). Around 1-3 weeks ago i took all 5 to the vet. They said the kittens look like they MIGHT develop some respiratory issues and for the most part they haven't except one. 

The first born. I've been doing my best until we can have more money saved up because we also need to get a car (current one broke down RIGHT before the vet visit)

I was on the couch when i heard her cry out in what sounded like fear and/or pain. So i picked her up and checked her out.

One of her eyes is now crusted shut, the other seems to be on its way. And what's most worrying to me is that she's just. Laying in my arms. All of the kittens are extremely active and will ONLY come up to snuggle you if THEY decided they want to sleep on you. No exceptions

Besides that every other time I've picked her up to clean her eyes as best i could and check on her she was very squirmy.

I'm really scared and don't know what to do or what's going on. And for the record not only were the kittens not planned but we also can't keep them, so please don't like roast me or whatever about ""poor financial choices"" or ""why have cats if you can't afford them"" 

We were only planning on the one cat. She was a stray we took in that was apparently pregnant.

Edit to add: she's also started wobbling slightly. Anther thing that scares me",16,0,0,0.5,0,,/r/AskVet/comments/13t228f/is_it_a_bad_sign_that_my_kitten_is_just_laying_in/,False,False
65,AskVet,2023-05-27 08:09:22,nickmasterstunes,"Cat has been acting agitated, growling and hissing at nothing for two days","Wednesday night my cat Taco (siamese, 3yo) started acting very agitated, growling and hissing at nothing and scurrying around the apartment. He's been doing it on and off for 48 hours now. He calms down in the early afternoon and after feeding time. He seems to be the most agitated at night and early morning. I have another cat who is acting perfectly normal, and Taco is not being aggressive towards her. It's almost like he can sense something in the apartment that I can't.  
I took him to the vet today and they said he was totally fine. Did an exam and everything checked out. They said he was constipated and were going to perform an enema but he ended having a bowel movement at the vet and they called me to pick him up. They said his agitation could be stemming from stomach pain, but when I got him home the behavior continued.  
I have looked all over my apartment for something that might be bothering him and I can't find the source. The only thing I can think of is that my roommate's girlfriend is currently staying with us for the week, but she's been here before and she's super sweet to him and he's never had a problem with her. He's also acting agitated right now and they're not even home.  
Please help, I don't know what to do. Something is bothering him severely and I don't know how to make him happy.",1,1,1,1.0,0,,/r/AskVet/comments/13t1myn/cat_has_been_acting_agitated_growling_and_hissing/,False,False
66,AskVet,2023-05-27 08:02:49,33nyx_,My 2 month old puppy has a protrusion in the place her umbilical cord was,"its like a swollen bump. is she okay is that normal?

Species: dog
Age: 1 month +
Sex/Neuter status: female/ non neutered 
Breed: stray
Body weight: 5 kg? 
Duration: 2 weeks
Your general location: india",6,1,1,1.0,0,,/r/AskVet/comments/13t1j86/my_2_month_old_puppy_has_a_protrusion_in_the/,False,False
67,AskVet,2023-05-27 07:54:31,Slipknot5151985,My Yorkie pup is sick,"Last night my pup vomited a few times and he's done it before so I didn't worry too much about it, he seemed lazy all day today and I can tell he doesn't feel good. I called the only Vet within 4 hours of my location and they won't be back in the office until Tuesday and I don't know what to do. He's already puked up the water I syringe fed him earlier and it had a horrible smell like rotted meat? Can someone please tell me what I can do for him until I can get him to the vet.",3,1,1,1.0,0,,/r/AskVet/comments/13t1eap/my_yorkie_pup_is_sick/,False,False
68,AskVet,2023-05-27 07:35:00,ChoiceAutomatic5660,Luxating Medial Patella,"My cat, a 1 year old ragdoll siamese was recently diagnosed with luxating medial patella. Grade 1 in his left and 2 in his right. I initially took him to the vet for his vaccinations, but he was limping at times as well. The vet didn't recommend surgery just yet, and told me to monitor his limping at home, if he increases. So far, I see him develop the limp when he jumps up onto the couch or cat tower or when he jumps down that he develops the limp. Should I listen to the vet and wait to monitor, I am just scared he is gonna develop arthritis at this rate as his knee pops out at least 5 times today.",1,1,1,1.0,0,,/r/AskVet/comments/13t13ij/luxating_medial_patella/,False,False
69,AskVet,2023-05-27 07:31:28,space___lion,Kittens heart sound,"Hi, looking for some advice. We’re purchasing two Ragdoll kittens from the same litter. They’re 12 weeks today and we’re planning on picking them up this Sunday. Yesterday the owner went for a last check-up and the vet heard a murmur in all 3 kittens in this litter. The mom and dad have been tested for HCM and passed in the time before breeding.

The vet said that it’s possible the heart murmur will disappear on its own, but getting an echocardiogram is probably wise regardless of whether the murmur persists or not. The breeder said the vet called it a ventricular septum defect.

What should I do? The breeder offered to pay some of the costs for an echo and is also willing to make an agreement for a money-back guarantee of sorts. We’ve been waiting for these kittens since February, when the mom was pregnant.

We were very excited, but now a bit unsure. How serious is this or could this be? Should we continue or cancel?",2,1,1,1.0,0,,/r/AskVet/comments/13t11jk/kittens_heart_sound/,False,False
70,AskVet,2023-05-27 07:15:05,thecatalystmoment,Stomach Cancer,"My dog was recently diagnosed with stomach cancer. I feel it is to late.. but is there any guidance, advice or products you'd suggest for me to give him? I just started him on Dramamine and a pain medication. But I just wish there was a cure to help :(

Dog: German shepherd/ Lab
Weight: 73
Age: 9yrs
Sex: Male
History: no history
Diagnosis: stomach cancer",4,2,2,0.75,0,,/r/AskVet/comments/13t0s6w/stomach_cancer/,False,False
71,AskVet,2023-05-27 07:11:08,1braincellhuman,how do i find vets near me that support raw diets in dogs?,"species: dog
age 
2.5yrs
desexed in january this year
staffy
30-35kg range
history: 
has environmental allergies that flare up mostly in summer. has been on apoquel in summer before. he is blue so i guess that’s where his allergies come from. i can’t let him go play in bushes anymore because his skin will flare up.  he gets bathed with malaseb 1x a fortnight but a little more frequent in summer. 
clinical signs: 
red rash on belly, underarms & chin/neck. 
located 1hr from sydney australia
duration:
started at 1yr old his first summer",5,0,0,0.25,0,,/r/AskVet/comments/13t0pxx/how_do_i_find_vets_near_me_that_support_raw_diets/,False,False
