index,subreddit,post_time,user_name,title,text,num_comments,score,ups,upvote_ratio,downs,likes,URL,over18,ASD
57,AskVet,2021-10-23 05:51:26,Putrid-Occasion1881,Can repeated exposure to marijuana smoke cause nerve damage in a cat?,"My friend's roommate's cat is a 14 year old overweight tabby cat who lives day and night in the kitchen. He can't go outside because he has severe allergies. Both him and his roommate regularly smoke weed indoors for medical purposes. My friend smokes in his room across the house from the kitchen with the door shut, windows open and makes reasonable efforts to keep the smell from traveling to the rest of the house, which roommate has said works well. The roommate is currently sleeping in the living room for unrelated reasons. He only smokes stiizy pods though the living room connects directly with the kitchen. The kitchen does have a door on it that always remains shut. 

Recently the cat was seen acting very lethargic and later was unable to walk properly. The roommate took the cat to the vet but when he returned he told my friend that the vet had asked him directly if anyone in the house smoked marijuana and then said that the reason for the cat's behavior was that it was being exposed so regularly to weed that it was constantly high and it was causing neurological damage. The cat is receiving treatment and is recovering well and my roommate no longer smokes in the house but my question is more about how a vet would come to this conclusion. Is it possible that it's so obvious weed was causing the issue that the vet felt confident to ask for it specifically? The roommate also said that the vet specified that a stiizy wouldn't be able to cause the damage in the way a bong or dab rig could which would make sense except that the roommate has confirmed themself that the efforts my friend had been putting into masking the smell had been effective and also my friend is across the house and the smoke would have to travel and get through a couple of doors. And yes, while a stiizy isn't nearly as strong, repeated use throughout the entire day still leaves the house smelling just as if you've been smoking from a dab all day and it wouldn't be hard to make it into the kitchen if people are regularly opening the door to go in and out. 

My friend and I are just really confused as to the circumstances of the diagnosis, especially since he's basically receiving all the blame. Also I apologize for the nature of the question, we realize exposing an animal to weed at all isn't ok so I just want to reiterate that the cat is receiving treatment, is recovering well, and weed is no longer being smoked around the cat.",3,1,1,1.0,0,,/r/AskVet/comments/qdyx49/can_repeated_exposure_to_marijuana_smoke_cause/,False,True
339,AskVet,2023-05-07 14:49:42,DommyMommyMint,Cat unable to urinate after getting blockage cleared,"Cat: 5yo male tabby, spayed, 20lbs, central coast area of CA.

I took him to the emergency vet 2 days ago to get a urinary blockage cleared. since he's been home I have been giving him the pain medicine and feeding him a urinary health diet (iams urinary health dry food). I also purchased a pet water fountain to encourage him to drink and have witnessed him drinking often. I am very concerned because he has not been able to urinate since he came home from the vet. I have watched him strain but not succeed. 

my problem is that I cannot afford to pay for further treatment and so I don't know what to do for him. Clearing the blockage the first time was very expensive and I am a single person who is only able to work part time due to health reasons. I don't want him to suffer and so I'm wondering if there is any way I can get help for him or even surrender him (which of course I don't want to do because I love him so much) somewhere where he can be treated.",42,28,28,0.89,0,,/r/AskVet/comments/13arar4/cat_unable_to_urinate_after_getting_blockage/,False,True
1526,AskVet,2022-04-22 13:45:51,Naima92231,Seasonal/vaccine-related seizures in 5-6-year-old dog?,"Hello. I have a very healthy 6-year-old Pit/Boxer mix (about 52 lbs.) whom I adopted from a shelter when she was a few months old. Aside from occasional GI issues (short-lived, and never terribly serious--the usual stuff), she's never had a health problem. She IS, however, an anxious dog who gets nervous when things change, or aren't in their usual places, etc. She falls in love with everyone she meets, but is very unwilling to go on walks, etc., with anyone except me. She is a sweetheart.
About 2 years ago, around May or early June, she had her first two 2 relatively mild seizure events (no loss of consciousness or ""paddling""--just unable to stand, shaking violently, smacking her lips, and looking terrified) about a week apart. Her vet checked her blood, and said that everything looked normal. There were no more incidents until...
The following spring, last year, she went to the vet 2 separate times within a few weeks for her boosters and rabies shots. Within between a few days to about 3 weeks after both visits, she had multiple instances of the same kind of events of varying length and severity (again, no loss of consciousness, etc., although one time she lost control of her bowels, which would NEVER happen otherwise).
I talked to the vet about it, and she asked me to keep a log. I also asked her about CBD, and, although she couldn't ""officially"" recommend it, she did say that some of her patients had had good results with it. So I started her on CBD oil--.5 ml. of 1200 mg. oil 2x per day.
A week after we started the CBD oil (I believe it takes a little time to start working), she had another 9-minute long episode (I got video of that one). It was awful, but, as usual when it ended she was back to normal and just wanted to go outside. That was 23 days after her last booster last year. It was on April 30th, and she had no more until...
Exactly one week after THIS year's boosters, which were given on 30 March, she had another episode. She was shaking so hard I was terrified she'd die. After about 5 very long minutes, she was fine again.
(I should also mention that she had an apparently benign mast cell tumor removed from near one of her nipples a few months ago, in winter, and she's recovered well, except that she is now terrified of the vet's office...understandably, as the procedure was no doubt really frightening for her. But there were no subsequent seizures then.)
Sorry for the long background story!
Of course I started to associate the seizure events as being related to the vaccinations, but I've seen very little reliable info online making that correlation, and the vet says it's not likely. But why do they always happen only in the spring, and within a few weeks of boosters?
The other thing I learned from ""Dr. Google, Veterinary Edition"" is that boosters for distemper/parvo/bordatella, etc., only usually need to be given every THREE years--NOT every year, as we've been doing per the vet office's suggestions. I've also read that multiple vaccinations boosters given at one time might be too much.
So...long story short... could this all somehow be coincidence? I'm wondering if (a) she's predisposed to seizures, and either the stress of the vet visits and/or the boosters themselves can trigger them, or if they can be seasonal. (I don't use fertilizers or pesticides in the yard, she doesn't go to dog parks, and we take our walks on city streets, away from other dogs. I have no plans to ever board her anywhere.)
One more thing--she's EXTREMELY heat-intolerant, which I assume is due to the Boxer in her.
Thanks!",4,1,1,1.0,0,,/r/AskVet/comments/u9f2f2/seasonalvaccinerelated_seizures_in_56yearold_dog/,False,True
2953,AskVet,2023-02-12 17:47:02,MoonyGraham37,My cat ate the smallest amount of garlic - should I get the vet involved?,"Details: my cat is 4 years old, spayed, domestic shorthair, she’s  probably 10+ pounds, and she’s extremely antisocial so taking her to the vet is a lot of stress for her. I also can’t really afford a vet trip just to hear them say she’s fine and I’m over-reacting. We also live in Connecticut, USA.

What happened:
I made dinner last night which calls for 1/16 of a teaspoon of garlic powder mixed with butter to go on top of what I made, which drips onto the plate. After I was finished I heard her lapping the plate because of the butter - I want to say 3 little licks - and then she looked up and started licking her chops so I imagine she definitely tasted the garlic. We looked at each other and I just kinda said “that’s…probably not good for you” and shoo’d her away from the plate. And then I looked it up online and apparently garlic is one of the worst things a cat can eat. Everything I’m reading says that 1/16 of a teaspoon per 5 pounds is fatal, but she’s 10 pounds and she only had a small fraction of 1/16 - just enough to taste it. Like. Literally maybe 3-5 actual specks of garlic powder.

Now:
I didn’t hear or see any vomiting and she’s acting fine this morning, but I know that it may take a couple days to a week for things to go wrong. Am I overthinking this or do you think she’ll be okay? I just need a second opinion besides my own. Thank you!",1,1,1,0.66,0,,/r/AskVet/comments/110lkm8/my_cat_ate_the_smallest_amount_of_garlic_should_i/,False,True
3016,AskVet,2018-01-17 04:59:48,iamukiki,Fostering a dog for animal control with wound they missed,"I am fostering a 3ish year old hound male who recently had his leg amputated and had his staples removed today. He had several wounds they ""cleaned"" but now one that appeared to be almost healed looks bad. They shaved the hair and it looks like removed the scab. He has antibiotics for his several issues, but is this as bad as I am thinking or just looks bad. They didn't mention it. He has a loose shirt on now so he doesn't lick and to keep dirt out. They are closed tomorrow so I'm trying to decide if it's an emergency and find an outside vet. It's on is rear side, not near the missing leg.  https://imgur.com/gallery/8QSyX",3,3,3,0.67,0,,/r/AskVet/comments/7qyo5t/fostering_a_dog_for_animal_control_with_wound/,False,True
3017,AskVet,2017-10-16 05:19:14,iamukiki,Is there any chance my sweet 7 month manx girl isn't going blind?,"So first off, vet visit first thing tomorrow, Tuesday morning at the very latest. Thursday morning for sure, her eyes were normal and not cloudy at all. I saw her Thursday night and everyday before today, but it has always been dim light cuddle time, so I could have missed it. Sunday afternoon I noticed her one eye is cloudy. She is otherwise acting normal. I've had her since 5 months and she has been healthy and okay' d by the vet at that time.

I've never had a cat have any kind eye problems. Any chance it is just maybe an infection or scratch? My two kittens do play fight a lot. Like I said, I'm getting her to the vet asap, I am just startled by the sudden onset.

My other kitten and adult cat are normal. Should they be seperated? 

Https://imgur.com/gallery/qNV3a",6,1,1,0.6,0,,/r/AskVet/comments/76oe9o/is_there_any_chance_my_sweet_7_month_manx_girl/,False,True
3019,AskVet,2017-09-16 22:27:52,iamukiki,"2 kittens (6 month, calico & manx) stuck without power and have cold.","I have 2 kittens (5lbs) that have a cold. One started getting sick before Irma (just sneezy), but everywhere was closed because of the impending storm. 

Power has been out since Monday and all the windows have been open in 90 degree house.

Now the other one is getting sick. They both sneeze a lot and have green eye gunk and watery eyes. They are otherwise acting normal. A little lethargic during the day, but so am I. It's Florida summer with no ac.

My vet is closed and so is most of the county. If I drive an hour, I can get them in to a vet, but cats and long car rides don't mix well.

My question is, based on their age and weight, does it sound urgent or can I wait til mid-week when I can get them into a local vet? They both just got the last of their shots and were given a clean bill of health a month ago.",1,1,1,0.6,0,,/r/AskVet/comments/70judj/2_kittens_6_month_calico_manx_stuck_without_power/,False,True
3022,AskVet,2017-06-06 16:10:00,iamukiki,2 spayed rescue hound mixes(1-4 years old?;60 and 80lbs) got their teeth cleaned yesterday and still seem sick or in pain.,"Both my dogs got their teeth cleaned yesterday for the first time. Prior to me owning them, they both had a poor diet (took a year to get one of them to stop eating dirt) and their teeth showed it. Nothing had to be pulled, but anesthesia was used. Neither has any current health issues (1 tested negative for heartworms for the first time).

Now, they both moan everytime they move. Their eyes are constantly watering and filled with boogers. Neither has an appetite or will drink water. Last night was worse. One cried a lot and couldn't get up by herself with her unsteady footing. It has been just over 24 hours and I'm starting to worry about the lasting risks of being put under. I also feel helpless and would do anything to help them.

I called the vet and they said this was normal and should clear up by tomorrow. Does this seem normal? Should I bring them back to the vet or is there anything I should be looking out for? Is there anything I can do to help them?",2,4,4,0.84,0,,/r/AskVet/comments/6fmrky/2_spayed_rescue_hound_mixes14_years_old60_and/,False,True
3024,AskVet,2017-05-03 03:36:06,iamukiki,5 week old foster kitten died. Feel terrible.,She looked broke. I think she fell.  She was fine 3 hours ago and seemed healthy. Are falling accidents common? What else could kill a seemingly healthy kitten?,3,2,2,1.0,0,,/r/AskVet/comments/68xzkn/5_week_old_foster_kitten_died_feel_terrible/,False,True
3025,AskVet,2017-04-03 00:42:41,iamukiki,"1y spayed female greyhound mix, 80lbs, has 3 red marks/sores after getting into hoarder neighbor's yard in Florida a week ago.","First one blistered and popped and is now mostly healed. The other 2 are bald and skin around sore is red, but no blister. One is on the neck where she can't bite, but is still bald. I have lasik tomorrow and I'm trying to decide of I need to find someone to take her to the vet or I am overreacting and she can wait a few days if they're still there. She is acting normal. I just found the other 2 sores. Also, for a month she has been chewing one area bald, but it is not red, although now it has little bumps too that look like pimples...",4,2,2,1.0,0,,/r/AskVet/comments/633gjs/1y_spayed_female_greyhound_mix_80lbs_has_3_red/,False,True
3030,AskVet,2016-11-02 17:08:25,iamukiki,Foster dog (1 year hound/lab mix) has generalized demodex mange and cough that is getting worse.,"I've had this foster for 2 weeks and he seemed to be improving and growing mire hair, but yesterday, he started coughing up blood along with the white mucus and for the past week his skin tears easier daily. He has had a slight cough since I've had him, but it keeps getting worse. He is currently on 1000 mg of cephlaxen daily, 50mg of tramadol daily, bath every 3 days and medicated dip once weekly. I contacted the vet and they didn't seem worried. He coughs everytime he walks at this point. He lays on the couch all day and rests.

Maybe I am over reacting, but is this part of the normal healing process for mange? They think he has blood in what he coughs up because his throat is irritated. At what point should I be concerned? I just feel bad he seems to suffer more everyday.",6,2,2,0.76,0,,/r/AskVet/comments/5ar4mc/foster_dog_1_year_houndlab_mix_has_generalized/,False,True
3053,AskVet,2022-07-05 03:34:40,schmyndles,I'm just lost on what to do next for my cat's continuing skin problems,"Cat, DSH, male, 9 yo, 20.5 lbs, indoor only, no other pets, otherwise healthy other than this issue and weight.

TLDR; Do I need a new vet? Should I get a second opinion? Is it normal for a vet to be so dismissive with these things? He recently took over the animal hospital and the previous owners were very different and they were the only vet I've ever used. I don't want to be spending all this time and money on special food that won't help him lose weight either if allergies are most likely not the issue. I guess I just feel like I'm failing him trying to be his doctor via Google, but also don't want to spend time and money finding a new vet to just be given the same vague non-advice. He's also been going to this place since he was a kitten.

Okay, the skin issue: My cat has had dandruff, scaly flaking skin, hair coming out, scabs and wounds, etc, for the past 6 months. Took him in for his wellness check and shots March 3rd. I wanted to get him on a diet and discuss the skin stuff, but I think the vet was in a hurry to leave. I even showed up a half hour early when they asked. He barely touched my cat, ran his hand up his back and said he's not able to groom because of his weight, to brush him more and feed him less. Really no guidance on either issue. 

I've used sprays and waterless baths, various brushes and combs, and nothing helps. Called them back a month later to schedule another appt and instead the receptionist said they'll give me Revolution in case there's fleas (which he was given at the beginning of April, no change). She also recommended adding omega 3 supplement oil to his food, which I did for a couple months. She also suggested it could be a food allergy which would require a limited diet. So it took me a bit to research foods, but he's been on a no chicken, fish, or turkey diet for two weeks (I stopped the Omega oil because it had fish as well). I know that could take a couple months to show improvement though.

I feel weird doing all this really without any guidance. I am still limiting his portions and measuring all his food, but it's been hard because I have been switching his wet food trying to find the best ones and the kcal in each one is different, so he's lost about a half a lb since March. I continually check for flea evidence as well. I'm afraid that this is really bothering him or that he'll get an infection before he loses enough weight or I figure out if it's a food allergy. Not asking for a diagnosis, just want to know if I'm on the right path or if I should find a new vet to help.  

[Here's pics and a timeline.](https://imgur.com/gallery/6o4D3YO)",1,1,1,1.0,0,,/r/AskVet/comments/vrondp/im_just_lost_on_what_to_do_next_for_my_cats/,False,True
3059,AskVet,2022-02-20 12:20:25,schmyndles,Ear mites treatment at home for cat?,"• Species: Cat

• Age: 8 years

• Sex/Neuter status: Male, neutered

• Breed: DSH

Body weight: 20 lbs

• History: Started approx two weeks ago, redness and fur missing from one ear, and had spread to both ears

• Clinical signs: redness, missing fur, scabbing, over grooming, overscratching, head shaking, black coffee grounds type dirt inside ear.

• Duration: two weeks

• Your general location: WI, USA

Hi, my car started showing all the signs of ear mites a couple weeks ago. At first I just thought he had accidentally scratched his ear, as only one ear was affected with redness. But last week both ears became affected, so I called the vet. They walked me through a list of symptoms to check for, and that's when I noticed the black dirt in his ears. He already has a wellness check (vaccines and a talk about his weight) scheduled for March 3rd, so the doctor said I could wait until then for treatment of the mites.

But I can tell he's miserable, and I want to make him at least comfortable until he can get in, so I called them back the next day (Thursday) and asked if there was anything else I could do. I'm already on the cancellation list, but she recommended getting some cat ear cleaner and using a cotton ball to try and clean them out.

So yesterday I went to the pet supply store and grabbed some car ear wipes, and I noticed they had ear mites drops for cats as well. I grabbed those too, would it be okay for me to try those? Idk if they would kill all the mites, but at least it might provide some relief for the next couple weeks? It's called Four Paws Aloe Ear Mite Treatment for Cats. It has pyrethrins (.05%) and piperonyl butoxide (.5%).

I just don't want to screw up any treatment the vet may have for him, or give him something that's dangerous. I know he's not officially diagnosed with mites, but the doctor and I both think that's the issue. I appreciate any advice you have!",2,1,1,1.0,0,,/r/AskVet/comments/sx03uv/ear_mites_treatment_at_home_for_cat/,False,True
57,AskVet,2023-05-27 10:34:11,Upset_Peach,Does a previous case of intussusception affect a cat long term?,"Does a previous case of intussusception affect a cat long term?

Species: feline

Age: 6 months

Sex: Spayed F 

Breed: Mixed Breed/Siamese/Domestic Shorthair

Body Weight: 5 pounds

History: Intussusception with surgery at 4/5 months old.

Clinical signs: She HAD lethargy, lack of appetite, abdominal swelling, diarrhea 

Location: Canada 

I adopted a Siamese kitten that I was originally fostering. She had a surgery for intussusception caused by parasites. 

The surgery was in April and currently she acts just like any other kitten. 

I have concerns about how this will affect her future. Is the rate of reoccurrence really high? 

She is on (and will remain on permanently) royal canin gastrointestinal diet to help her bowel sensitivity.",1,1,1,1.0,0,,/r/AskVet/comments/13t3z56/does_a_previous_case_of_intussusception_affect_a/,False,False
58,AskVet,2023-05-27 10:12:59,westbridge1157,Tummy ache or medical emergency?,"My two year old female GSD is having trouble pooping. She is herself in all other ways, running around, jumping on our other dog, looks and moves fine, she is however straining and we haven’t seen her poop today. 

She was fine yesterday and was given some raw mutton chop bones to nom on Tonight she is not pooping and not begging for dinner, but otherwise fine. 

We’re not close to a vet and not sure if this an emergency or a watch and wait. Any advice welcomed.",1,1,1,1.0,0,,/r/AskVet/comments/13t3mmm/tummy_ache_or_medical_emergency/,False,False
59,AskVet,2023-05-27 09:58:12,timmybauer1,Dog nail infection or?,"My dog has reddish/brown coloration on the base of one of his nails. It is the only nail that is like that. It’s been this way for a couple months and he has no signs that it bothers him. He doesn’t necessarily like it to be touched but that goes for all of his nails so i can’t be certain in that matter. It also looks like to be spreading down to the end of his nail. Im thinking that this might be a nail infection or maybe a bruised nail. Thoughts?
Here is some of his info:
pitbull/bulldog/terrier
Almost 3 years old
neutered
60-70 pounds

Here are some videos of his nail.

This one is from back in april
 https://i.imgur.com/uzTTOcy.mp4

and this one was from today
https://i.imgur.com/xGPVW6a.mp4",1,1,1,1.0,0,,/r/AskVet/comments/13t3dkw/dog_nail_infection_or/,False,False
60,AskVet,2023-05-27 09:54:54,Sakuiui,"Hey, I’m new here and have a serious question","My my cat has been having digestive problems for a few days now due to hairballs please let me know ways to minimise the chances of my cat gagging, losing appetite or having digestive problems because of hairballs, I heard there are pills that help the cats pass the hairballs through their system like normal food but I’m not sure of how effective they are and if they have bad side effects. If you guys know of any other solutions do let me know!",1,1,1,1.0,0,,/r/AskVet/comments/13t3boh/hey_im_new_here_and_have_a_serious_question/,False,False
61,AskVet,2023-05-27 09:54:32,SignificanceAfter456,Cat has eaten chicken wing bones,"My cat managed to get to some chicken wing bones and has eaten quite a few of them, she was fine all day and then was sick in the evening (about 16 hours after eating them) and two bones were in the sick. She is acting normal and still constantly begging us for food as she usually does. She was then sick the following morning with a tiny bit of bone in the sick and again seems absolutely normal. How long would it take for a blockage or tear to start showing symptoms such as no appetite, lethargy, sensitive tummy and hiding away as she has none of these common symptoms.",1,1,1,1.0,0,,/r/AskVet/comments/13t3bh2/cat_has_eaten_chicken_wing_bones/,False,False
62,AskVet,2023-05-27 09:35:09,DeepSeaUnicorn,Cat barfed after changing Prednisone dosage,"Hi! Our cat has been on 1.5 5mg pills/day of Prednisone for a month because he was barfing so regularly. He hasn't barfed once since the first day of the pill.  The vet just had us start to decrease the dosage to 1 pill a day on Monday and we think he may have barfed when we were away on a day after we lowered the pill since we found a puddle of barf. But now just as I fed him, he actually barfed immediately after eating. I'm afraid he didn't actually absorb his pill because he barfed as he was eating. 

The vets are all closed because it's the weekend and a holiday on Monday. It's about 600 euros just to walk into an emergency vet.

I know skipping dosages is bad. Do i try to give him a new pill? Do i up the dosage back to 1.5 until the vet opens up on Tuesday?",1,1,1,1.0,0,,/r/AskVet/comments/13t3096/cat_barfed_after_changing_prednisone_dosage/,False,False
