index,Index,is_post,subreddit,post_time,user_name,title,text,num_comments,score,ups,upvote_ratio,downs,downvote,likes,URL,category,content_categories,over18,asd
20,21,,depression,2023-05-27 06:51:41,00Makerin00,My Life Is Over,"Just wanted to keep this short. I’m a 23 M living in Canada. I have no dreams, energy and social skills, and no friends during the past decade. I’m also constantly thinking of bad things that I have done in the past. I don’t mean to sound like an incel when I say this but it’s over, there’s no soul I’m just an empty shell walking the earth.",3,3,3,0.81,0,<bound method VotableMixin.downvote of Submission(id='13t0e2k')>,,/r/depression/comments/13t0e2k/my_life_is_over/,,,False,False
21,22,,depression,2023-05-27 06:29:18,existentiallystupid,Inconspicuos title,"I cant name this post anything that i actually mean because my mom is making restrictions worse. She tracks earch history, blocked all social media, wont pay cell service, blocked youtube, and any time i install something she removes it. Im 16 with no freedom. I dont have any friends. Im inside all day with nothing to do and my loneliness and suicidal thoughts are getting worse. I talked to her about all he restrictions and she outwright denied all of it to my face. She said it must be a bug or error. What if shes right? Idk anymore i just wanna talk to somebody. I havent cut myself today for the first time in weeks but im still considering it. Even though i want to talk to someone my mom set my phone to lock for the night in a few minutes. I dont think ill be able to keep myself from self harm tonight. I feel horrible idk whats wrong with me idk whats happening im so lost lonely and confused i just want a friend. When i bring up restricitons she always removes them for a bit and then puts rhem back even worse than before and i dont know if im paranoid or if im being gaslit i just want to fucking talk to someone. Gtg not like anyone will see this anyway",1,1,1,1.0,0,<bound method VotableMixin.downvote of Submission(id='13t00r2')>,,/r/depression/comments/13t00r2/inconspicuos_title/,,,False,False
22,23,,depression,2023-05-27 06:26:18,Break_Open,ugh.,"The person I am with is so narcissistic that I have to circle logic my own entire logic process because she thinks gaslighting on all her points instead makes me care about hers and nothing about mine like I just ""HAVE HALVE"" I just half to care about her half since I care about her's... I say your points have nothing to do with mine... and she gets uglier.",0,1,1,1.0,0,<bound method VotableMixin.downvote of Submission(id='13szyzb')>,,/r/depression/comments/13szyzb/ugh/,,,False,False
23,24,,depression,2023-05-27 06:25:11,OrganizedErraticism,My Disposition,"Not necessarily looking for a diagnosis as much as I am to vent-however, thoughts on what I may be experiencing are welcome.
Notes/behaviors:
1. For some time I’ve been someone who becomes completely captivated by a particular thing and obsesses over it until suddenly I become disinterested. Looking back on it it’s unfortunate because there have been a lot of things if I had never stopped pursuing could have a future in. I learn the things I envelop myself in fairly quickly and it’s almost like my brain hits a threshold of satisfaction prompting me to want nothing to do with said thing anymore. Throughout the years I’ve spent copious amounts of money/time into things I’ve never fully pursued.
2. I’ve noticed unwise purchasing decisions, mostly recently. I think this could be because I never had much to spend before recently. One of my things I picked up was trading card collecting, I’ve spent a few thousand dollars on trading cards and when I get them in I never feel satisfied, I feel like I’m supposed to feel something else-yet, I keep buying them. I lost $600 sports betting today on bets I really wasn’t educated on, and lost $3k last week, thankfully gambling is something I had just picked up and am leaving behind. I amass money and it feels like I need to get rid of it, and so I spend and then I feel awful and anxious about my financial security, why?
3. Repeating actions to try and feel satisfied. Recently I’ve been noticing that I’ve been repeating actions such as pushing my hair back, biting my nails, picking up and putting something down until it “feels right”, but it never feels right and it becomes a monotonous cycle that affects my job/life and the more I think about it the more uncomfortable it makes me.
4. Obsessing over things that could be “wrong” with me. I once spent 7 hours researching literature on schizoaffective disorder because I noticed one or two things that I seem to have related to and thought it must be what’s wrong with me. This extends to practically anything ex. Spot on skin (skin cancer), and in that moment it really feels like I have it and I believe it, I always eventually become rational and realize I don’t but when I get caught up in this catastrophic type mentality it becomes debilitating. Believing that something catastrophic is wrong with me or a loved one creates a subconscious perception that the rest of my life is meaningless.
5. Alcoholism- I just completed my graduate degree and looking back on my last few years in college I can’t put together more than a three day consecutive span where I was completely sober. This scares me and I tell myself drinking every other day or every two days is okay-but it’s not. 
6. Purpose/The future- I have two degrees, the latter of which I finished first in my class. I’ve had some great job opportunities but for some reason am settling for mediocrity. I’ve even had a few Professor go out of there way to have people in my industry interview me- all of which I missed or never contacted back and the shame I would feel after blowing these opportunities is immense, but yet I keep doing it. Now I need a good job, the clock is ticking, and I don’t have one. I often think about what the point is or why I’m here and the lack of a fulfilling answer cripples me.",0,2,2,1.0,0,<bound method VotableMixin.downvote of Submission(id='13szy9w')>,,/r/depression/comments/13szy9w/my_disposition/,,,False,False
24,25,,depression,2023-05-27 06:15:47,tannahxoxo,I used to be so positive,I used to be such a positive person. Now I can’t stop negative thoughts and thinking about worse case scenarios. I have little energy. I just feel like I’m going through the motions 😢,2,2,2,1.0,0,<bound method VotableMixin.downvote of Submission(id='13szsmh')>,,/r/depression/comments/13szsmh/i_used_to_be_so_positive/,,,False,False
25,26,,depression,2023-05-27 06:14:08,Anxious-Ad-4763,not suicidal but i wish to die everyday,"every single aspect of my life is shitty,
The weird thing i know how to fix my life

for example:
Like i hate my body but i know I can have  an amazing body if i just worked out for 3 months.....
it's not just hating my body i can't find my purpose in life

but i have no energy no purpose to do anything in my life , i don't want to be dramatic but every single time i go to sleep i wish not to wake up, and everytime i wake up i get little bit sad that i Woke up !

there's no self harm i just gave up life and can't get it back , nothing matters im cold AF and losing emotions everyday


im venting and hoping if someone explain what happened to my brain suddenly i switched from an enthusiastic person to someone who (have + going to ) give up in every single challenge , and failed everything in life from Education - Relationship - Work 

ps : im going to be homeless soon i got rent due and can't get my ass to apply for a job and probably will not",0,1,1,1.0,0,<bound method VotableMixin.downvote of Submission(id='13szriw')>,,/r/depression/comments/13szriw/not_suicidal_but_i_wish_to_die_everyday/,,,False,False
26,27,,depression,2023-05-27 06:08:57,BipolarDisorderly,What if I never find peace in my lifetime?,"I've always been able to find pleasure in life, I just don't know if I've ever enjoyed it. It's gotten a lot worse where, it's pretty apparent I'm not enjoying life at all no matter what I do. I made a vow to myself though when I first started dealing with depression and suicidal thoughts where I made the decision that I would never give up no matter how bad things got. And I never have, because I believe our lives are short enough that I could endure an entire lifetime of suffering even if I'm only doing it just to find out if things will get better. Which brings me to my point... What if things actually do never get better?

&#x200B;

That's the reality I'm trying to prepare myself for, because what if that's just the way I am? That I'm just someone who can't enjoy life? How do I find any meaning in life then?",2,6,6,1.0,0,<bound method VotableMixin.downvote of Submission(id='13szo4x')>,,/r/depression/comments/13szo4x/what_if_i_never_find_peace_in_my_lifetime/,,,False,False
