index,Index,is_post,subreddit,post_time,user_name,title,text,num_comments,score,ups,upvote_ratio,downs,downvote,likes,URL,category,content_categories,over18,asd
12,13,yes,depression,2023-02-20 17:34:29,luna_bea_tuna,I make things worse,"I'm at the point where I can see my family would be better off without me. Sure it would be hard for them, and probably traumatizing to my son, but I'm realizing that it would be even worse if I stick around (in the being alive sense). 

I'm the problem! 

This should be bothering me more. But i think I've come to peace with this.",0,1,1,1.0,0,<bound method VotableMixin.downvote of Submission(id='117f0hz')>,,/r/depression/comments/117f0hz/i_make_things_worse/,,,True,True
17,18,yes,depression,2022-12-16 08:46:15,luna_bea_tuna,How do you stay patient waiting for medication to work? push through or taper down medication,"Hello hello. I am 4-6 weeks into brintellix for depression (I'm on venlafaxin for anxiety). Started at 10mg, about 2 weeks ago felt increased depression and anxiety and I increased my dose to 20mg (my doctor said that would be ok). I know it is supposed to take weeks if not months to feel a difference, but every day has been filled with dread, constant self hate, low energy, bad mood, and just wanting to end my life. If anything depression is worse than before and have even less energy to fight.

On top of that, I have gained 20lbs since started brintellix, and I worry if I don't stop this medication then I will be depressed and overweight. I can feel myself having a strong negative mental reaction to being overweight, which I think in itself is something to understand (why do I feel this way?).

TLDR; feeling more depressed from medication. Should I stop and try another? How do you push through to the point where it could be working?",0,1,1,1.0,0,<bound method VotableMixin.downvote of Submission(id='zna3os')>,,/r/depression/comments/zna3os/how_do_you_stay_patient_waiting_for_medication_to/,,,False,True
19,20,yes,depression,2022-11-30 07:25:44,luna_bea_tuna,I can’t do this anymore,I have a 3 year old. And everyday is crying and kicking and screaming at me. I can’t take the noise and stress and struggle to do anything. My life is relatively easy and everything is hard for me. WHAT THE FUCK IS WRONG WITH ME. I DONT UNDERSTAND HOW ANYONE EVEN JUST LEAVES THEIR HOUSE ON TIME WITHOUT HAVING A FUCKING MELTDOWN. FUUUUUUUCCCCCCKKKKKKK!,4,3,3,0.8,0,<bound method VotableMixin.downvote of Submission(id='z8kw6y')>,,/r/depression/comments/z8kw6y/i_cant_do_this_anymore/,,,False,True
21,22,yes,depression,2022-11-15 09:16:53,luna_bea_tuna,Visualized tools for depression,"Hi - I suffer from anxiety and depression and take medication for both, and am in therapy to articulate the way I feel, have someone challenge or validate feelings, and learn tools to use on a daily basis to help myself when I am feeling deep sadness, hopelessness or purposelessness. 

What I haven't been able to do is really take anything I learn in therapy to help myself outside of the 24hr window after therapy. My brain is so fuzzy that I struggle to remember the tools I have learned and it feels like I haven't grown at all and am in the same spot as years ago. So I get caught in the whirlwind and spin out.

I started watching (haven't finished) the Jonah Hill netflix special about his therapist, who uses some drawing/visualization techniques (in the therapy session at least) and I felt inspired. I am thinking of having physical things to remind me of different tools to use - either like actual objects/jewelry or drawing/non-permanent tattoo/stickers. 

So for reddit I ask this:

1. What are your ''tools'' / techniques for working through feelings in the moment?
2. Do you have any physical/visualized objects/techniques to remind yourself? Or if not, how do you remember them? Or jolt yourself out of a moment to remember that you even have tools?

I expect not every technique works for everyone, and that everyone struggles with different depression and anxiety challenges, but I appreciate any shared thoughts.

I'll post what I end up doing - maybe it will resonate with someone else out there in the ether.",0,2,2,1.0,0,<bound method VotableMixin.downvote of Submission(id='yvrt9b')>,,/r/depression/comments/yvrt9b/visualized_tools_for_depression/,,,False,True
22,23,yes,depression,2022-11-12 17:23:20,luna_bea_tuna,What is my depression telling me?,"Is it correct to think that when I feel depressed, it’s my mind/body telling me something is wrong and needs to change? Like do you “listen” to your depression and realise there are particular things driving it and that these things need to change?

Or is it really a feeling that is independent of that, and that I can feel no matter what is happening in my life?",4,3,3,0.81,0,<bound method VotableMixin.downvote of Submission(id='ytd5zd')>,,/r/depression/comments/ytd5zd/what_is_my_depression_telling_me/,,,False,True
24,25,yes,depression,2022-08-17 08:05:30,luna_bea_tuna,No way out.,"My partner and I have no interests in common, we don’t see the same future (but I have never seen one and only wish for death every day), and are constantly fighting. I never look forward to being with her. Our relationship and fights are what pushes me into depression, though I’m sure I would be miserable anyway. We have tried couples therapy and I think we need more help but she doesn’t want to go to more. I really want a divorce.

But wait! We have a 3 year old, and both live abroad temporarily and both come from different countries. So if we split up, there’s no clear way we can both be with our child unless we continue living abroad, which I know she will not want. And maybe we can’t afford to live apart either. Neat!

There’s no future I can imagine where I will be happy. Either stay in a shit marriage for the kid, or divorce and maybe fuck up their life because probably I wont be around since I wont be able to live in the same country. 

Everyday for the past 20+ years I’ve thought about killing myself / wishing I were dead. I tell myself “you are a piece of shit. You are a monster” every day. And it never occurred to me that maybe not everyone thinks that way until recently. This is…a rant I guess.",2,2,2,1.0,0,<bound method VotableMixin.downvote of Submission(id='wqj5is')>,,/r/depression/comments/wqj5is/no_way_out/,,,False,True
816,817,yes,depression,2023-01-03 08:22:19,GhostAmethyst,Is it Winter blues or just my life?,"I’m gonna keep a lot of details to a minimum just so I’m not typing a novel. 

My fiancé and I are both disabled, mainly in huge part to our mental health. But these past couple months we’ve had some positive changes happening around our life and more to come. Mainly along the lines of finally being able to make a more accommodating apartment space that could potentially help us a whole lot with daily functioning. 

I know during the Winter people tend to feel depression symptoms going up. But I don’t know if it’s just that for me. Because every time I have things going on, I think about people that aren’t around in my life anymore and it just pushes me further into depression. 

My father walked out on me as a teen and I often think where he is in life and when I have things going on, what he would think of me. My grandmother passed away 4 years ago, before I had any semblance of stability and so I often wish I could share this life I’ve been building with her. I think about friends that just aren’t around. And more recently having to distance myself from the rest of my family, and so I think a lot about how I can’t share any of my life with them. For my own sanity, trust me, it’s best not to. 

I’m also neurodivergent and I struggle immensely with building relationships and making friends. So when I have a lot of changes happening, it quickly feels isolating and lonely because I genuinely don’t have anyone I can share it with. I’m part of a small community on Instagram, and a lot of my internet friends are always happy to hear what’s going on, but it’s more of passing updates. It’s never full conversations about my life or theirs. Not anymore. All the friends I used to have that used to know everything about my life, don’t want to be in my life anymore. 

Idk. It sucks sometimes looking back at all the work you’re doing (therapy and otherwise) and realizing you can still wake up and feel like nothing matters.",0,1,1,1.0,0,<bound method VotableMixin.downvote of Submission(id='1022fut')>,,/r/depression/comments/1022fut/is_it_winter_blues_or_just_my_life/,,,False,True
831,832,yes,depression,2022-05-14 12:31:39,GhostAmethyst,Consequences of Hygiene Struggles,"Been feeling incredibly insecure for quite a few months now. At one point over initial pandemic my depression got pretty bad. I was basically showering once a week, IF that. It was so hard to feel any motivation to for reasons on top of my depression. 

What I wasn’t expecting though is that in that time I was going to create more problems for myself later. I’ve always struggled on and off with dry scalp and dandruff. I’ve changed my shampoo and shampooing routine more times than I can count. It didn’t occur to me that not showering often enough for an extended period was going to cause extremely stubborn build up on my scalp. 

At this point it’s led to my hair falling out. And the worst part is it’s BARELY motivating me to wash it more frequently. I’ve switched to more natural products and have bought this specific scalp scrubber, and also have been doing oil treatments. I think I’d be seeing quicker progress if I could stick to being consistent with it. I even cut off all my hair to make things easier. 

It just sucks. It brings up feelings of me being a failure in some way because there’s this awful in my face physical evidence that I can’t take care of myself well enough. 

Has anyone else had consequences of hygiene issues due to depression? Doesn’t have to be hair related, just curious.",8,15,15,1.0,0,<bound method VotableMixin.downvote of Submission(id='upga0k')>,,/r/depression/comments/upga0k/consequences_of_hygiene_struggles/,,,False,True
833,834,yes,depression,2022-02-24 21:37:59,GhostAmethyst,Anyone else feeling self destructive today?,[removed],0,1,1,1.0,0,<bound method VotableMixin.downvote of Submission(id='t0m4zc')>,,/r/depression/comments/t0m4zc/anyone_else_feeling_self_destructive_today/,,,False,True
1475,1476,yes,depression,2020-12-04 23:39:44,cyborgmonkey-,A hopeless loser,"Younger and less qualified people are getting promoted. My mental illness has held me back. After 20 years I am still at the very bottom of the ladder. I am a smart good worker, and self sufficient. But they never let me have any extra responsibility ever since my breakdown 3 years ago.

Now I have a 20 something ""lead"" worker who has to ask me questions.

I'm ashamed and embarrassed to even be here. I hate myself for being such a loser.

I told myself I didn't care anymore but this last promotion triggered me bad. I've wanted to self harm for the first time in a year. I keep breaking in to tears.

I am a good dad and husband and I still provide for my family.  Why does my lack of success at work make me hate myself so much?

Plus I am trapped in a small town with the only job with benefits to cover my meds.

It feels so hopeless.",0,2,2,1.0,0,<bound method VotableMixin.downvote of Submission(id='k6wf3i')>,,/r/depression/comments/k6wf3i/a_hopeless_loser/,,,False,True
1485,1486,yes,depression,2020-09-24 01:28:46,cyborgmonkey-,Overwhelmed.,"I have depression, anxiety, bipolar. A couple years ago we had a wildfire in my town and had to evacuate. (Town was okay) I also got denied a promotion that was my only way out of a dead end job while I was evacuated. I had a breakdown. Lots of self harm, suicidal thoughts. I went through a bunch of therapy. Got proper meds. Was doing good. Then coronavirus and political unrest. Avoiding politics on here but lets just say all my coworkers are on the opposite side of me. My boss constantly rants about it. Which is starting to literally make me feel ill. Now there are wildfires again. Not endangering my home but seriously making the air toxic for a few days. Spiking my anxiety. Reminding me of my breakdown. Now my kids (who both have special needs) are doing online school. My wife does most of it but I still have to be up sometimes at 8 to help the 7 year old even on days I don't work until 2 pm. I love my son be he has so many meltdowns it also makes me feel sick. We had a 30 minute meltdown over a dropped pencil two days ago. My goldfish are my Zen place but they got a parasitic infection and are sick. I'm treating it. Hoping I got it in time. I will sob if my favorite goldfish dies. Her little happy waggles get me through rough days. I learned a way to survive in the world with my mental illness. But now the world is changing so rapidly that I'm worried I will get overwhelmed. I had to take yesterday off work because I could not stop throwing up from nerves and crying. I don't know what I'm expecting from writing this. I don't really think anything will help. But maybe it will help just to feel some love and feel like I am not alone.",0,1,1,1.0,0,<bound method VotableMixin.downvote of Submission(id='iynh7u')>,,/r/depression/comments/iynh7u/overwhelmed/,,,False,True
1843,1844,yes,depression,2014-03-19 23:45:02,thetreecycle,Today is a success because I have continued.,"I didn't do anything today. Or did I? 


",1,2,2,1.0,0,<bound method VotableMixin.downvote of Submission(id='20uwar')>,,/r/depression/comments/20uwar/today_is_a_success_because_i_have_continued/,,,False,True
2437,2438,yes,depression,2019-12-27 22:58:06,aairo1228,How do I thrive again?,"Tw: major depressive disorder, anxiety, PTSD, abuse

Hey everyone, I'm 27, in college, and I have major depressive disorder, PTSD, and anxiety disorder. 5 years ago, I was able to hold a job, I was in college, and I had stability. I decided to quit work, and my wife and I went to school together. 
I'm still in school, after failing a few classes and being unable to keep up with the course work, I tried to calm the school thing down and go part time and work part time. Well, 5 jobs this year and I haven't managed to keep a hold of one for over a month. I have panic attacks that are so bad that I faint or throw up. And it's just over leaving the house. I've tried to relax, tried to find outlets with friends and I can't even manage that these days. My wife is super supportive, and kind. She understands, but I feel like I'm letting her down by failing so much at what I set out to do. I'm an artist, and haven't even sat down to paint or draw in months. 
This decline has happened over the course of a year, I'm feeling worse and worse about myself, I'm terrified I'm going to lose financial aid, and that we'll be homeless. I feel so hopeless and worthless.
I don't have insurance, and there's no counselor or therapist that's free out here that's equipped to handle someone like me, I've tried the only free resource out here. 
I genuinely don't know what started this decline in my mental state. Idk if it's just childhood trauma coming to a head, if that's the case why it started now, or how to even get out of it. I need advice and resources to resolve this...
Thank you all for listening.",1,1,1,1.0,0,<bound method VotableMixin.downvote of Submission(id='egiceq')>,,/r/depression/comments/egiceq/how_do_i_thrive_again/,,,False,True
2957,2958,yes,depression,2023-02-21 21:58:55,No-Macaroon-9902,Feeling kind of bad lately,"my mental health has been a problem for a long time. i have found some answers to some issues but the depression has been getting worse lately (isolating - meaning i don't even feel comfortable in the garden - and self harm have been the obvious expressions).

i was referred to a local mental health team but it has been months and it is so difficult to talk to anyone. they call me and either i miss the call or i'm really not prepared for the call so i don't answer. i call back and they are either engaged or i speak to a receptionist and nobody is available and they will call me back but it takes hours and i do not feel like talking at that point. i asked if i could communicate with them via email but apparently the receptionist can't give out any emails because the person who has the email address would have to agree. i was thinking of writing a letter but i'm worried they will just tell me to call. i am okay with appointments where i have to see someone because i see that as a situation where i have to be in a room and at least something will happen (and i have practiced this way of thinking with seeing the doctor and it has worked. i am still polite and don't say how bad things really are but i have written things down and have spoken more than i ever have - but my doctor changed and my new doctor has basically referred me to this mental health team and said they are just their for medication reviews so the one place i started to feel relatively comfortable talking feels closed off).

i've asked family for support but again, talking isn't so great  so i emailed and they haven't mentioned anything to me. it has been a week. i'm not sure what to do. my work doesn't make me feel so good and i have had interview dates for a few new jobs but i can't bring myself to go and cancel and i'm closing doors that maybe could make things a bit better and i don't want to but i think not having the interviews is better than turning up and having a rough time at the moment as it will sink my mood even more.

the sinking down to a very low place is in progress and i'm aware my reaction to this is becoming progressively worse. i'm not sure what the point of this post is but i guess it is just nice to be able to say it somewhere.",0,1,1,1.0,0,<bound method VotableMixin.downvote of Submission(id='118gcsa')>,,/r/depression/comments/118gcsa/feeling_kind_of_bad_lately/,,,False,True
12,13,,depression,2023-05-27 08:21:45,King_Ziminiar,I need advice,I need someone to talk to,0,2,2,1.0,0,<bound method VotableMixin.downvote of Submission(id='13t1u0z')>,,/r/depression/comments/13t1u0z/i_need_advice/,,,False,False
13,14,,depression,2023-05-27 07:48:44,Due-Violinist5278,I'm struggling. I lost the love of my life Monday night. The grief is physical pain. I made her a video to try n keep busy. Pls watch n share. Every view means her smile is on one more screen. And I'm keeping her memory alive. Thanks,"We met @ school w about 350 ppl in an auditorium. I had seen her speak and It was love at first sight. She was brilliant and beautiful and nerdy, and sarcastic, and spunky. 
I got the courage together to walk up to the podium without permission in front of 350 ppl . And I went to the mic and said. ""My names John and I'm madly in love with Victoria Vaughn! Will u go out w me""? The whole place went nuts. I got in trouble and she got embaressed. We were together after that.  Lol we both had issues w addiction. We ended up dating for 3 yrz. 

We got sober together, baptized together, and then we got engaged. We had a little tiny 1 bedroom apartment on the ocean in north Florida. And they were the greatest memories of my life. Times were simple. And no one existed on the planet except her and I. We prayed together everyday. And there was a buzz about us, because we kind of knew if we stayed sober, what an incredible team we would make.

 She was straight a, very driven and positive person. One of the hardest workers I had ever met.. AND THE ONLY WOMAN MY MOTHER AND DAUGHTER EVER APPROVVED OF...But we relapsed and fell apart. And she ended up moving to Virginia to get away from the drugs and finally b ful time mother to her son. I respected her for that. The plan was, we both get it together, and someday, we find eachother again.

 Unbeknownst to us. She had picked up drinking. And after only 4 yrs. She got cirocis of the liver. When she got ill I was luckily sober and begged to b by her side. I texted her and called her everyday. She refused to let me see her in that state. We were expecting  a liver transfer and a long road to recovery. But she passed away on Monday night due to an anuerism and then no brain function. 

I made this video to deal w the trauma n grief of being sober and never in 36 yrs feeling this way about a loss. But man am I grateful for the ability. I've lost my father, my little sister, my 2 very best friends, my boss, and my ex gf, and now my ex fiance, all to this disease. Which is why I started the reddit grp
 r/sobrietynothercoolsht in the first place. 

Here is a video I made to try and express how much I loved her. I sang it to her all the time and I changed out the chorus from ""euphoria"" to her name ""victoria"" it always made her smile. Let this b a message. This disease of addiction is running us down, no matter our condition and its slaughtering us. We have a better chance of surviving war, than we do a disease of the mind that perpetuates fear and uncertainty and emotio instability. If u r surviving today. You are a physical tangible, piece of evidence that god exists. And I am here for each and every single one that reads this msg. Dm me anytime. Because there is someone out there that feels this same way about you. Love u guys.
https://youtu.be/xBlcMXEGrm8",0,1,1,1.0,0,<bound method VotableMixin.downvote of Submission(id='13t1b02')>,,/r/depression/comments/13t1b02/im_struggling_i_lost_the_love_of_my_life_monday/,,,False,False
14,15,,depression,2023-05-27 08:18:06,jitsupigg,When it rains it pours.,"Lately, as in the last couple of weeks, I’ve (M 35) been really depressed and the thought of ending my life has been on the forefront of my mind. I don’t want to workout anymore. I barely want to eat. I feel my family would be much better off if I were dead. 

It’s starting to effect my judgement. Last week at work, I did something, that at the time I felt was innocuous, but I’ve always known to be stupid. Yet, I did it anyway. The wrong person saw. I got written up. And if there is any further fallout from this I will likely lose my job. Now, my coworkers are seemingly ostracizing me and won’t communicate with me. 

I already feel that I am failing as a man. I feel I am failing as a husband. Worst of all, I am failing as a father. If I lose my job I won’t be able to provide for my family. We are stretched thin as it is. My 1 yo is constantly getting sick and we’re going in and out of the hospital/Dr office. My 2 yo seemingly actively hates me and wants nothing to do with me. And to top it all off, the 25th of May, is the anniversary of my best friends suicide.  

I am having a tough time, but I don’t want my wife or anyone else to find my body.",0,2,2,1.0,0,<bound method VotableMixin.downvote of Submission(id='13t1rzy')>,,/r/depression/comments/13t1rzy/when_it_rains_it_pours/,,,False,False
15,16,,depression,2023-05-27 07:56:59,milkisanuwu,Advice (M17),"I just need some advice. I just got on summer break (for my final year of school), and I am scared. The year before when I had to be homeschooled (COVID), I was at a low point (that progressively rose overtime), but I am scared to be back at home again for the majority of my time. I am anxious that I will be depressed again, and I keep overanalysing everything I do and linking it with that dark period. The stuff I keep linking is completely unreasonable too, an example is watching shows and anime (idek how that logically would make me depressed). Do any of you have advice or sound logic for me hear and stuff?",2,2,2,1.0,0,<bound method VotableMixin.downvote of Submission(id='13t1fr2')>,,/r/depression/comments/13t1fr2/advice_m17/,,,False,False
16,17,,depression,2023-05-27 07:43:00,MiddleRest8738,Need some names,"I will be unaliving myself within 2 years.. ..Am done. No genuine friends.
.No caring family.. No love... I did self harm.. it's doesn't do sh*r.. Its.short term to let go.im that moment...
Only reason am alive is my mom, as long as she there I won't do any anyhing stupid... Any tips to Prolong my life... 
Tldr ... I needs ur tips to basically to avoid mental pain ..  I drank , did drugs and did severe self harm.  None of them even stop my mind  feeling all the paini felt and accumulated over years.

Don't report. I won't kill myself even though am dead inside",1,1,1,1.0,0,<bound method VotableMixin.downvote of Submission(id='13t17uh')>,,/r/depression/comments/13t17uh/need_some_names/,,,False,False
17,18,,depression,2023-05-27 07:12:46,ThrowAway4Venti,I'm to blame,"I know I contributed to what happened. I talked about something I shouldn't have, and now people are hurt. 

I talked to a friend about my depression, how bad it was. He had some sort of psychotic break the next day, and hurt himself and someone else. 

No one knows aside from him. And I don't think I will ever see him again. But I wish I had kept it to myself. I knew better.",1,1,1,1.0,0,<bound method VotableMixin.downvote of Submission(id='13t0qwy')>,,/r/depression/comments/13t0qwy/im_to_blame/,,,False,False
18,19,,depression,2023-05-27 07:10:45,Exxeviant,Really miss my dad.,My dad passed in 2009 of a brain tumor I'm now 26 and just had my first child my side of the family is never involved with my newborn but my wife's is always there I feel a sore loss like that's something I could never provide I wish he was here.,0,1,1,1.0,0,<bound method VotableMixin.downvote of Submission(id='13t0ppg')>,,/r/depression/comments/13t0ppg/really_miss_my_dad/,,,False,False
19,20,,depression,2023-05-27 06:52:33,selainx,i dont deserve anything except,to be tortured and killed.,1,1,1,0.67,0,<bound method VotableMixin.downvote of Submission(id='13t0ekw')>,,/r/depression/comments/13t0ekw/i_dont_deserve_anything_except/,,,False,False
