index,subreddit,post_time,user_name,title,text,num_comments,score,ups,upvote_ratio,downs,likes,URL,over18,ASD
87,offmychest,2023-05-27 10:45:34,thisjustfeelsbad,"i feel like a bad ""survivor""","im putting this as nsfw just for the vague mention of abuse. i don't want to get into things too heavy, but still. why not. 

background. im 25f. in my teens i had a couple back to back pretty abusive relationships. both more leaning into sexual abuse and mental. i got out, i moved on. im in a happy relationship, coping well on my own outside of therapy, have a good job, a good apartment, and great pets. life's good. 

but i can't tell people about the shit that happened to me. not because i'm ashamed, not because i'm scared, nothing like that. but because of people's reactions. if i have to hear one more ""omg 🥺 i can't believe that 😔 you're so strong 💗 such a brave survivor"" im gonna become the abuser myself and start throwing hands. 

i get a lot of it is that abuse is an awful, awkward subject to even hear about, and i get that. i just don't want to be ""girlboss empowered"" because i was violently raped on a normal basis for two straight years. i just want to have a normal, respectable life where i don't have to hide my past. i'm not a survivor or some fucking pillar of strength for leaving on my own or any of this bullshit, i'm just a person trying to get through the day. and i feel like as soon as someone knows i'm an abuse survivor, they either treat me like i can handle anything no problem or with kiddie gloves. im a normal person!!! just because bad things happened to me doesn't change that!!!",1,1,1,1.0,0,,/r/offmychest/comments/13t45s0/i_feel_like_a_bad_survivor/,True,False
88,offmychest,2023-05-27 10:31:44,justkeepbreathing94,I'm crying at the thought of my wife dying.,"My wife and I are 29 and both of us are healthy. She's sleeping and I'm sitting here looking at her, and the fact that every moment we're creeping towards death and one day I'll lose her is making me cry right now. If she ends up dying before me, I really believe I'll just follow her, because I couldn't imagine being without her. Maybe I'm more existential today than usual, but this thought is lingering and knowing this time with her will one day end is breaking my heart right now. Sorry, this isn't something I would just casually say anyone I know, so I wanted to say it here.",1,1,1,1.0,0,,/r/offmychest/comments/13t3xst/im_crying_at_the_thought_of_my_wife_dying/,False,False
89,offmychest,2023-05-27 10:27:30,Honobia,Might be time to move on.,"He flirts with every girl, including our mutual friend and boss. Not just flirts but like booty smacks and pervy comments. He is emotionally closed off, almost never talks about himself, any information is few and far between, and half of it from coworkers. He is an ex-addict, and that would always worry me. He won't hang out outside of work because he's so introverted. More like impossible. He hates compliments.

I know I'm not special. His attentions shouldn't mean anything and it should be easy to drop this crush because honestly he can be kind of cringey.

BUT

He's so impossibly handsome to me. He smells amazing. He gives the. Best. Hugs. When I am stressed he really listens and gives great advice. When I'm sad he hugs me for as long as I need to feel okay. He's so forward and confident, comes off as very Dom, which is also impossibly sexy. I feel so comfortable and myself with him, touching him, or him to me. All the sassy flirty things I'm too shy to say to other guys come so naturally. He never judges me. 

We've talked about maybe being a thing one day, at least smashing it out, but that I need lots of time to heal from my last relationship. I adore his friendship too much to use him as a one night stand anyway. But how am I supposed to move on with life when I literally *dream* about this person? 

Every day I tell myself to drop it.

Every day I adore this hot mess a little more.

I'm tired of being confused. Tired of chasing his breadcrumbs of affection while acting proud like I don't even want it. Tired of feeling vulnerable. Tired of clumsily making advances that go nowhere. Tired of mixed signals. He wants me, but not to spend time with me, when he's casually fucked plenty of girls around me. 

Today I was sitting on a high stool with my legs up waiting to clock in and he came over, bent down and kind of half layed in my lap to say hi. I stroked down his head and his whole back and felt like I could do this for the rest of my life. He let's me fix his hair when it's messy and when I ask for a bite of his food he fixes me the perfect bite and feeds it to me. 

I can't do this anymore. It hurts.

I should get a new job. I have an offer for AGM at a friend's restaurant. I should just go. If he ever wants to see me he'll have to make an effort for once. 

At least then I can move forward.",1,2,2,1.0,0,,/r/offmychest/comments/13t3v82/might_be_time_to_move_on/,False,False
90,offmychest,2023-05-27 10:25:02,Cumkagehiddennut,I’m not attracted to my wife. I mean I kind of have a thing for ugly white women but I think with her it’s the clothes she wears,After the pandemic I went through a depression and then on the back of that I was very attracted to the wife. She wore just just basic jeans and t-shirt which I like and she got herself in good shape. I couldn’t get enough and that led to another baby. Now she dresses like a 50 year old and it’s killing me,0,0,0,0.5,0,,/r/offmychest/comments/13t3tq3/im_not_attracted_to_my_wife_i_mean_i_kind_of_have/,False,False
91,offmychest,2023-05-27 10:23:41,SadFail976,I wish either I were dead or my father were,"My (19F) father (44M) was never really around growing up and I resent him for that. Even during the times he was around, it was like he wasn’t really there. And if he was there, it would either be to physically punish me for some kind of wrongdoing or handing off his responsibilities for taking care of me to my mom. It’s as if he doesn’t want to deal with me, and nothing I do is enough to convince him otherwise. 

I never really had great memories of my father, and the good memories that I have can all be counted on a single hand. These were the only three times he actually acknowledged me for anything I did or said something as a compliment. I also resent him for being the most petty, insensitive, indifferent, insufferable, negative, emotionally unavailable person I know and the fact that I need to associate myself with him and see him now at any given part of the day makes me want to end my own life. 

My reasoning for this goes from something as simple as taking all of the sweet parts of fruits for himself, to telling me to go jump off a train platform when I’m clearly in distress and not in a good mental space, to insulting me and my appearance and invalidating my pain and suffering, to becoming physical for being too much for him to handle. I have had my panic attacks triggered by him and sent to the hospital because he would try to slap/choke me when we had an argument. Two weeks ago, we had another argument. 

I was diagnosed with a treatable type of cancer earlier year and had a few surgeries done since then and just need to go through radiation to complete my treatment. So no threat of my life being lost, but cancer is cancer and just because it’s treatable doesn’t mean I won’t be feeling like shit from the process and recovery. Two weeks ago, I was 12 days post-op  and needed to go outside to run errands but the ends of my steri-strip from the surgery were staring to curl and get caught on clothing. Before I got dressed I decided it would be a good idea to have the ends be cut off, except the incision site is somewhere that is difficult to accurately maneuver around. And I don’t want to accidentally stab myself with a pair of scissors. 

So I go to my father who is the only person who is home and available to help me, but he ends up ripping off the steri-strip instead, leaving my incision site angry and irritated for a few days. (After a previous surgery, my steri-strip was ripped off in the in my sleep and it woke me up because it was so painful so imagine how this felt) 

I told him multiple times prior to me giving him my pair of scissors to only cut off the edges only and leave the middle of the steri-strip alone, but he doesn’t heed my wishes. Much like how he doesn’t respect anything else about me either. 

I honestly don’t know why I thought it was a good idea to go to him for help in the first place. 

After I realized the steri-strip was gone and the fact that it wasn’t the scissors that were tugging on my skin but him tugging it off, I was speechless and asked him “why he would do that instead of doing what what asked”. And he replied with something along the lines of “stop making it a big deal, i did you a favor” and I stormed to my room to cry and punch the wall because I felt so violated. 

I called my mom to talk to her about what happened to calm myself down and she said she would speak with him. I hang up to go get myself ready to leave, but as I was leaving the bathroom I hear my father talking loudly on the phone with my mom complaining about me along the lines of being an ungrateful brat and other shit talk. I heard this and feel the need to defend myself, but it escalated from there and ended up with him slapping me to silence me.

We haven’t spoken since but today after a few days of radiation, he asks me if I know I need to take my laundry outside to be washed at a laundromat because he doesn’t want the household washing machine to be contaminated. I asked why and he replied saying because me and my clothes are dirty. (I have a separate laundry basket and do my laundry separately from the household but I wasn’t aware I needed to use a whole different washing machine) I honestly don’t understand whether this is coming from a place of ignorance or malice.

My father hasn’t been very supportive throughout my cancer treatment, never asked about my progress, never went with me to my appointments, never checked on me after my surgeries, etc. even said I was a liar when I got my initial diagnosis. And expects me to perform daily normal tasks that are usually easy when I am not feeling awful, when I’m feeling awful. I had a very severe bruise on my arm from an A-line post-op and was doing housework a bit slow, but he still gave me shit about it and laughed at me when pointed out I have a large bruise and didn’t want to make it worse. 

At this point, it is best if he doesn’t even step a foot near me because nothing he does helps me in the slightest bit. Seeing his face alone spoils my whole day. I feel like it would be better for me to be dead rather than needing to interact with him. I hate him, I have felt this sort of way for as long as I remember. 

Sorry for the long rant-like post, and excuse any grammatical errors, it’s 3am and I am so tired, heartbroken, and alone.",0,2,2,1.0,0,,/r/offmychest/comments/13t3sy3/i_wish_either_i_were_dead_or_my_father_were/,True,False
92,offmychest,2023-05-27 10:20:18,Cumkagehiddennut,When I was 19 (m) I spent the summer rawdogging my friends mother (48f),It was my best sexual experience. Whenever we could she was just down and ready. I mean this summer was in between college semesters and none of the college girls could hold a candle to her. She was always wet and eager and never put up any objections. Since she was in menopause I could just bust without worry. I think I still get attracted to older women because of that time.,0,0,0,0.5,0,,/r/offmychest/comments/13t3qyf/when_i_was_19_m_i_spent_the_summer_rawdogging_my/,True,False
93,offmychest,2023-05-27 10:16:25,Inevitable_Ad10101,I am bullied at work and by my neighbors,"hi. i just want to share it here because I don't have someone I can share with. im almost 34 and an introvert. I dont have any close friends and I cant just say it to my family. I am bullied at work by a faction of coworkers. there coworkers are ahead of me. 2 of them are close to the boss and close friends  with hr. so I cant actually do anything. I tried standing for myself once but I was branded arrogant. I rarely talk and just do my work for the day. Im bullied during breaks and during lunch time. most of them are just words and I pretend I didn't hear it but, damn, small things when accumulated makes you depressed and anxious. Im looking for an alternative job for 2 years now but I have no luck. and hey. im also bullied by my neighbors for the longest time. my reputation and self steem is at its lowest and i might soon reach my breaking point. im actually on anti depressants. damn. I want a better job.",0,2,2,1.0,0,,/r/offmychest/comments/13t3oql/i_am_bullied_at_work_and_by_my_neighbors/,False,False
94,offmychest,2023-05-27 10:13:14,Cumkagehiddennut,I (35m) want to pound my older coworker( mid 50s f),I don’t know why. It could be that there are no other women at the company and they only other women I see in the Amdahl are my sons teachers.,2,0,0,0.5,0,,/r/offmychest/comments/13t3mr9/i_35m_want_to_pound_my_older_coworker_mid_50s_f/,True,False
95,offmychest,2023-05-27 10:11:31,Emotional_House6183,Freaking out because my sister is dating a grown man,"My sister JUST turned 19. I found out yesterday she met someone here on reddit who shares similar interests to her. He lives a few states away and has already come to visit her. He’s 27. They started talking when my sister was 18 and this man was 27. I am shocked and upset at the fact my parents dont see an issue with this. They think because she is a legal age its okay. This guy is pretty wealthy, has a house and car, a full time adult job. My sister on the other hand is fresh out of highschool. I’m 21 and I wouldn’t even mess with an 18 year old. I worry for her and idk what to do. I fear she’ll run away to go live with him (which she has every reason to tbh our dad is a terror). But this guy has so much power over her. Financially and age wise. From my experience you are in a totally different mindset between the ages of just 19 and 21… let alone 27! Wtf does he want to do with a 19 year old!!",0,2,2,1.0,0,,/r/offmychest/comments/13t3lro/freaking_out_because_my_sister_is_dating_a_grown/,False,False
