index,subreddit,post_time,user_name,title,text,num_comments,score,ups,upvote_ratio,downs,likes,URL,over18,ASD
404,offmychest,2023-05-20 08:12:27,East_Midnight2812,Data breach of privacy sparks anxiety and feeling physically sick on edge,"I reside in a country and neighborhood that is generally considered safe, and it's rare to encounter the police. However, last week, a cyberattack targeted the internet service provider I use, resulting in the compromise of data belonging to 50% of its customers, including myself. The origin and specifics of the attack remain unclear, but I received an email assuring that the unauthorized access had been contained, while urging vigilance against potential misuse of personal information.

Once I read that email, a wave of anxiety washed over me. I began sweating profusely, and the panic suppressed my appetite. It also triggered flashbacks to instances where I had engaged in unhinged rants online, whether on platforms like this or by limiting visibility on Facebook, leading me to worry about the possibility of these actions being used against me unexpectedly. This morning, as I awoke in a state of panic, the blaring sirens of police cars intensified my distress. From my balcony, I could see that they were stationed in front of the main office within my estate. Curiosity compelled me to consider rushing downstairs to investigate the situation and perhaps even take a photo of their license plate. The presence of a police van parked directly across from the police car added another layer of panic. Typically, I don't pay much attention to the cars parked in my apartment's car park or who occupies which spot. However, now I find myself compelled to do so.

My mind has been unable to quiet down, relentlessly conjuring up every worst-case scenario imaginable. The thought of them arriving at my doorstep any day, at any hour, has made it nearly impossible for me to find solace and sleep peacefully tonight.",0,1,1,1.0,0,,/r/offmychest/comments/13mlw5n/data_breach_of_privacy_sparks_anxiety_and_feeling/,False,True
1634,offmychest,2022-10-11 00:41:00,mandelaXeffective,I'm so tired of being the only one fighting for relationships and I'm tired of being treated like an experiment.,"It's like every time a relationship gets even a little difficult, I'm the only one willing to actually fight for it. I'm the only one willing to do the work. I'm the only one expressing needs and setting boundaries. 

And on top of that, I'm tired of people using me. It's ok if you aren't sure about whether or not you want a relationship or you want one but aren't sure you can be in one, but that's something you should be upfront about before getting involved with someone. Some people are ok with being with someone who isn't sure like that. However, I'm not one of those people, and that's ok. Don't get involved with me if you're not sure you want a relationship, or if you're not sure you can be in one. I'm autistic and I'm demisexual and I'm disabled and I'm sick of people wasting my time, energy, and emotional labor because they can't be bothered to actually do the work. Don't wait until I'm already invested.",0,2,2,1.0,0,,/r/offmychest/comments/y0uy7v/im_so_tired_of_being_the_only_one_fighting_for/,False,True
1636,offmychest,2022-08-24 04:40:52,mandelaXeffective,"I love you, *so* much.","I know it's way too soon to tell you, but it's getting harder and harder not to, especially in moments where I feel like you really need to hear it. You get so worried you'll do something to make me not like or want you anymore, or to push me away; and every time you do, it takes every ounce of strength I have to keep those three words from spilling out. You are so much better to me than anyone else I've dated, and I feel *so* fortunate to have met you. Still, I know this is all kind of new for you, and I don't want to scare you or make you feel like you have to say it back. Because even if you didn't say it back, I *feel* loved, and I think in some ways that is more important. I just want *you* to feel loved too. Because you are, so so *so* loved.",0,27,27,0.97,0,,/r/offmychest/comments/wwa2jb/i_love_you_so_much/,False,True
1965,offmychest,2023-05-14 01:16:15,Usual-diphthong-4348,My neighbour's kid is a crazed hellion and I have just been quietly dealing with the madness,"My neighbour's child across the street - not sure how old she is, maybe 12 or 13, hard to tell - has been getting more and more angry and crazy and throwing all her pent up hate at me mainly on Fridays and Saturdays. She comes up to my window with a friend and yells obscenities at me, everything she can think of, or runs around screaming insults about me like ""UGLY WOMAN"" or ""You need more hair, baldy!"" Or homophobic stuff or whatever she can think of. She also brings her little dog with her to my window and gets it to bark, then screams help and pretends its attacking her before running away laughing. Alternatively, she screams insults at me from her window of their home. She does all of this sporadically between about 5 pm to 9 pm. I have tried to tell this girl to cut it out, but there is no stopping her. Her mom can't or won't do anything either. I don't really feel hatred toward the parent. It looks like they might be a divorced family. I only ever see her mom there. I imagine the mom might be working a lot and the girl might have issues that the mom can't tackle cause she's got her hands full. But I have no clue. I am making assumptions.

A sane neurotypical person would handle this situation appropriately. But I have autism and people don't understand that I truly am unable to speak to people IRL a lot of the time. I just can't get the words to happen. So I put up with this as if it were back pain, and I feel comforted knowing she will tire out soon. But it's still just a garbage situation to deal with every week. I believe I am targeted by this girl because she sees that I am different from other adults due to my autism. This girl has also done slightly more concerning things like ranted at me and followed me to my door as I was walking inside. I am not looking forward to when she becomes a full fledged teenager or adult. I think she might be a maniac or try to steal my things or set my house on fire. I will have to get a doorbell cam probably later on since I can't trust this kid. It bums me out.",2,1,1,0.67,0,,/r/offmychest/comments/13gyifr/my_neighbours_kid_is_a_crazed_hellion_and_i_have/,False,True
1997,offmychest,2021-06-29 21:48:27,introvertedfreak21,I don't get labels,"I can understand to a degree the need for a common label, something that ties you to a community. Such as sexuality, I can understand because I'm a bisexual woman. However, I don't personally get smaller labels or one made to break a social construct. I get not everyone feels comfortable in their own skin, maybe they like don't feel true to their gender. I know for a fact that I'm not what a ""typical"" girl would be like but at the same time, when was the genders so heavily forced? Maybe its a bad perspective thing. I grew up with mainly girls and guys to play with, I liked running around outside, getting dirty and exploring nature. My female cousins enjoyed it just as much as my male cousins did. There was no real pressure placed on us to act certain ways. I get that's not the same for everyone.

My perspective may seem off to some. I just never saw any real pressure to act a certain way till I was teenager, where my step mom insisted I needed to do my hair and wear make up to get male attention. Most times, the guys I hung out with just enjoyed my humor and like for video games or for the fact that I was content to hear their issues and try to give objective advice.

I would like perspective on those who came to the conclusion they were nonbinary, it was one of the gender types that I was rather confused on. I respect that it is your choice and there is nothing wrong with that, I just want to gain better understanding. I want to say that in all of this, I intend no aggression and only seek to understand.",0,3,3,1.0,0,,/r/offmychest/comments/oaib8h/i_dont_get_labels/,False,True
2003,offmychest,2021-05-09 13:53:16,introvertedfreak21,Never an easy Mother's day,"I'm just posting a rant really because I don't celebrate the holiday and it can be a reminder of events leading to my mistrust of most women, even though I am a woman too.

My own mother died when I was 17 however Mother's day wasn't easy when she was around either. She was a junkie that couldn't bother getting out of beds most day, relying on her own father and strong ADHD meds to take care of her kids. I'm thankful I don't remember a lot about her because I just feel there aren't many good memories there. Even still, she was my mother and I was never truly mad at her for what happened, she had bad addiction issues and by the time I was around, she was too far gone. A part of myself will always be missing with her gone, there will be parts of myself I don't understand and will always feel unsure about.

However, I can not say the same about my dad's wife. She is more the real reason why I stopped celebrating this holiday. One mother's day, about 4 years ago(I believe this was only 2 years after my mom passed), I wasn't doing so well that mother's day. I was excited, I remembered that my step mom wanted to make a blanket out of all the cards she got and I thought it would be great if she had this giant like three foot tall mother's day card at the center of it. I had set up the display for these cards at my retail job, so I looked through all of them to find the one I thought she would like the most. I hid it in my closet for like a month waiting for Mother's day, my stepsister thought it was a good idea and my dad did too. I thought I got her a gift she would like.

The day rolls around and I have to work that evening but I got the morning to enjoy. We all got up early to help make her breakfast, ate together, everything seemed fine. The moment my dad walks outside to smoke, my step mom looks at me and says ""You should put a shirt on, no one wants to see your saggy boobs."" I was wearing a spaghetti strap tanktop because it was my pjs, even my stepsis was taken aback. We mostly ate in silence when my dad came back and I went off to my room, upset. My dad checked on me, I was so hurt because I was never very secure about my appearance but it was just so out of the blue. Dad convinced me to at least due presents and then I can stay in my room away from her. We get our gifts ready and I'm thinking maybe she will like my gift and we can move on. No, she didn't like it. She seemed upset by it because she only wanted handmade cards form my sister and I. My dad tries to move on to the gifts form him and my sis to keep her form saying something that will make me cry. I was struggling to hold back tears, it was obvious that I just wanted to go cry. They show off their gifts to her and she still isn't happy with them. They got her stuff to decorate the house with because she likes to decorate but it wasn't good enough. She then asks me why I'm about to cry and before I speak, my dad mentions how today is hard on me without my mother. That breaks me, I can't handle hearing just the reminder that she's gone and just start crying. Step mom is screaming about how today is about her, I shouldn't be crying, all that. Dad gets me to my room, screaming at her to shut up. He tells me to just avoid her by staying in my room and that he's sorry she's like this. I start calming down after a little while and texting my boyfriend only for her to come in and ""apologize"" by going on this long winded rant about her bad mother and then says ""At least your mom is gone, I wish mine was."" I couldn't believe it, I just screamed back ""At least you know yours."" My dad comes in and get step mom out, asking me what she said and just utterly appalled by her words. She tries to apologize again but at that point, I just keep telling her to leave and when she doesn't, I just yell for my dad because I don't wanna deal with this, I gotta go to work in a few hours and deal with all the people celebrating this day while I feel like shit.

They all get ready to leave, going to get their nails done as a Mother's day gift to stepmom. Dad comes in my room and tells me to try and not let this get me down at work, that he's sorry for marrying such a cruel woman and that this really made him look at her differently. He talked about divorce but I knew that wasn't gonna happen, that's a promise he whispered to me for many long years.

After that whole ordeal, I have always refused to celebrate the holiday. I'll talk to her on the day of if I see her but I never tell her happy mothers day, I never sign a card for her, none of it. She utterly shredded any chance she had at forming any kind of mother-daughter relationship with me. We have just acted like adults around one another since. I know this whole thing will hit her harder when it comes down to my eventual wedding because I will refuse to dress with her, she won't go to a bacheloette party for me. That I can all do with my stepsis, who has never been anything but family to me since I met her.

If you read this far, thank you. I've had a rough year and this day just drags out so many nasty memories for me so knowing just a few more people out there might understand this pain helps. And for those who don't, be thankful you don't. Appreciate the hell out of the mother who genuinely loved you, the stepmom who took up the role of mother for you when yours didn't. In these days, real caring mothers are a rare diamond, too many women just have kids too young and for the wrong reasons so be grateful to the mother who you know truly loves you unconditionally. I know I'll give my grandmother a call, she's one of the few women I know truly loved her children and grandchildren with all her heart.",0,2,2,1.0,0,,/r/offmychest/comments/n8envo/never_an_easy_mothers_day/,False,True
2307,offmychest,2022-01-26 11:33:26,linguisticshead,Within 3 months I lost my 2 dogs and my grandma.,"November 3rd, my best friend in the world, my dog, died from kidney failure from a heart condition we had already been treating. 

December 29th, my active, sportive and healthy grandma suddenly died in her sleep. Grandpa found her in the morning. 

January 26th, my other best friend died during midnight after being in the hospital since Sunday. A diarrhea that started on Thursday quickly evolved to infection of her whole digestive system. 

Everything is so awful and unbelievable.",3,6,6,0.88,0,,/r/offmychest/comments/sd3xrt/within_3_months_i_lost_my_2_dogs_and_my_grandma/,False,True
2336,offmychest,2020-10-13 15:49:38,linguisticshead,"Dear God,","I am trying to believe in you. I really want to believe in you. But there are somethings that I want to say before we further our relationship. Theoretically, you probably know all of this already, but writing some paragraphs online seems more convincing than having a dialogue inside my head with you.

I do not believe in heaven or hell. Let's be honest: the concept of living forever is just as scary as dying. The concept of living in heaven or hell makes even less sense. I know there is a mystery involving our existence. Maybe we will never really die or maybe we will never live as we are today. We cannot just be here, but I do not think none of us will ever find out.

I do not go to church. I do not like it there. It is loud and crowded. People pray so loudly and I really do not understand why. I do not like the groups, I do not like joining people and praying together, it makes me uncomfortable. I feel judged at church. I feel that if they found out that I am gay, no one would like to have me there anymore. I prefer you and I, you know? Like pals, like mates. I can talk to you and there is no judgment. I can thank you for the good things that happen in my life and I can also be angry at you if something goes terribly wrong, it is okay to be mad at you for awhile, isn't it? I am sure you understand that. I hope you understand that.

I am angry at you about my family. I really am. My mom will have it really hard when I come out. I cannot possibly imagine what my dad will do. He might hate me, he might respect it within time, but he will never come around with the fact that his only child, is a lesbian. And his only daughter wants to get some tattoos to cover up all the scars she has on her wrist from the time she was trying to deal with the discovery of her sexuality. His only daughter does not like dresses or cropped t-shirts. His only daughter prefers ties, suits and masculine clothing. It would save me so much suffering, so much sadness, so much effort if they were simply okay with who I am.

I am not angry at you because of my anxiety disorder, obsessive compulsive disorder or my autism spectrum disorder. I can deal with that. Or at least, I am trying my best – even if my best means stealing anxiety pills from my mother's cabin. You understand that, don't you? But I am really angry at you about my physical health issues that do not seem to go away even though I am in perfect shape, even though I exercise, even though I keep my diet clean. These are the things that make me angry at you. I am angry at you. I wish I were healthy. I wish I could be who I was last year. But I cannot, because these issues will not go away no matter what I do. No matter what I try. I am just 18.

I know there are many things that hurt me at the moment and maybe I will never understand why they are happening to me. But it helps to believe that you have some purpose for all of this suffering – that you know I can handle it. I do not understand you – and maybe I never will. But I want to believe in you. I want to have faith. I want to know you are always there, somehow. Help me believe in you. Help me get over the things that make it hard to believe in you. I want to have faith.",3,7,7,1.0,0,,/r/offmychest/comments/jag4al/dear_god/,False,True
81,offmychest,2023-05-27 11:07:23,SakuraTreasure,Tough day,"My sister brought up some sensitive topics yesterday that is making me feel awful about myself that I can't talk about in detail. Anyways it's making me very upset and I feel like I have no right to be happy or celebrate my birthday. I'm probably going to maybe window shop today but not really be able to completely enjoy it now. 
Either that or I may just sleep in hugging my fur babies.
I'm not very happy today and I can't seem to get myself out of the funk. 
I just don't know what to feel anymore.",0,1,1,1.0,0,,/r/offmychest/comments/13t4jmb/tough_day/,False,False
82,offmychest,2023-05-27 11:01:52,d3f0ur,Life is good,"Growing up I was a really happy child. Always smiling. Really social. Whenever my dad came home I've been told I always hid or went upstairs. Fast forward to my teenage years it got worse. Mentally and physically abusing me and my mom. Really downgraded socially got anxious all the time. Lost weight. Didn't wanna do anything. Got severely depressed. By the time I turned 20 my parents finally divorced. Really struggled with that and got more depressed. Finished high school got a job. Ended up in a cycle of work, come home, smoke weed, go to bed and repeat. Skinny, depressed, no friends. All alone(besides my mom obv). Turned 25 and decided to move out got a shitty apartment. Decided enough is enough.
 Stopped smoking weed. Hit the gym 5 days a week strict routine. Bulked up 25 kg in 6 months. Ended up buying a house two years later. Absolute dream house. Still can't believe I got that lucky. From that point on life was in a fast uphill. Eventually found a really good job close to home. Met a really beautiful girl at the gym and we are currently dating for a while. Constantly get compliments on how good my body looks from working out and how i am always smiling. Life is what you make it.",0,1,1,1.0,0,,/r/offmychest/comments/13t4fqm/life_is_good/,False,False
83,offmychest,2023-05-27 11:01:14,Whole_Marsupial9610,I’m so insecure about my looks that I cannot take off my mask,"I’ve always struggled with my appearance growing up but after face mask were introduced things seem to have gotten 100x worse for me in regards to my self esteem issues. After seeing posts made about how situations where people were being “mask-fished” I started thinking about how much attention and how much nicer I was being treated with the mask and realized people probably thought I was better looking than I actually was.

While everyone was happy that masks were no longer necessary in my city, I became depressed thinking about having to take it off because and disappointing those around me with my face. I still cannot bring myself to take it off except when I’m at home or if I go out with friends, but if I don’t have it on refuse to look anyone in the face and spend all day looking at the ground.

Things have gotten really bad to the point where looking at someone without it on or having someone mentioning seeing me outside without it upsets me, I have almost been fired for no call now shows on days I couldn’t find any face masks and couldn’t muster the courage to go in ,and any compliment someone says to me regarding my face just feels like they’re saying it to be nice.

I just wish I trusted someone enough to talk to them about this. This really sucks.",0,1,1,1.0,0,,/r/offmychest/comments/13t4fbr/im_so_insecure_about_my_looks_that_i_cannot_take/,False,False
84,offmychest,2023-05-27 11:00:41,longdoglong,The little things are getting me down.,"I've had a bit of a hard time recently. A tooth extraction left me with neuralgic pain for which I've been taking medication for, but it's made me so tired. On top of this a series of relatively small things are getting me down. 

I lost my wallet with some cards which I will be charged to replace. I made a mistake ordering a washing machine of the wrong size and now I need to pay extra to have it refitted into the space. I've barely left the house for fear of triggering the neuralgic pain. Despite having worked my socks off, my bonus is going to be small this year and I feel overlooked and unimportant compared to some of my peers. My partner works onsite for long hours whilst I'm WFH, so I feel very lonely during the day. He's often tired and so falls asleep early when he gets home, which adds to the feeling of loneliness. 

All these things, and more, are getting to me. I know that other people face so much more hardship than me but if anything this makes me feel even more upset with myself.",0,1,1,1.0,0,,/r/offmychest/comments/13t4ey4/the_little_things_are_getting_me_down/,False,False
85,offmychest,2023-05-27 10:53:40,GoatGelo,Secret Convos,"Secret Convos

I don't know but, I'm loving the secret convos lately, and the idea of meeting strangers whether sfw or nsfw. I know its an act of cheating but it allows me to escape in this toxic reality.

Haaaay. I'm not proud but I can't help it.

I don't need advice just want to share this feelings. Thanks!",1,1,1,1.0,0,,/r/offmychest/comments/13t4aol/secret_convos/,True,False
86,offmychest,2023-05-27 10:48:46,purplepeachpup,I am happy my friends are cutting off my former toxic friend,"so this is something that I have thought about for a long time. so back when I (25F) was 5-6 years old I met my former bff (F25). our friendship has been all over the place, starting with a friendship in first grade, we had our ups and downs, then when we got older she got really clingy and even changed classes to be in my class. and would drive away some of my friends (I realize now). when we started high school we went to different schools and that improved our friendship. after a year of two she ended up transferring to my school and we were on great terms. when we went to uni things changed and I felt the friendship was one-sided and we cut contact, she felt blindsided by this and apparently hasn't gotten over it yet. when I look back at that friendship I see that she was really manipulative and also narcissistic, I might not have been innocent but I feel so much better knowing that I am not surrounded by her toxicity.  
we still have some mutual friends, and we have seen each other a lot these last couple of months for that reason. whenever we see each other now we chat and fake a conversation. I feel like we are all good. kinda like seeing an ex where the relationship did not end bad. but I just found out that she is really bitter with me, and are complaining to my friends about seeing me, and how awkward that is for her. our friends are just as confused as me seeing how normal everything seems in front of me, but then she is so mad when I am not around. but anyways my friends seem to be really annoyed with her trying to be the center of attention all while faking being super nice and innocent. and she also has a lot of other lovely qualities that made my friends realize how toxic she is. so is it wrong of me to hope that they cut her of? and what do I do about her, I know all of the stuff about her hating me through my friends, and she seems not to hide it from them. I feel like I have the upper hand being for not talking about her behind her back, but at the same time I want to be petty and let her know that she is awful.",0,1,1,1.0,0,,/r/offmychest/comments/13t47nk/i_am_happy_my_friends_are_cutting_off_my_former/,False,False
