index,subreddit,post_time,user_name,title,text,num_comments,score,ups,upvote_ratio,downs,likes,URL,over18,ASD
466,relationship_advice,2022-07-11 10:23:37,SpicyRamen5193,How do I encourage my Boyfriend to clean more?,"I've (19F) been living with my boyfriend (22M) for 4/5 months (Together for 10/11 months) now and the place became messy for a little bit until I dug myself out of a rut and cleaned up. He's helped me clean a good number of times but doesn't really clean by himself very often. He had an abusive childhood where his father would beat and yell at him if he didn't clean the house everyday so I understand why he hates cleaning. I want to help him set habits for the future and have talked about this with him and have tried to come up with ideas to help his motivation to clean like a reward system, but he's said he's not interested in that idea as it feels demeaning to him. Any ideas?

Edit: He is fine to clean on his own when asked to do a specific task and doesn't complain and we've made some ground rules like he'll wash the dishes when I cook and dump his soda cans. He just has trouble cleaning on autopilot is all.

TLDR: I need ideas to help motivate my boyfriend to clean on his own.",1,1,1,1.0,0,,/r/relationship_advice/comments/vwf29p/how_do_i_encourage_my_boyfriend_to_clean_more/,False,True
1980,relationship_advice,2022-04-08 23:51:41,introvertedfreak21,How do you know if you are poly?,"A little background. I've been with my bf for 5 years now, its been the two of us that whole time. We have had a threesome once before with another guy but it wasn't anything romantic. My bf has always been comfortable with me trying to get a gf as I'm bisexual but have had terrible luck with women. So, I always thought it would just be something sexual, no real feelings. Well, the last two weeks I've been texting a girl daily. I've really gotten to know her and I do care about her but I'm not sure in what way. I do flirt with her but we haven't really done much else. We also haven't met in person yet because life gets in the way. I've always known relationship to be you find that one person and are set for life. I never really understood how poly worked but also didnt see it as a bad thing. I don't have feelings like I love her but I do find her attractive and just fun to be around. My bf is aware of all this and I will show him messages form time to time.",5,1,1,1.0,0,,/r/relationship_advice/comments/tzgohr/how_do_you_know_if_you_are_poly/,False,True
2002,relationship_advice,2021-05-11 19:49:24,introvertedfreak21,"Boyfriend totaled my car, moves in, and now might buy a motorcycle","I'm not sure how to feel on all of this so I'll give some backstory first

My boyfriend and I have been together 4 years now, we knew each other for 5 years before dating so he is someone I know very well and trust deeply.

Last August, I saved up $1,500 to use as a down payment on a 2015 Toyota Camry, I loved that car so much. It was the first I ever had a nice car. My only other car was a 2003 Ford Ranger that needed a lot of love so I was excited to get a car that I didn't have to worry about so much about having issues.

Anyways, two weeks ago, my boyfriend and I were heading home from work. We stopped at the nearby Walmart. It was dark out, we were waiting at a stop bar to turn left into coming traffic. He was driving at the time and I was the passenger. Lanes looked cleared, saw no one coming and then, out of nowhere, the airbags deployed. This woman came up on a hill and hit the front of my car. Her airbags didn't deploy for some reason. The accident details aren't that necessary to the story, just the cops deemed it my boyfriend's fault. I had full coverage so my insurance just paid the loan off on that car and I'm out the already $2k I put into the car.

Now, to today. For a good week, we were looking into buying me another car but like one someone is selling. My boyfriend offered me the $2k he saved up to help me since I had to miss a lot of work this last month because of an eye injury. He moved in to my place with my roommate so rent is cheaper, I pay nothing on car insurance, and my boyfriend does let me use his car(04 Volvo V7 with over 230k miles on it). Problem is that today, I told him I wanted some time to myself, to process my emotions on everything and just relax. So, he decided to go take a look at motorcycles for fun, he loves them. The issue starts there. He is debating on getting one and I'm feeling crossed at the moment. He said he would give me his car as long as I want till I save up money to get my own car. Ever since the accident, I've just felt hollow. I come from a very controlling family, I had to fight so hard for every inch of freedom I could get. They charged me so much in rent that saving up money was hard, I had to move out with the help of my roommate's dad. So, being able to save up money to get the car I wanted and to have lost it, it hurt. I don't know how to feel now. I'm jealous my boyfriend might get a bike, something he's wanted for so long after he totaled a car I worked so hard to get. He did offer to still use the $2k he had to help me get another car, I'm still looking at used cars but the waiting game is so hard and I'm just so drained these days. It also doesn't help that the doctor I've been seeing about my eye(the injury is still healing but I'm cleared to work) wants me off one of the three days I work(3 days, 12hr days) and I can't work my side job yet because they didn't send a piece of this welcome kit(its a delivery service). So, I'm just feeling so lost.

Edit: The $2k I mentioned is not my money, its still his and if I find a car for that cost, he will pay it and I will pay it back to him over time. Its more so just a loan form him.",13,1,1,1.0,0,,/r/relationship_advice/comments/na5wfo/boyfriend_totaled_my_car_moves_in_and_now_might/,False,True
2018,relationship_advice,2022-08-14 04:24:38,Vessecora,How do I explain to my husband why I'm upset that he sleeps when we visit family for lunch?,"Everytime my husband and I visit my elderly mother's house for Sunday lunch he will end up sleeping on the spare bed instead of interacting.

My mother and I never found this too rude or anything, just quirky because we know that he, being autistic, gets overwhelmed easily and we understand that he feels comfortable enough with us that he can fall asleep.

But now that I'm working full time and he's supposed to be in charge of just taking care of the house, I'm feeling strangely jealous and abandoned because I only have so much time that isn't spent at work.

He says he stayed up until 4am because he just didn't get tired until then, which I get but I also feel like I shouldn't have to miss out on family time because of his decision.

I love him and understand why he does things I just struggle to explain to him how his behaviour makes me feel. I have PTSD and have been struggling with my mental health so I just find it so hard to keep perspective. Especially when it comes to expecting him to be present. I'm not sure if I'm expecting too much from him, or too little.",7,0,0,0.33,0,,/r/relationship_advice/comments/wnxd85/how_do_i_explain_to_my_husband_why_im_upset_that/,False,True
2678,relationship_advice,2019-11-03 03:03:22,frogsrock_freddy,"Paper marriage abroad, should my (F24) fiance’s (M25) family attend?","My fiancé and I have been together for about 8 years, and we moved to Tokyo for his job about three months ago. We’re both US citizens but my fiancé is also a Japanese citizen - I haven’t been lucky enough to find a job to sponsor my visa here, so we’ve decided to get married so I can stay on the spousal visa until we return to the US later next year.

My parents who both live in the US decided they absolutely need to attend our marriage license appointment at the govt office here in Tokyo. We’re planning on having a “real” marriage with family/friends in winter of next year when his job transfers us back to the US. However, as I’m an only child and my parents are pretty old they’ve decided they just can’t miss out on this little milestone of the paper wedding.

Issue is, I think we’re making my fiance’s mother feel obligated to travel here as well for the marriage paperwork. She previously expressed that she really doesn’t care about this part of the process - but now that she hears that my parents will be flying out, she feels like someone from their family is “obligated” to show up as well. 

My fiance’s parents and younger siblings all live in the US, and although the father is verrry distant I know his mom has worked a bit harder at staying close. Fiancé repeatedly says he doesn’t need anyone from his family to show up for the paper wedding as it’s just a formality for my visa. 

How can I let future MIL know she’s not required to fly out here for the marriage paperwork appt? Or, am I reading the situation wrong and it would be a good idea to have her attend? There’s a bit of a language barrier but we can generally communicate. I really don’t want to make them spend money on the flight if they’re just feeling pressure to match my parents’ strangely high level of enthusiasm for paperwork.",2,1,1,1.0,0,,/r/relationship_advice/comments/dqux96/paper_marriage_abroad_should_my_f24_fiances_m25/,False,True
181,relationship_advice,2023-05-27 11:05:14,UniversalProtocols,"My (18M) situationship (18F) ended yesterday morning. I have a teddy bear that was hers and reminds me of her. She lives in a different state, and I want to return it but I also want to include a letter.","We ended on good terms. She was a loving kind and compassionate person, and I took her for granted. I would make comments to get a reaction while she was going through a lot and I should’ve known better. I wasn’t mature or ready for her. I held her high in the beginning but as time passed I took her for granted. I regret it and I would do things differently, but it’s officially in the past. We ended on good terms and I do want her back, and it hurts but I love her and loving her means looking out for whats best for her, and knowing what’s not good for her.


I just want to include a hand written letter, thank her and return what’s rightfully hers. Any ideas for what I should say? I am a hearty writer and there’s a lot I want to say but i don’t think it’s appropriate.",1,1,1,1.0,0,,/r/relationship_advice/comments/13t4i4k/my_18m_situationship_18f_ended_yesterday_morning/,False,False
182,relationship_advice,2023-05-27 10:59:13,SherbertSimple7350,Guy I'm(26F) seeing(31M) went from so in love to claiming I ruined his life and I'd stab him if I could ?," Sorry for the long writing in advance.I started seeing some1 about 1 month and half ago. Not exclusively. He told me I love you within 3 weeks. He used to tell me he wants to have my my kids and travel together etc. All sweet things. He cooked for me and actually pressured me to stay at his initially to sleep over. He kept telling people I'm his GF even tho I clarified I was waiting on an official date nd it felt too fast. He was always upset if I didn't reply on time nd when I took a holiday he was suspicious of my friend cause he didn't get to speak to her. But we were talking only 3 weeks at the time..

Things felt quick but I said I'd try since he seemed sweet and making effort . We started having arguments recently . He didn't like how I'd be upset when he'd do something. When we argued he had called me all forms of names and apologised and I accepted.  About 3 days later we argued again because he was angry that I picked a call while we were talking (urgent 1 ) and y didn't I tell him straight away on the phone. He hung up on me about 5 times. Told me to go do whatever secretive thing I need to do.

Next day I was upset and told him he was rude and he said sorry for yesterday.  I told him am upset cause not long so he was also shouting at me and telling me to shut up and called me liar (over small misunderstanding)then again shouting and name calling.

Now he's claimed he's miserable. I am to blame for everything. I'd stab him if I could because I'm still upset after his apology..  He doesn't want to ever talk to me and he'll never ring me . That he feels I'm abusive He did say he doesn't know why he's shouting at me and doesn't recognise himself when I told him he's unfair. He said let's take some days away and think about what we've done and see what happens...

I'm so confused and lost ..anyone have any insight ?",4,1,1,0.99,0,,/r/relationship_advice/comments/13t4dxm/guy_im26f_seeing31m_went_from_so_in_love_to/,False,False
183,relationship_advice,2023-05-27 10:59:04,ReporterMaleficent41,"My boyfriend (26M) accidentally sent me (26F) an ass pic of some random girl,along with a comment that made no sense. Im bi,but it obviously wasn't for me.","We fall asleep on FaceTime pretty often, and I woke up to find a text that was sent about four hours ago. It's not a picture of me and I don't know who the picture was sent to, or what the intention was. But it makes me feel insecure and like he's hiding something. I couldn't understand why he is saving pictures of other women?? And I can't think of any reason why he'd send it to someone else...help pls lol. It's a cropped photo,and it appears to be of someone that he doesn't know personally, but I can be wrong. Idk what to think",3,1,1,1.0,0,,/r/relationship_advice/comments/13t4du6/my_boyfriend_26m_accidentally_sent_me_26f_an_ass/,False,False
184,relationship_advice,2023-05-27 10:50:33,toronto1999,My (23m) girlfriend (24f) and I have gotten over many fights together but now all of the sudden everything is coming up at once and she won’t let old things go. How can we get over this road blocks together?,"We’ve been dating for 2 1/2 years and when times are good, they’re amazing and when times are bad, they’re really bad. She’s very insecure so I used to keep things from her because if she found out she would be mad. she found out anyways, and obviously was very mad, an example of this is she did not like me having female friends and texting them so I would hide the amount I texted them (it was only a few times a week, but she felt like I was prioritizing them over her). 

Nevertheless, it’s been a long time since her and I have had these arguments, and I am becoming more open and honest with her. 

All of a sudden she has brought up that she still doesn’t forgive me for this, even though I tell her that I am actively working on getting her trust back, and just being an overall better boyfriend. She keeps fixating on that I lied to her and it really doesn’t help her and I grow a better relationship together. I’m not sure how I can move on with her and ensure that things will get better.

I obviously love her very much and I’m willing to do what it takes to stay with her but I feel like she needs to try and get over her issues but I don’t know how I can help her do that",1,1,1,1.0,0,,/r/relationship_advice/comments/13t48qo/my_23m_girlfriend_24f_and_i_have_gotten_over_many/,False,False
185,relationship_advice,2023-05-27 10:45:48,ThrowRa-Trifle-9382,I (22f) am in a relationship (22m) and don't feel loved anymore,"So me (22f) and my boyfriend (22m) are together again for almost a half year now. I say again because 3 years ago were also in a relationship. I broke it of at that time because he was a huge smoker en lied to me all the time. Now i have to admit I really missed him in those 2 years and when he contacted me I was willing to try again.

Now the issue ain't with the lying anymore. He has been brutal honest since we started dating again and I appreciate that. It's the fact I think he stopped trying to do his best for this relations because. I think the reason is because we already dated once he doesn't have to ""court"" me or something and just takes me for granted.

Some examples: everytime he is coming to my place he is always late or there is something more important to do then comming over. I am talking 3-4 hours later, every single time. Whenever he promise to do something it is not happening. If he promise to call te next day, he won't. If he says he has a suprise for me, he got nothing. In the beginning he would message me goodmorning and goodnight and we would talk through app all the time and call me a lot about things, but after a few weeks I get almost no text and he only calls me late at night after his work.

When I confront him about it he calls me crazy. He says I never talk about my problems with him. But when I do, he just sight and says he can't deal with this right now and I just have to give it a place on my own. 

Last week I was done. I coulnt handle crying myself to sleep every single night. I called him up and said I didn't wanted to do this anymore and I wanted to break up. He got defensive and said that we can talk about these problems right after he got back from a camping/ small music festival. He needed some time for himself to think and I understands that, because it was already a planned trip for him to be alone with his thoughts. He also said we will talk when he get back and he will try to change. So i agreed.

Now the night before he was about the leave I called him up. Only to find out he is not going to this music festival alone like he planned to, to be alone with his thoughts. He is going with his usual group of music festival friends. In about three weeks he will go again to a bigger music festival with these group. He lied to me saying he is going there to get some rest and peace and even cancelled going to Paris with me to do so. All for something that he will do again in 3 weeks.

I am devestated. I coulnt talk with him about this because when I tried talking about it the night before he was tired and said i need to deal with this on my own until I get back. Now I don't want to have this conversation and ruin his days there (even tho this happened). But I feel broken. I will be leaving to Paris on my own tommorow so I dont know when I have a change to talk. I don't know if I can handle talking to him, because I know he will not listen, blame everything on me and just let me deal with it alone.

I do love this man. I really do. I wished we could have a future together. But if he never shows me love, if he always puts me on last place I dont think I can handle that.

Any thoughts/advice?",5,3,3,1.0,0,,/r/relationship_advice/comments/13t45x3/i_22f_am_in_a_relationship_22m_and_dont_feel/,False,False
186,relationship_advice,2023-05-27 10:39:07,LilJoules,I (30M) might love my best friend (25F),"There's this girl who's now my best friend and has been for a while. She knows how I feel about her, and she feels the same way, but she's not ready for a relationship or anything more than friendship because of past traumatic experiences. 
We do a lot everything together and she's someone I could probably spend the rest of my life with. 
Its been months and months, and honestly I don't know if she'll ever be ready for a relationship to be honest. 
Like I want to move on, but it's hard when she's the only girl I think about, or want to be with. 
Wait it out or no?",8,4,4,1.0,0,,/r/relationship_advice/comments/13t41zw/i_30m_might_love_my_best_friend_25f/,False,False
187,relationship_advice,2023-05-27 10:34:37,Old_Drawer_698,My (m26) girlfriend (f25) wants to remain fwb after I broke up with her,"I broke up with my girlfriend a week ago for a variety of reasons (trust issues, LDR, her seeming unhappy  in our relationship) after a 10 month relationship and she still has feelings for me. She says that being fwb would give her less false hopes than being just friends, since it would be clear for her it's just about the sex and there's no hope for a relationship. 

I'm not sure what to tell her? I'd be down to be fwb but I don't want to take advantage of her feelings. Am I preventing her from moving on by agreeing to being fwb? She lives in another city and I need to go pick up my stuff from her place soon and give her anwser about whether I'm down to fwb by tomorrow (I set that deadline, she didn't give me an ultimatum or",8,2,2,0.75,0,,/r/relationship_advice/comments/13t3zec/my_m26_girlfriend_f25_wants_to_remain_fwb_after_i/,False,False
188,relationship_advice,2023-05-27 10:30:54,pensacolahoedown,I (34m) am about to break up with my partner (34f) of 10 years (34f). Where do I start?,"I didn’t think it would end like this, she hasn’t done anything wrong. 

After 6/7 years of a great relationship that started off very strong for the first 4/5 years, Covid just destroyed it and the last 3 years has been strained. The constant contact in the apartment, no real barriers or semblance of personal space for 2 years and now a year or so later, with the world spinning again - all I want to do is go out of there and live. My values have changed, my world view has changed, my feelings have changed. I just can’t do it. I need space, I want to live, I feel like I’m rotting in this city. She deserves the best and she isn’t getting it from me right now, but I’m so so scared of this life change. 

I’m a trauma kid, my whole life I’ve never known “home”, I’ve never been at peace, and in recent years I’ve had it for a while. But now at 34, this doesn’t feel like home anymore. 

I care for her so much, I need to do this, How did I get here, Jesus. 

What do I do? I have no assets, no home of my own only the rental we share. Once I do this I will immediately have nowhere to live. I have a little bit of money and a credit card. No kids, all assets (furniture & car) shared.",1,2,2,1.0,0,,/r/relationship_advice/comments/13t3xa9/i_34m_am_about_to_break_up_with_my_partner_34f_of/,False,False
189,relationship_advice,2023-05-27 10:26:12,Glittering_Abalone50,My boyfriend (M25) said I (F23) cause his depression,"On new years I asked my boyfriend of 3 years how he looked back on the passed year, and he out of nowhere said it was a very difficult and terrible year for him. He could sometimes look stressed and then I would ask him what’s wrong and comfort him. To me it just seemed like a normal stressful day or week. But apparently what he told me then wasn’t all that was on his mind. I’m always there for him and have never given him a reason not to trust me, why didn’t he let me help him? He told me that when the time is right he would tell me, so I waited.

Fast forward almost 5 months later. He would often turn cold and be really rude to me. If I asked him he was ok he would say I am asking him too many questions, not to worry and to leave him alone. I was walking on eggshells. Last week I talked to him about this and that it’s very difficult for me to understand his cold behaviour without knowing the reason why. He then told me “you wanna know the reason for my depression? It’s you”. I only replied saying “oh, ok. That’s not what I expected.” I tried my hardest not to show emotions cause he would then maybe say “see?? That’s why I didn’t want to tell you”. So I just took it and eventually we came to a solution (i have to change). 

He said I caused his depression by being disrespectful. I started uni again in September to work on my future and have made some new friends (mostly guys, I major IT-security there are only like 3 girls in the whole year). Also I’ve been into going to raves sometimes. On average I go to one every 2 months, tell him with who, send pictures and he has my location 24/7. He also knows my phone password and told him he can see my phone whenever he wants. 

Also apparently I ask too many questions (he doesn’t want me to ask how his work was when he comes home, how his meeting went etc). And I’m rude. He is Japanese and the way I talk and my opinions are sometimes too much for him. I can say in my friend group I’m known for being calm. 

I’m just really hurt I can say I always do my best for him and hearing that you’re causing the person you love depression is not really nice. Also my mom passed away this april and handling both these things is a lot. I have no energy left over I’m exhausted. 

My boyfriend can be so kind, funny and he helped me through so many things. We’ve been living together for more than 2 years now and it’s the first time I’ve really felt like I have a home. I love him but I don’t like this side of him. He can sometimes completely flip his personality and it’s scary, like laughing at me in my face while I share feelings saying “why you always crying”. 

Anyways I just feel weird now. Everything is back to ‘normal’ but for me it’s not",4,4,4,0.83,0,,/r/relationship_advice/comments/13t3ugi/my_boyfriend_m25_said_i_f23_cause_his_depression/,False,False
