index,subreddit,post_time,user_name,title,text,num_comments,score,ups,upvote_ratio,downs,likes,URL,over18,ASD
190,relationship_advice,2023-05-27 10:26:01,WelcomeSpecialist157,How do I (21F) repair something I’m not sure can be fixed with my boyfriend (22M)?,"Before I start, I absolutely loathe myself for this, and I know I don’t deserve him. I just want to try to fix this if I can. Losing him might be more than I can handle. We’ve been dating about 1 1/2 years.

So to start, about a month ago, I made a horrible mistake. I got way too drunk at a house party, and was convinced by girl friends of mine to kiss a few of them. I don’t remember doing it, but I’ve been told it was 2-3. I would have never done this sober. I’m straight, no doubt about it. Immediately after I did it, I told my boyfriend and started apologizing. I felt horrible, especially because some of those friends told him he should just forgive me and let it go, “because I was exploring my sexuality.” I wasn’t. I know I’m not interested in women. I’m just a shitty girlfriend who doesn’t control her impulses when drunk.
The next day, when we were both sober, we talked. He said he forgave me, and asked that I lessen my contact with those friends, which I did. I still felt guilty, and continued to apologize, but he said it was okay. Things were off since then, but I thought it was stress from graduating and starting work.
Tonight, he called me while drinking with his friends and said he really was having a hard time forgiving me. We talked and are going to talk more tomorrow, but he said he loves me but what I did just hurt him a lot. Which is reasonable. What I did was unforgivable and I don’t deserve his love or his forgiveness. But I desperately want to make things right and to start healing. I have no idea what to do or how to start it. I absolutely hate myself for what I did. It breaks my heart I hurt him. I just don’t know what to do.

TLDR: I cheated while drunk by kissing other girls, something I would never do sober. Not sure where to start or how to earn forgiveness that I really don’t deserve.",4,3,3,1.0,0,,/r/relationship_advice/comments/13t3ucb/how_do_i_21f_repair_something_im_not_sure_can_be/,False,False
191,relationship_advice,2023-05-27 10:17:25,spl45hX,My GF(26F) wants me(26M) to cancel my evening with friends,"For context we are in a relationship for 2 years.

After she planned to go out with her friends (girls night) I planned to to something with my friends that day.

However her friends canceled on her and she now wants to stay home with me instead. However I don't want to cancel on my friends (she knew about my plans) 

I think it is just an AH move to cancel with my friends, besides I actually was looking forward to meet them again. 

In my mind I just try to honor my word, if I go out with the friends. It has nothing to do with who is more important to me, which my GF argues. I just think it is common sense not to cancel without a very good reason, once one commits. And I know my friends would not do the same to me. Also since my GF is also pissed about her friends cancelling on her, I don't see why I should do the same to mine and piss them off.

My question is do you have any ideas what to do? (Going out together with my GF to my friends does not work in this case for various reasons)

TLDR: Girlfriend (26F) planned a girls night, got canceled and now expects me(26M) to cancel my evening with friends",11,2,2,1.0,0,,/r/relationship_advice/comments/13t3pc9/my_gf26f_wants_me26m_to_cancel_my_evening_with/,False,False
192,relationship_advice,2023-05-27 10:14:36,Substantial-Ad-7126,My (22f) husband (27m) got sexually suggestive photos from his mother (51f) am I dealing with parental enmeshment?,"
She’s super odd, protective, hates me, blah blah blah. Narcissistic, like really bad. 

But she sent him to photos where she’s posed sexy and in a leather dress. And it gives me the ick that she thought. “oh my son will like this picture.” It has 0 message or caption.  Just her standing with her ass out and her boobs out (under her dress but posed with them full flair) like you would for a picture to a man you’re tryna (ya no) He never responded to it. But idk if I’m overreacting of if I am in fact dealing with emotional inc3st. I’ll send them to anyone willing to help me out here.",13,7,7,0.89,0,,/r/relationship_advice/comments/13t3nkj/my_22f_husband_27m_got_sexually_suggestive_photos/,False,False
193,relationship_advice,2023-05-27 10:13:54,No-Matter5594,Libido mismatch with my (22F) boyfriend (24M). What to do about it?,"I have no idea what to start from, but I really need outside perspective on the current sexual dynamic I have with my boyfriend. The situation is very complex and it’s hard for me to tell every single thing that I think contributed to where we arrived now, so if something is confusing please don’t hesitate to ask a question.  
Important information before reading: We’re in our 20’s, we started living together a few months ago and were long distance for 2 years before that (different countries)  
To put the problem simply at first: Me and my boyfriend have very different libido. This generally applies to our sex life, but specifically to penetrative sex. I, as of now, have pretty much no need to have penetrative sex, contrary to my boyfriend.  
There are several things that are affecting my situation: From the beginning, penetrative sex was painful for me. My boyfriend did not rush me to have sex (I was a virgin when we met), we really took our time and he cared about my pleasure a lot, we bought dilators etc. so I could be as comfortable as possible. What’s very important to mention was that we were both interested in more kinky sex, he had experience with it but I only had fantasies about it. My perspective now (this is not how I felt back then) is that I did not have a good enough understanding what sex like that makes you feel like in real life and how to deal with it - this intensity was fun to watch or talk about, but in real life causing me slight pain/talking to me in a degrading way was different. Wanting him to be satisfied and seeing him happy and into it in my head was more important to me than thinking if this is actually pleasurable for me. At the time, there was still an adrenaline rush to it, he always asked me for consent (which I gave) and we talked about what we were doing. In general, I would say I have a lot of regrets about that time and I’ve talked about it, but I do not think he ever actually understood how this impacted me.  
While we were still doing kinky things and having more rough sex, he has done something I have specifically asked him not to do before because it made me feel bad - he put his hand on my throat and slightly squeezed. When he did I kind of zoned out (not because it was strong just out of shock I suppose) so we continued for a bit longer, then I stopped it and he said that he “was so close to cumming” (We both don’t cum from penetrative sex but that’s a different story). I talked with him how that was not ok and he apologised and I brought up that situation several times since then when we talked about our libido mismatch. This was basically the moment when I stopped wanting to have any kinky sex and every time we had missionary sex since then (like that time), I cry. It usually happens as soon as I see him “get into it” the way he did at that moment. It just makes me feel very depersonified, like I am not a person he loves, but a thing to fuck.  
Now, we’re in a situation where we try to have penetrative sex once a month and usually it ends quite quickly with my crying or being just about to do it. He comforts me, he hugs me, he is there for me when it happens. I have incredible guilt built up inside of me anytime we have a conversation about us not having sex anymore that I am not satisfying him. I have no idea what to do - I would love to go to a sex therapist, but we are both very poor and there is literally no disposable income we have besides the one for groceries and rent. I love this man incredibly and I know I want to fix it and he feels the same, but it feels like there is nothing I can do about these things. I feel like for both of us it’s this gruelling feeling that we cannot do anything about this anymore even though we want to and we love each other. It just feels some stupid to end a relationship when there is still so much love left and you grew together so beautifully over one thing (significantly, but nevertheless one) not working well.  
I don’t know… I am thankful to anyone that made it this far. Did any of you have similar stories - something you partner did put you over the edge and you just could not do kinky stuff anymore? Is there any way out of this where both parties are happy? Besides this, I would love to hear from any women who have vaginismus etc. on how they manage to have sex regularly and pleasurably. Thank you so much for any advice!  
TLDR: My boyfriend has way higher libido than me and is more interest in kinky sex. My interest in it faded due to a few situations between us and due to the pain I experience at the beginning of sex. Is there any way to save this?",2,2,2,1.0,0,,/r/relationship_advice/comments/13t3n4r/libido_mismatch_with_my_22f_boyfriend_24m_what_to/,True,False
194,relationship_advice,2023-05-27 10:13:30,throwrapyjamahead,I 36m suspect my brotherinlaw 48m of poisoning his son 18m,"About 13 years ago I had a conversation with my brother in law in which he unexpectedly brought up that he poisons his child whenever the child gets on his nerves and that he would never give him too much to kill the child as he isn't a monster.  He stated the poison was tasteless and odourless and small doses were undetectable in blood tests.  He then backtracked and said he was joking and would never do that.
I discussed this with my partner at the time who said he had mentioned trying to design rodent traps.
My sisters child has had stomach issues all his life.  I mentioned this to my sister and suggested a urine test should confirm if the poison was or was not present.
My sister then had an argument with her husband in which he denied poisoning the child.
The child has just turned 18 and still has stomach issues and displays symptoms that could be related to mild poisoning.  The stomach issues have caused him to pull out of school and remain undiagnosed although multiple tests have been ran.
I don't want to ruin my relationship with my sister who has been a huge support to me in life.
My brother in law is a manipulator and schemer which has led him to be wealthy, and my sister admits at times she wonders if difficult situations he places her in are deliberate and he doesn't have a great relationship with her or the kids.
How do I suggest a simple urine test could remove all suspicion or confirm my fears?",4,7,7,0.82,0,,/r/relationship_advice/comments/13t3mwy/i_36m_suspect_my_brotherinlaw_48m_of_poisoning/,False,False
195,relationship_advice,2023-05-27 10:11:57,throwRA-91919,My (28m) ex girlfriend (26f) is furious that I lied to her about my real income and benefits during our relationship. Did I do the right thing?,"English is not my first language and I apologise for any grammar mistake. I (28m) am legally blind with some remaining vision left. From what I can best describe my vision is looking through clouds. i make six figures from rental properties, investment and disability benefits. I also have a connection with a premium airline that allow me to havve significant discount on any flight and accommodation. Anyways, I met my ex girlffriend (26f), let's call her Jen, through a mutual friend and I found her to be very sweet and caring. Our friendship grew closer and we starter dating. She knew I was legally blind and I asked her if she was sure as I might be too reliant on her. She took her time and said yes. Due to my past relationships where I was being taken advantage of, I decided not to disclose my real income and flight benefits. I only told her my income was around $50k and that i own one rental property. Our relationship was great and i made sure not to be reliant on her but she insisted on helping me whenever I struggled with navigating around places and ordering food. To reward her for being a great partner, I bought her luxury gifts and overseas trips together. She was very happy which also made me happy. However, after six months of dating, she suddenly told me she realised she wanted to have an independent partner and did not want to be seen as someone who is dating a blind person so she broke up with me. I was heartbroken but I understood. Fast forward to four months later, I invited four close friends of mine on a trip to Japan as a way to move on and spend quality time with friends. All flights and accommodation were paid by me. The trip happened last week and we had a good time. My friends were very accommodating to me and grateful for my generosity. Jen  found out about the trip from IG story posted by one of my close friends. She asked my friend about it and they told her that I paid for the whole trip and that's where she found out that I have flight benefits and I make more than I originally told her. She called me to confront me about it saying if I told her the truth she would have stayed with me. I explained to her that i have been taken advantage of in the past and that I did not want to be treated the same again. She was angry and said she is not that kind of person and that I will never find a partner ever then hung up. My friends said she is clearly a gold digger. I forgave my friend who told Jen because they thought she knew. I question myself whether or not keeping my high income and flight benefits secret was the right thing to do and if i should be honest about it in any future potential relationship. A part of me tells me she is only angry that I lied to her in the whole relationship. It is hard to be in a relationship as a blind person and I rather spend time with quality friends.",6,4,4,1.0,0,,/r/relationship_advice/comments/13t3m0l/my_28m_ex_girlfriend_26f_is_furious_that_i_lied/,False,False
