index,subreddit,post_time,user_name,title,text,num_comments,score,ups,upvote_ratio,downs,likes,URL,over18,ASD
156,TrueOffMyChest,2023-05-27 10:32:24,throwaway26090210,I don’t feel like a grown-up,"I turned 18 just a couple of days ago (the legal age for everything in my country) and I really don’t feel anything special about it.

The first day, it was pretty cool because I could buy alcohol and cigarettes and I really did feel more grown-up than I did the day before.

No one even asked for my ID while buying anything and I was happy about it but at the same time felt kinda stupid because then it got to the point where I was like: Did I even need to turn 18 to buy alcohol?

My birthday was fun at least, for the most part, and all of my friends were really excited for me and the opportunities my new-found maturity showed (I am older than the rest by a couple of months)

But now it’s kind of faded. If anything, I still feel like a 15 year old. Yesterday, I went to buy cigarettes and was genuinely worried whether they’d ask me for ID until I realized that it doesn’t matter. If they did, I could just show it.

I no longer had to take my older sister’s ID to buy the age-restricted things, nor did I have to ask her to get them for me.

I’m supposed to go open a bank account next week, and although I could have done it this week I didn’t want to because I would have had to do it alone. I’ve just been waiting for my mom’s schedule to clear up so she can go with me.

My friends asked me out today to get drinks, and I know they expect me to order cocktails for the whole table or something, but I really don’t want to.

I want to feel like a kid for a little while longer.",4,3,3,1.0,0,,/r/TrueOffMyChest/comments/13t3y6i/i_dont_feel_like_a_grownup/,False,False
157,TrueOffMyChest,2023-05-27 10:30:20,fuck_my_life613,Living with my family is draining,"I (19F) live with my dad's family and it hasn't ever been more draining than today. For context my mom passed away when i was 4 and my dad isn't really in my life so i was raised by his family. His brother whom i have come around to call papa (unmarried), my aunt (unmarried) and my grandpa. My dad's family never really liked my mom's though they hold conversations and are civil with each other. My parents eloped and married against the wishes of the both families so I guess their under lying hostility for each other makes sense. 

What's so arguably toxic and draining living all these years with them is that though they look after me and treat me relatively well compared to others perhaps who are in the same scenario as me is that whenever i have an opinion against theirs beliefs/actions or when i do something that doesn't seem to make them happy i get called "" don't act like your mother's family and become the bad blood like them"". ""bad blood"" in this scenario is pretty derogatory as if my mother and her family isn't normal humans like any other. I have been hearing this as long as i can remember and though over the years i have come to act as if it doesn't bother me anymore i still feel unwanted when it happens. I haven't felt wanted all this years of my life that I have been living honestly. It always seems like an underlying message of "" we gave up on our own personal lives to raise you so you better make it worth."" Whenever i do something that makes them feel that isn't the best choice or action to do by their perspective i hear pretty awful remarks by them. It can range from "" we are raising you up just because that's what your dying mother wish was"", "" ofcourse you are like any other dumb child, you after all carry your mother's blood in your veins"" to ""We don't care whatever you do, you aren't ours anyways."" I know compared to the awful physical and mental trauma that many live through mine seems almost miniscule and unimportant, I'm in no way ungrateful for the fact they are raising a child that isn't their own but it always doesn't make me feel the best. 

I suffered from unaliving tendencies and SH from age 11-18 because i couldn't deal with all these remarks. Added with the being a perfect kid who gets perfect marks that i had to keep up maintaining because if I didn't i would feel extremely anxious and guilty i fell into depression . (I have been clean for the past one year which I'm very proud of) and had to seek therapy outside their knowledge. They don't really believe that one can suffer from mental health problems. Added with the 2020-2022 covid era my mental health and grades tanked and i felt more isolated that ever. Such taunts, arguments and remarks increased along with some strain in the family dynamics as my granpa started showing signs of dementia then and it affected me a lot. I have been better since then and I'm doing well but things get hard some days and today was one of them so I thought maybe I should get it off my chest here. At the end of each day I'm thankful for the relatively good life that i lead and for all the opportunities it presents but their words never makes to fail me realise that I'm not really wanted anywhere and that them raising isn't something that they chose to do but something that had to given the past circumstances. Feels bad and hurtful but i guess that's life.",1,1,1,1.0,0,,/r/TrueOffMyChest/comments/13t3wvs/living_with_my_family_is_draining/,False,False
158,TrueOffMyChest,2023-05-27 10:02:39,SadPickles27,I am still in love with my ex and can't seem to move on,"As the title says. I love my ex. I can't find a single bad thing about them. I feel like I'm obsessed or something. We haven't been in contact, but sometimes they reach out and we start talking. It's always respectful. As if I'm waiting for them to turn around and come back to me. I still remember their warmth and how safe and happy I feel thinking of them. And how we did everything together. And how lovely it was to be in love. I only wish one day they come back with the same feelings. Till then, I'll sit here and think of them. I don't even actively think of them. It comes in flash backs. It even occurs in dreams. I may be obsessed. I might need closure, or maybe my feelings are strong. Whatever it is, dear ex, I hope for you to heal, whether you come back to me or choose to move on. I love you. And I always have. Yours, Y.",0,2,2,1.0,0,,/r/TrueOffMyChest/comments/13t3gdf/i_am_still_in_love_with_my_ex_and_cant_seem_to/,False,False
159,TrueOffMyChest,2023-05-27 09:56:49,LexaLovegood,I just want an apology.,"Context. I guess. I 30s f am the youngest of 4. My mom was pretty tired by the time she had me and my dad left when I was like 8 with LC until I finally NC at 19.

Yes I look back now and admit that I was a bit spoiled. My parents worked so they could provide with what we needed and after it was just me mom and 1 sibling. she did spoil me a bit because I was heart broken. I was a daddy's girl to no end. 

Now my older 3 siblings had it a bit rough. I don't know much besides what I've gotten out of my mom because it was rough for her too. But besides some unfortunate major incidents I remember our life being decent. But I always remember one siblings (we will call her M) having issues. 

M was and is a bit of perfectionist. She always had to match her clothes. Her hair and makeup had to be right. Me on the other hand I would just grab and put on whatever. I was always a tomboy and she was our moms girly girl. That never ended well. So our lives were to me at the time just sibling issues. But as I've gotten older and started processing my own issues I realized alot of them come from M. She was my biggest bully. 

I've accepted that she had her own demons she was fighting at the time and probably seen me as golden child while to me that was our older siblings. But somedays when I'm not doing so good and struggling I just want her to say I'm sorry. I'm sorry I hurt you because I was hurting. I know that will never happen. But I feel like it's something I need. I unfortunately do not have a therapist atm and am working through my issues myself. I wish we had a better relationship but I can't change the past and can only look towards the future to hopefully get better. 


If you read this far thanks. I don't expect anyone to read this. I just needed to say it.",0,4,4,1.0,0,,/r/TrueOffMyChest/comments/13t3cu3/i_just_want_an_apology/,False,False
160,TrueOffMyChest,2023-05-27 09:56:16,Odd_Volume9689,I got fired for being assaulted at work but apparently one of the managers (who did end up getting fired) was telling people that I was getting fired for being a bad worker,"I'm frustrated because the separation reason on my termination letter was misconduct because they said I initiated getting assaulted by throwing two cans away in the only open trash can. Day of, the other manager told me she understood why I threw the cans away in the only open trash can (because it was the only open trash can), but two weeks later I got fired over getting assaulted over it because they insinuated that I started it. My paperwork says I got fired for misconduct, but another manager was telling people that I got fired for being a bad worker. This manager had never given me any actionable advice and was constantly telling me that maybe I should quit until I got HR involved, and then she left me alone, but when things came to a head I think she jumped at the opportunity to get rid of me. 
The issue is the paperwork says I got fired for misconduct. If I was just fired for being a ""bad worker"", I would be able to file for unemployment in my state, but they explicitly said misconduct,  so I've had to liquidate my savings in order to job hunt and I still don't have money left over for rent so I'm frustrated and angry because I did everything they asked me to and I still got screwed over for it. 
The day of I was told that I didn't do anything wrong and I still ended up punished for it and that Really hurts.",0,1,1,1.0,0,,/r/TrueOffMyChest/comments/13t3ci5/i_got_fired_for_being_assaulted_at_work_but/,False,False
161,TrueOffMyChest,2023-05-27 09:47:29,Sufficient-College55,I made out with my current boyfriend when he was seeing someone else,"
I am from a culture that views dating as a monogamous venture, as in dating one person at a time. 

I met my boyfriend through a mutual friend and some of us went drinking at a bar. I found him really hot when I met him for the first time the day before we went drinking and asked my friend if he was single. 
My friend said “Technically yes, but maybe no. He went on a date with a girl few days ago” - I had decided I wouldn’t interfere and only wanted to see him as a friend. Cut to the next day - he was looking insanely gorgeous and attractive and I obviously felt a stirring in my heart whenever he was standing next to me. 

My friends saw the sexual tension between us and we were all buzzed. They cheered on us to kiss on a dare and we started making out, and now we are in a serious relationship and looking forward to marrying each other in a few years. 

Lmao I never thought I’d be the “other” woman. However he is the sweetest guy ever and before we officially went on our first date, he made sure to end things with the other girl. 

I know it probably hurt her but I would do it again if it means I have him all to myself.",1,0,0,0.5,0,,/r/TrueOffMyChest/comments/13t37f1/i_made_out_with_my_current_boyfriend_when_he_was/,False,False
162,TrueOffMyChest,2023-05-27 09:42:08,One-Letterhead-58,I am sad I didnt finish High School,"I was forced to drop out at 15, by my father. I got my GED, I thought I was okay with it. But now ever since the people my age started graduating my heart hurts. I see posts of them at prom, of them at their graduations, photos of them saying goodbye to their teachers talking about how much they meant to them and it fucking sucks. I didnt get to go to prom, hell even before I dropped out I had never been to a school dance. Now I will never get that chance. All those memories everyone got to make at school I missed out on. High School is supposed to be the best time of a teenagers life and I missed it all. I know its not my fault, I had no choice but damn it, it fucking hurts. I dont really know how to not feel this way, I wish I could just shut it all out.",2,2,2,1.0,0,,/r/TrueOffMyChest/comments/13t34du/i_am_sad_i_didnt_finish_high_school/,False,False
163,TrueOffMyChest,2023-05-27 09:33:05,nothxdood,Coworker called me ugly,"Not sure why. I'm about average as far as looks go. 

She's going through some stuff so I suspect it has more to do with her feelings about herself - either that or she's got a big gay crush on me and isn't ready to deal with it so instead wanted to insult me, either that or she's jealous.

Maybe I was too nice to her (she didn't have food and I gave her some, twice, and I helped train her in when she was new and gave her advice about some life stuff) and she resents me for it so now she's being mean? I don't know. I've heard her on the phone at work insulting boyfriends / potential boyfriends so it seems to just be her personality. I regret putting in so much effort to help her out now though and I will probably be keeping more of a distance in the future.",2,3,3,1.0,0,,/r/TrueOffMyChest/comments/13t2z53/coworker_called_me_ugly/,False,False
164,TrueOffMyChest,2023-05-27 09:27:54,Throwaway-exfriend65,I want an ex friend come back.,"*english isnt my first language so i’m sorry if i worded some stuff wrong*

me(16F) and a close friend of mine(16F) had a big fight about a month ago. It was me who started it because almost our entire friendship she doesn’t text me or talk to me unless i talk to her first, i’ve brought it up twice before we had the fight, i’m not the only one she fought with or had a problem with, alot of her friends also have a problem with that i think.
we would go days without speaking if i don’t reach out first. and if i do, she would take hours to an entire day to respond with a one word message, 2 words if im lucky. 
A mutual friend of ours is on my side, telling me i should ignore her because she’s being incredibly weird and she doesn’t know how to act, the said mutual friend also says that she always texts her, its what convinced me i was being ignored.
After that i started ignoring her. I wouldn’t talk to her or look at her and it lasted for about 2 weeks, and in those 2 weeks she never talked to me in person or online. I blocked her on insta and she never noticed, and there were two instances where she saw me and turned the other way.
Two days before the fight she came up to me and hugged me out of nowhere, telling me that she dreamed that i talked to her, that she wanted to talk but can’t think of anything to say and that she’d speak to me after the weekend in school, the school day came up and she didn’t come to me at all.
in the fight i asked why she never speaks to me and that i always reach out first and that we’ve talked about this before. She says that shes always tired and that she has problems at home, ok understandable. I said that if she had just told me we wouldnt have these problems. She then says that she doesn’t have to tell me, and says that she’s fought with other people about this issue and that the ones who understand, understand. And the ones who don’t can fuck off.
Now every now and then she gives me looks and thats all. she would text my best friend saying that she wants to talk to me but she doesn’t. Just a few days ago she texted my best friend again saying she wants to make up, and that she can’t bring herself to talk to me when she looks at me. My best friend tells her again that im ignoring her because of how hurt i was.
i don’t want to be the one who reaches out, i’m always the one who texts first or reaches out. I don’t know what to do anymore. I don’t even know WHY i want her to come back after this entire mess",0,1,1,0.99,0,,/r/TrueOffMyChest/comments/13t2w20/i_want_an_ex_friend_come_back/,False,False
165,TrueOffMyChest,2023-05-27 09:17:29,battleshipfued,Saw something unsettling today,"Okay so I can't sleep and this has thrown me off all day. Was going to get groceries with my husband, as we are walking to the car in our complex we were approching the stairs we saw a young sister (maybe about 5) and her younger brother (about 2) climbing the stairs together. Something looked very off and as we were getting closer we realized the boy had no underwear or pants on. He was fully exposed and his sister was trying to take him somewhere. My first thought was what the hell? These kids must me lost, why isn't the child wearing anything outside of the house? Why are they alone?

I immediately stopped, asked my husband to go to the car and wait for me while i ask the sister where her parents are and where her apt is so I can escort these kids to privacy. She did not speak English but pointed at her brother and said his name. She wearing traditional clothing. For context I live in the USA and there is a good amount of immigrants in our complex but I had a hunch these kids were from Afghanistan because of their clothing and names, I'm middle eastern and tried saying Arabic words but she didn't understand either. I noticed the apartment they wanted to go to has a huge Afghanistan flag in one of the rooms that I glimsped one day roaming around. The sister seemed pleased to talk to me but we couldn't communicate. The boy seemed distracted and started going down the opposite way and they both looked away and I immediately went down stairs and found their mother. 

Their mother was in traditional clothing, fully covered, and couldn't speak English, I asked if she was from Afghanistan and she nodded, she was smiling and looking extremely weird and soulless. At that point I assumed she was a refugee. She was roaming around far away from her kids and seemed like she gave zero shits when I brought up that her son is naked and he needs to wear something and it's not safe for a child to be like that in public. After a while the Convo was going nowhere and I felt unsettled cos she wasn't doing anything and I made the choice to leave her be. 

I have never seen something like this before, I live in a very hot state during the summer and even then I've never seen a very young child a exposed in such a way IN PUBLIC while people walk around the complex midday, anyone can see him and his mom didn't care. It made me think something deeply wrong is happening in their household and that poor child has no sense of privacy. The mother was fully covered but didn't bother to cover her kid?? Is this shit common in afghan culture? Have u ever seen something like this? I felt so horrible for that kid and I felt like I should have done more but I was honestly too shaken and I did what I could. I don't have kids but I care a lot about child safety and this disturbed me given how many messed up people are out there.",8,6,6,1.0,0,,/r/TrueOffMyChest/comments/13t2q4r/saw_something_unsettling_today/,False,False
