index,subreddit,post_time,user_name,title,text,num_comments,score,ups,upvote_ratio,downs,likes,URL,over18,ASD
244,TrueOffMyChest,2023-04-23 23:10:05,thefrustratedpoet,How did nobody know I’m autistic?,"*edited the date of diagnosis… it definitely wasn’t 2032!* 

I (38f) was diagnosed with ADHD in 2021 at the age of 35. Since I got medicated, I have absolutely spiralled. I think that the ADHD was masking something deeper. I think I’m autistic. I’ve been looking through old photos, and remembering things - meltdown, shutdowns. 

I literally found a photo of myself on prom night doing t-Rex arms and looking like I had learned to smile from watching other people.

I remember my dad telling me not to smile in photos because I used to look like a clown when I smiled. I was terrible at friendship, still am, and I have never been able to manage well on my own. 

I’m sensitive, feel too much, have had lifelong gut issues, and struggle with task initiation, task switching, change. I’m in complete burnout.

Looking back on my life, I cannot fathom that anybody thought I was normal. And now I’m nearly 40 and exhausted and struggling, and unable to pursue a diagnosis, and scared that I’m just going to be broken for the rest of my life.

I can’t speak to anybody in my life about it because I just made ADHD my entire personality for 2 years. I can’t bring ANOTHER thing to my support circle. 

I’m so sad and tired and guilty and full of shame and regret. I didn’t even look for autism because of internalised ableism. And now I just get to live as an alien for the rest of my life. 

Self-diagnosis is valid, but all I can think is that a formal diagnosis would open up support.",8,25,25,0.88,0,,/r/TrueOffMyChest/comments/12wtxgv/how_did_nobody_know_im_autistic/,False,True
454,TrueOffMyChest,2023-02-25 10:07:09,SpicyRamen5193,Humans being humans moment,"Today at work, I was looking around for my last cart of freight to work and I find it down one of my aisles with shower displays half worked. I went down there thinking my manager was working them but as I get around one of the displays, I see my coworker in one of the displays looking at the inside from the inside. I walk up and jokingly say ""Taking a shower, huh?"" and he, probably not seeing me walk up, is a bit startled but chuckles back and confirms. One of few silly little moments where I think humans are just silly little creatures and it made my day a bit better :)",0,2,2,0.75,0,,/r/TrueOffMyChest/comments/11bhj1e/humans_being_humans_moment/,False,True
464,TrueOffMyChest,2022-11-01 04:24:29,SpicyRamen5193,I was reminded why I don't go to church,"So this is just a vent post of sorts so it's not going to be long.

I was reminded about a time at church where they were looking for people to run the electronics booth at church like the presentation slides and lights and what not. I signed up and I went to the first ""training"" and it was going fine til we got to the actual booth where I was told to sit to the side. I didn't argue and I thought nothing of it. I thought we were going to take turns fiddling with the light settings and what not, but then I was never called up. I think I just ended up leaving early because they never had me go up and sho me how to work everything like they did everyone else. I was the only girl and everyone else was around my age so it wasn't because I was too young. It just felt very judgemental too for the fact it seemed like they didn't think I could learn everything they were talking about.",0,2,2,0.75,0,,/r/TrueOffMyChest/comments/yiynl0/i_was_reminded_why_i_dont_go_to_church/,False,True
467,TrueOffMyChest,2022-06-23 14:58:59,SpicyRamen5193,My parents probably think I'm an unloving near failure of a kid,"I (19F) haven't said 'I love you' very often since about middle school and have a minimal relationship with my parents that I won't get too into here. I used to be an amazing student who would get A's and B's in school. I struggled mentally but I still made it. High school hit and my grades began to drop a bit. I wasn't entirely concerned but my parents were, moreso over my grades than why the grades fell; I think they assume I was lazy, which I won't deny, I was to a degree. Around junior year I met a guy (23M) online and we hit it off. Everything was fine up until mistakes were made and our relationship turned sour, which also had an impact on my mental health. I will dive more into that relationship with the guy more in another post that I'd like to write. My grades began to fall due to this toxic relationship and my parents were angry. I was dating an older guy online who still lived with his parents, my grades had tanked, and I did nothing other than what I was required to do (go to school and go to work). Then covid hit and everything just increasingly got worse. Some days I would eat nothing and do nothing. I would watch anime instead of work on school. I had no energy to really do anything. My parents tried multiple times and different ways to separate me from my now ex because they knew some of my struggle was because of him, but I found ways around that. Everything just got worse and worse and it really divided me and my parents. I hated that they hated my then bf and pulled myself away from them. Fast forward to January 2021, I have decided to go to therapy because I believed I was a problem to everyone. My then bf breaks up with me because he can't handle the massive depression and insecurities he's caused me. I in turn want to commit as I felt I had nothing else to live for, he and the toxic relationship we had was all that kept me going at that point. My parents slowly figure this out and try to support me, but they don't understand that therapy isn't going to fix me immediately. I couldn't handle all the regular stressors of life and I especially couldn't handle my parents constantly nitpicking my therapist and my school work when I just wanted to die. So I moved out for a month to my friend's house across the street. This really broke my mom because I didn't tell them all what happened leading up to this, as I wasn't ready and I was still extremely angry at what they said and did while I was in this relationship. I feel very bad that I left my mom feeling like this was their fault and I regret not telling them but I plan to. My friend was my shoulder to cry on during this period and really helped stand my ground while I was going through all of this. I slowly got better and was able to pull my grades up by my bootstraps just enough to graduate. Now, I'd talked to my parents about the plan after I graduated and I was told that I would have a place to stay until I could get back on my feet mentally and financially. They at least understood that I was not ok mentally, until they didn't. After I graduated in May and moved back in, they had told me that I had until July to figure out a place to live and a job to support it. I was dumbfounded, not only had they gone back on their word but I would not have the same luxury as my 3 siblings of being able to save money and learn good spending habits before going out on my own. I felt blindsided. Luckily they told me they'd give me my mom's old car for transport if I graduated and my dad ended up allowing me to move into one of his rental properties and be one of his tenants. Still, these were big steps for me to take after being extremely depressed for god knows how long.

About a year has passed and I'm doing ok mentally and I'm in a much healthier relationship with my current bf (22M) and we are living together. He's a smoker and sometimes I feel like my parents judge me for the type of people I end up falling for. We make just enough to make ends meet but neither of us will likely pursue higher education or, at least at the moment, make much more than what we are now, especially with inflation taking over. I am the least successful out of all their children and I don't know if I will ever make more than any of them.

TLDR: I got into a toxic relationship, got the big sad, grades tanked, parents offered help and then revoked it, but now I'm better in a healthier relationship with a smoker, but really only living paycheck to paycheck while my siblings are much more successful than me and I feel like my parents are disappointed in me because of all that.

P.S. Don't tell me that I'm still young and can change my life around, I've heard it too many times and with inflation, it might actually be impossible to do very much. I am also trying to make amends with my parents.",0,0,0,0.5,0,,/r/TrueOffMyChest/comments/viyvyf/my_parents_probably_think_im_an_unloving_near/,False,True
469,TrueOffMyChest,2022-06-08 14:10:49,SpicyRamen5193,I wish I was my parent's biological kid,"I (19F) am adopted from China. I've grown up in a relatively normal household and feel I was treated the same as my older siblings. I never felt like they prioritized me or gave me less attention and I was fine. I've gone through phases knowing I'm adopted, missing my bio mom and wondering why I was given up. I have come to terms with the fact I may never meet her or know why she gave me up a long time ago, but it doesn't cure my feelings of abandonment or attachment issues I have now. I've never behaved the same as the rest of my family, as I believe I am neurodivergent while they are not, and it's caused multiple misunderstandings between us. I love them but I am not attached to them like that; like if they died, I probably wouldn't cry. I wish I had that connection with all of them like a close knit family has. Sometimes I feel so alienated from them all, like I'm looking in at their life thru a window, especially when looking at very old family photos. I was with my family and extended family while looking at the family photo album and I just felt left out because I'm not their flesh and blood. I just wish I was. I would've felt normal.",5,4,4,0.76,0,,/r/TrueOffMyChest/comments/v7qk5u/i_wish_i_was_my_parents_biological_kid/,False,True
1974,TrueOffMyChest,2023-02-06 05:19:40,introvertedfreak21,A funeral made me realize things I missed out on,"Tldr: I was at a funeral for my late uncle, and listening to voice-mails others have of him made me realize that I don't even remember my mom's voice or face.

So, this was a couple of years ago, it's just something that comes to mind now and again.

I'd like to say I wasn't close with this family member, he was my stepmother's brother. He had a lot of issues from an accident when he was young. He had seizures to a point that a good chunk of his brain was removed to help control them. He wasn't in a good way for a long time as he just couldn't get freedom from his family. If more detail is wanted, I'm okay providing it but this isn't really about him. He did commit suicide one night and wasn't found till the morning. Understandably, everyone was upset. I wasn't close to him but I still felt he didn't deserve to go out that way.

Well, his funeral comes. He was cremated and put in a vault with other ashes in these glass boxes that also had his picture and a few of his things. I remember this well as everyone talked about how they loved him, told stories of him, and then my stepmom played a voice-mail he left for her. That's when this feeling struck me. I had none of that with my own mom. She passed away when I was 18, I'm now 25. I wasn't close with her because she was an addict and neglected me a lot when I was young before my dad got custody. However, I still loved her, she was my mom no matter. I feel guilt for thinking about her during that funeral. I have barely any photos of her, no old voice mails. Just a few letters that read like the ramblings of a mad woman. I wish I had more than that, stuff of hers before she was too far gone. All of her things is with my half sister but I refuse to speak with her. She is an addict as well and believes my dad brainwashed me against them and that one day I'll just return when I'm free of him. She also thinks my mom's death wasn't an accidental overdose and said to me ""She just missed her baby so much"" the day I visited after her death. That still hurts to remember, no one ever wants to believe they are the reason their parent died. My dad told me she has had at least 7 overdoses and this one just happened to be fatal.

I just wanted that off my chest. Maybe there are other people who could understand this feeling of disconnect but the disgust for that half too.",1,3,3,0.8,0,,/r/TrueOffMyChest/comments/10uyhy1/a_funeral_made_me_realize_things_i_missed_out_on/,False,True
2319,TrueOffMyChest,2021-07-22 18:26:10,linguisticshead,The Autism Community is not inclusive and it is not a community.,"For a bit of context – I am clinically diagnosed with autism and recently I received a ton of hate on social media for sharing some views on the autism diagnosis criteria. It seems as if people forget that having difficulties communicating is a part of being on the spectrum and you are not allowed to complain how fucking hard this is sometimes.

Autistic people with less communication skills are left out of the community. Autistic people who are nonverbal are often not given a chance to participate in a group. I have been trying to make friends in the autistic community for a long time but all I feel is that I don't belong there and that these are not my people and not the kind of activism I want to join. 

Besides trying to interact all the time with autistics on social media, the only time I was able to get their attention was by sharing on my private account an opinion that was slightly different than theirs. I got tons of hate while autistic people are legally being electrocuted in order to change their behaviour!!! I got tons of hate for sharing that I don't mind wearing the puzzle piece symbol while we are still being denied accommodations in Schools and Universities. Why isn't anybody talking about this? Why is it that the autistic community will only interact with me when I say something they don't 100% agree with, even when I am just a University student who has absolutely NO power on how the world views autism? When I am not fucking defending eugenics y'all.

Autistic people with less communication skills are left out of this community all the time, including me. Autistic people who don't agree 100% with other autistics opinions' are left out, are given hate and being ""cancelled"". Autistic people who have more difficulty with communication are not seen on social media, are not included in the groups. Because as much as we try, the autism community is only truly opened for people who can hold a conversation, for people who can share their views on things in a great way and for people who can seem more neurotypical. 

The Autism Community is not a Community. This makes me sad and upset. If this text is confusing, I am sorry, as I said, communication is hard for me and I am just truly upset with the realisation that even autistic people are not always inclusive, are not always accepting. You need to do better, we need to do better. You need to support people with less verbal skills like me and people who have more difficulty maintaining friendships like me. This is sad.",19,80,80,0.94,0,,/r/TrueOffMyChest/comments/opjupa/the_autism_community_is_not_inclusive_and_it_is/,False,True
151,TrueOffMyChest,2023-05-27 11:03:12,tangled_slinkyxx,Found out my colleague gets paid 4K a year more than I did doing the same job,"Not much else to say really, I was doing her role untill the beginning of the year and thought I got a promotion because my wage increased from 22K to 25K, but she earns more than I do now doing my old role. I am in the UK.

My work discourages talking about wage and now I know why, it's all I can think about, I love my new role but I'm not paid what I am worth and I don't want to quit. I had always suspected that I was paid less than I should be, because of my anxiety disorder they know I would take anything but to have it confirmed hurts and I just don't know what to do.

I can't bring it up with my manager as I shouldn't have asked Harriet her wage, and will probably get in trouble so my anxiety is keeping my month shut

*Sigh* ignorance truly is bliss. I was so happy with the pay rise until now",0,1,1,1.0,0,,/r/TrueOffMyChest/comments/13t4go7/found_out_my_colleague_gets_paid_4k_a_year_more/,False,False
152,TrueOffMyChest,2023-05-27 10:57:35,Mediocre-Bug293,I 19M am hopelessly in love with my ex 19F(part one),"As the title says I am hopelessly in love with my ex will will call E (names are changed for privacy), but to understand everything in its entirety we are gonna have to go back a few years to when I was in 8th grade, I was in a relationship with this girl we will call M. M and I were each others first of everything, and I mean everything, in 8th grade around 2017 she was bored of the relationship with me and got with one of my friends now we will call C and that was that for us, she will come back later in the story. 

After 2 years in 2019 I finally trusted again and had fell with this girl we will call L. Now at the beginning of the relationship with L, I was very immature and cheated on her once and she held it over my head for a long time although she forgave because she loved me. She had been embedded in every family cookout and event and the family loved her and her did I. Eventually it got to the point we had both our families at our house with my pops on the grill. Eventually, me being the dumb freshman I was had had enough with a stable relationship and had tried to end things with L. L did not take this lightly, as she had told my whole family and hers that I had been a manipulative and would mentally abuse her and as expected she begged for me to forgive her after I had lost everyone’s trust but I just told her to get out my face. (I have never talked to her again but she still hangs out with my little sister). 

Now at this point 2019-2020 my family had all shunned me and I spent the whole time alone in my room or at my job on some sort of pill or drink plus I was always high at all times. There was times the loneliness almost got to me but I prevailed and in the end my baby brother was the only one who believed me which I will never forget.",1,0,0,0.5,0,,/r/TrueOffMyChest/comments/13t4d0g/i_19m_am_hopelessly_in_love_with_my_ex_19fpart_one/,False,False
153,TrueOffMyChest,2023-05-27 10:52:31,radiofej,I feel like i let my bf down and now im crying.,"Sorry if my english isn't correct, it's not my native language. Also sorry if this sounds dumb, I'm just a silly teenager with silly life problems like this one.
Me and my bf have been planning to go to the cinema for some time now, to watch the spider verse on june 2nd.
Now, there wouldn't have been any difficulties, but yesterday, I told my parents I would be going to the cimena and they said i can't.
I got super upset and asked why, and they told me that their godson (6 M) will be graduating from kindergarten on that day and i can't go. I was visibly upset, but didn't say anything just went to my room and texted my bf that i can't go because of the kid.
I feel so stupid for not asking earlier if i could go, and had to let him down like this. 
And i know we can go later, but i feel even more upset, because before we got together, a year ago he asked me out on a date but i friendzoned him, and now, even tho we're together i feel like i let him down the same way, because finally after such a long time, and after i realized my mistakes we started dating. And him asking if we could go to the cinema after all that made me feel so good, but i had to let him down again. I feel so stupid. Idk what to do. I know we could go later, but i still feel so dumb, since we would have to wait another week for it, and it wouldn't have happened if i just asked earlier. I feel like i let him down the same way i did last year and i feel so guilty for it. 
I love him so much and i don't even know what to do right now to make it up for him, even tho i know he probably isn't that mad or upset like i am. Ugh i feel so bad I've been crying all day. What do i do?!?!?",1,1,1,0.66,0,,/r/TrueOffMyChest/comments/13t49yv/i_feel_like_i_let_my_bf_down_and_now_im_crying/,False,False
154,TrueOffMyChest,2023-05-27 10:39:12,Own-Arm318,I’m a 15m I don’t know what to do about my parents separation,"I’m a 15y male who has been in the middle of my parents divorce. I’ve been having problems with how I feel about both of them but mostly of my father. Me and him have some tension between us because of how different we like to spend are time.  The main concern right now is about my dog who my parents have been having problems over. the main problem happened 3 hours ago at 11:00pm me and my sibling 19y sis 17y sis  and 13 y brother and mom are going on a trip to go to my mom’s side of the family trip together. The problem is that we needed to drop off the dog at my dads because that was the plan all along and my dad knew or should have known that. Unfortunately my dad refused the dog coming over which I did not know this until I was at his house with my dog. He start yelling saying not to bring the dog in the house and saying to leave with the dog now.(my mom drove me over and was in the car) he started filming the interaction for some reason and I was being told by my mom to get in the car and just leave my dog ( ember ) outside (because my dad was outside) and leave. But I was scared because I think he might have just left her out their if just left and we live near a road that cars go fast on so if she got hit she would probably die. He told be “ if you leave her here  then we will have some major issues.” I was crying at this point (I’m pretty sensitive and don’t like getting yelled at) and I was just begging my mom to just take the dog home and just see if we can find someone but my mom said no finally she relented and called my sister boyfriend to ask if he could watch ember and he said yes. On the way home I was bawling my eyes out and I was mad at both of my parents for me being in the middle alone in this just thinking that if I choose one Side I will ruin the other relationship. It currently 3 am I. The morning and I have a flight at 5am i just don’t know what to think right now and need some outside input.   

Idk if this fits on this Reddit page but idk where else to put it

This is my first post on Reddit and I’m tired as hell right now so pls don’t judge me on my spelling or grammar errors",0,1,1,1.0,0,,/r/TrueOffMyChest/comments/13t421l/im_a_15m_i_dont_know_what_to_do_about_my_parents/,False,False
155,TrueOffMyChest,2023-05-27 10:38:31,JaredBaca206,I took a “heroic dose” of mushrooms and it changed my life.,"A couple of months ago I was in the worst place of my life. I was drinking every day and night and digging myself a deeper and deeper hole into addiction. I dabbled in magic mushrooms a little bit before in my life and one night I figured I’d try doing some alone. Boyyyy, I ended up having a bad trip ( and at the time I thought) the worst night of my life. I went on this weird psychedelic journey through my own head and I told myself things like “I wasn’t worth anything “ or I “don’t deserve happiness”. I thought I saw God and angels and demons… and I’m not religious. This lasted for seven hours and I thought that it was just a bad trip, but afterwards I felt extremely different. It was like my whole mindset on life changed overnight. I began slowing down my drinking, and I stopped smoking as much weed. I started applying myself more at work. I began looking deep into myself and I was actually able to commit for the very first time in my life to my general well-being and happiness. I can dream again, and I have a clear head now. I can actually take a look at myself and see what I am. 

Now I’m not saying “Everybody should go out and eat too many mushrooms!”, but I do feel like it opened a whole new door in my life. I’m happy again. I don’t drink. I don’t smoke marijuana. I stopped worrying so much about my recent breakup. I’m currently in the best place in my life. I don’t attribute it all to that one night, but I swear that my mindset changed for the better, and that’s what is important. Thanks for letting me share Reddit. I could be wrong, but I just wanted to get this off my chest.",1,1,1,0.67,0,,/r/TrueOffMyChest/comments/13t41oi/i_took_a_heroic_dose_of_mushrooms_and_it_changed/,True,False
